[I 2025-05-09 12:53:23,439] Trial 99 finished with value: 0.6931560483845798 and parameters: {'lr': 0.00014069823413482126, 'weight_decay': 0.009868130173079743, 'optimizer': 'RMSprop', 'dropout_rate': 0.35644249444338755}. Best is trial 64 with value: 0.5315759723836725.
Epoch 8 — Train Loss: 0.6323 — Val Loss: 0.6185
Epoch 9 — Train Loss: 0.6364 — Val Loss: 0.6130
Epoch 10 — Train Loss: 0.6216 — Val Loss: 0.6174
Epoch 11 — Train Loss: 0.6221 — Val Loss: 0.6141
Epoch 12 — Train Loss: 0.6168 — Val Loss: 0.6023
Epoch 13 — Train Loss: 0.6093 — Val Loss: 0.6010
Epoch 14 — Train Loss: 0.6051 — Val Loss: 0.6028
Epoch 15 — Train Loss: 0.5925 — Val Loss: 0.5912
Epoch 16 — Train Loss: 0.5886 — Val Loss: 0.5852
Epoch 17 — Train Loss: 0.5826 — Val Loss: 0.5936
Epoch 18 — Train Loss: 0.5704 — Val Loss: 0.5807
Epoch 19 — Train Loss: 0.5618 — Val Loss: 0.5827
Epoch 20 — Train Loss: 0.5548 — Val Loss: 0.5794
Epoch 21 — Train Loss: 0.5438 — Val Loss: 0.5743
Epoch 22 — Train Loss: 0.5317 — Val Loss: 0.5732
Epoch 23 — Train Loss: 0.5194 — Val Loss: 0.5615
Epoch 24 — Train Loss: 0.5109 — Val Loss: 0.5540
Epoch 25 — Train Loss: 0.4810 — Val Loss: 0.5633
Epoch 26 — Train Loss: 0.4814 — Val Loss: 0.5506
Epoch 27 — Train Loss: 0.4674 — Val Loss: 0.5411
Epoch 28 — Train Loss: 0.4574 — Val Loss: 0.5320
Epoch 29 — Train Loss: 0.4320 — Val Loss: 0.5442
Epoch 30 — Train Loss: 0.4124 — Val Loss: 0.5297
Epoch 31 — Train Loss: 0.3952 — Val Loss: 0.5366
Epoch 32 — Train Loss: 0.3930 — Val Loss: 0.5399
Epoch 33 — Train Loss: 0.3717 — Val Loss: 0.5233
Epoch 34 — Train Loss: 0.3594 — Val Loss: 0.5301
Epoch 35 — Train Loss: 0.3419 — Val Loss: 0.5324
Epoch 36 — Train Loss: 0.3223 — Val Loss: 0.5760
Epoch 37 — Train Loss: 0.3283 — Val Loss: 0.5402
Epoch 38 — Train Loss: 0.3086 — Val Loss: 0.5685
Epoch 39 — Train Loss: 0.2861 — Val Loss: 0.5631
Epoch 40 — Train Loss: 0.2744 — Val Loss: 0.5502
Epoch 41 — Train Loss: 0.2537 — Val Loss: 0.5413
Epoch 42 — Train Loss: 0.2430 — Val Loss: 0.5425
Epoch 43 — Train Loss: 0.2334 — Val Loss: 0.5593
Early stopping.
Epoch 1 — Train Loss: 0.6832 — Val Loss: 0.6731
Epoch 2 — Train Loss: 0.6754 — Val Loss: 0.6507
Epoch 3 — Train Loss: 0.6599 — Val Loss: 0.6326
Epoch 4 — Train Loss: 0.6509 — Val Loss: 0.6326
Epoch 5 — Train Loss: 0.6520 — Val Loss: 0.6312
Epoch 6 — Train Loss: 0.6368 — Val Loss: 0.6261
Epoch 7 — Train Loss: 0.6381 — Val Loss: 0.6170
Epoch 8 — Train Loss: 0.6339 — Val Loss: 0.6160
Epoch 9 — Train Loss: 0.6140 — Val Loss: 0.6031
Epoch 10 — Train Loss: 0.6077 — Val Loss: 0.5908
Epoch 11 — Train Loss: 0.5914 — Val Loss: 0.5786
Epoch 12 — Train Loss: 0.5859 — Val Loss: 0.5838
Epoch 13 — Train Loss: 0.5720 — Val Loss: 0.5701
Epoch 14 — Train Loss: 0.5510 — Val Loss: 0.5541
Epoch 15 — Train Loss: 0.5454 — Val Loss: 0.5580
Epoch 16 — Train Loss: 0.5225 — Val Loss: 0.5668
Epoch 17 — Train Loss: 0.5088 — Val Loss: 0.5767
Epoch 18 — Train Loss: 0.4734 — Val Loss: 0.5947
Epoch 19 — Train Loss: 0.4553 — Val Loss: 0.5397
Epoch 20 — Train Loss: 0.4253 — Val Loss: 0.5879
Epoch 21 — Train Loss: 0.4212 — Val Loss: 0.5583
Epoch 22 — Train Loss: 0.3897 — Val Loss: 0.5439
Epoch 23 — Train Loss: 0.3643 — Val Loss: 0.5733
Epoch 24 — Train Loss: 0.3455 — Val Loss: 0.5626
Epoch 25 — Train Loss: 0.3331 — Val Loss: 0.5415
Epoch 26 — Train Loss: 0.2997 — Val Loss: 0.5689
Epoch 27 — Train Loss: 0.2869 — Val Loss: 0.5439
Epoch 28 — Train Loss: 0.2791 — Val Loss: 0.5554
Epoch 29 — Train Loss: 0.2580 — Val Loss: 0.5635
Early stopping.
Epoch 1 — Train Loss: 0.6886 — Val Loss: 0.6820
Epoch 2 — Train Loss: 0.6777 — Val Loss: 0.6517
Epoch 3 — Train Loss: 0.6621 — Val Loss: 0.6501
Epoch 4 — Train Loss: 0.6528 — Val Loss: 0.6419
Epoch 5 — Train Loss: 0.6511 — Val Loss: 0.6275
Epoch 6 — Train Loss: 0.6449 — Val Loss: 0.6375
Epoch 7 — Train Loss: 0.6356 — Val Loss: 0.6323
Epoch 8 — Train Loss: 0.6335 — Val Loss: 0.6095
Epoch 9 — Train Loss: 0.6332 — Val Loss: 0.6054
Epoch 10 — Train Loss: 0.6234 — Val Loss: 0.6108
Epoch 11 — Train Loss: 0.6185 — Val Loss: 0.6134
Epoch 12 — Train Loss: 0.6147 — Val Loss: 0.6159
Epoch 13 — Train Loss: 0.6097 — Val Loss: 0.6093
Epoch 14 — Train Loss: 0.6034 — Val Loss: 0.5990
Epoch 15 — Train Loss: 0.5947 — Val Loss: 0.5931
Epoch 16 — Train Loss: 0.5824 — Val Loss: 0.5840
Epoch 17 — Train Loss: 0.5829 — Val Loss: 0.6070
Epoch 18 — Train Loss: 0.5632 — Val Loss: 0.5857
Epoch 19 — Train Loss: 0.5694 — Val Loss: 0.5822
Epoch 20 — Train Loss: 0.5414 — Val Loss: 0.5790
Epoch 21 — Train Loss: 0.5323 — Val Loss: 0.5637
Epoch 22 — Train Loss: 0.5232 — Val Loss: 0.5990
Epoch 23 — Train Loss: 0.5119 — Val Loss: 0.5854
Epoch 24 — Train Loss: 0.4926 — Val Loss: 0.5778
Epoch 25 — Train Loss: 0.4765 — Val Loss: 0.5761
Epoch 26 — Train Loss: 0.4678 — Val Loss: 0.5834
Epoch 27 — Train Loss: 0.4562 — Val Loss: 0.5412
Epoch 28 — Train Loss: 0.4290 — Val Loss: 0.5311
Epoch 29 — Train Loss: 0.4064 — Val Loss: 0.5586
Epoch 30 — Train Loss: 0.3892 — Val Loss: 0.5597
Epoch 31 — Train Loss: 0.3761 — Val Loss: 0.5710
Epoch 32 — Train Loss: 0.3614 — Val Loss: 0.5720
Epoch 33 — Train Loss: 0.3409 — Val Loss: 0.5596
Epoch 34 — Train Loss: 0.3377 — Val Loss: 0.5680
Epoch 35 — Train Loss: 0.2964 — Val Loss: 0.5486
Epoch 36 — Train Loss: 0.3023 — Val Loss: 0.5765
Epoch 37 — Train Loss: 0.2789 — Val Loss: 0.5641
Epoch 38 — Train Loss: 0.2554 — Val Loss: 0.5656
Early stopping.
Epoch 1 — Train Loss: 0.6775 — Val Loss: 0.6664
Epoch 2 — Train Loss: 0.6671 — Val Loss: 0.6332
Epoch 3 — Train Loss: 0.6565 — Val Loss: 0.6187
Epoch 4 — Train Loss: 0.6492 — Val Loss: 0.6200
Epoch 5 — Train Loss: 0.6446 — Val Loss: 0.6325
Epoch 6 — Train Loss: 0.6273 — Val Loss: 0.6297
Epoch 7 — Train Loss: 0.6344 — Val Loss: 0.6056
Epoch 8 — Train Loss: 0.6374 — Val Loss: 0.6133
Epoch 9 — Train Loss: 0.6220 — Val Loss: 0.6088
Epoch 10 — Train Loss: 0.6065 — Val Loss: 0.6002
Epoch 11 — Train Loss: 0.5991 — Val Loss: 0.5961
Epoch 12 — Train Loss: 0.5719 — Val Loss: 0.5982
Epoch 13 — Train Loss: 0.5667 — Val Loss: 0.5617
Epoch 14 — Train Loss: 0.5538 — Val Loss: 0.5819
Epoch 15 — Train Loss: 0.5282 — Val Loss: 0.5530
Epoch 16 — Train Loss: 0.5201 — Val Loss: 0.5640
Epoch 17 — Train Loss: 0.4888 — Val Loss: 0.5786
Epoch 18 — Train Loss: 0.4811 — Val Loss: 0.5718
Epoch 19 — Train Loss: 0.4388 — Val Loss: 0.5641
Epoch 20 — Train Loss: 0.4181 — Val Loss: 0.5509
Epoch 21 — Train Loss: 0.3806 — Val Loss: 0.5786
Epoch 22 — Train Loss: 0.3579 — Val Loss: 0.5701
Epoch 23 — Train Loss: 0.3430 — Val Loss: 0.5860
Epoch 24 — Train Loss: 0.3121 — Val Loss: 0.5680
Epoch 25 — Train Loss: 0.2881 — Val Loss: 0.5757
Epoch 26 — Train Loss: 0.2638 — Val Loss: 0.5817
Epoch 27 — Train Loss: 0.2574 — Val Loss: 0.5960
Epoch 28 — Train Loss: 0.2362 — Val Loss: 0.6107
Epoch 29 — Train Loss: 0.2088 — Val Loss: 0.5871
Epoch 30 — Train Loss: 0.2013 — Val Loss: 0.5947
Early stopping.
Epoch 1 — Train Loss: 0.6926 — Val Loss: 0.6894
Epoch 2 — Train Loss: 0.6869 — Val Loss: 0.6698
Epoch 3 — Train Loss: 0.6719 — Val Loss: 0.6556
Epoch 4 — Train Loss: 0.6621 — Val Loss: 0.6456
Epoch 5 — Train Loss: 0.6528 — Val Loss: 0.6452
Epoch 6 — Train Loss: 0.6561 — Val Loss: 0.6360
Epoch 7 — Train Loss: 0.6518 — Val Loss: 0.6440
Epoch 8 — Train Loss: 0.6455 — Val Loss: 0.6307
Epoch 9 — Train Loss: 0.6364 — Val Loss: 0.6202
Epoch 10 — Train Loss: 0.6337 — Val Loss: 0.6160
Epoch 11 — Train Loss: 0.6349 — Val Loss: 0.6189
Epoch 12 — Train Loss: 0.6303 — Val Loss: 0.6253
Epoch 13 — Train Loss: 0.6303 — Val Loss: 0.6130
Epoch 14 — Train Loss: 0.6241 — Val Loss: 0.6023
Epoch 15 — Train Loss: 0.6206 — Val Loss: 0.6148
Epoch 16 — Train Loss: 0.6147 — Val Loss: 0.6203
Epoch 17 — Train Loss: 0.6105 — Val Loss: 0.5999
Epoch 18 — Train Loss: 0.5989 — Val Loss: 0.5905
Epoch 19 — Train Loss: 0.5914 — Val Loss: 0.5929
Epoch 20 — Train Loss: 0.5925 — Val Loss: 0.5858
Epoch 21 — Train Loss: 0.5854 — Val Loss: 0.5780
Epoch 22 — Train Loss: 0.5783 — Val Loss: 0.6023
Epoch 23 — Train Loss: 0.5789 — Val Loss: 0.5801
Epoch 24 — Train Loss: 0.5767 — Val Loss: 0.5970
Epoch 25 — Train Loss: 0.5661 — Val Loss: 0.5787
Epoch 26 — Train Loss: 0.5496 — Val Loss: 0.5838
Epoch 27 — Train Loss: 0.5397 — Val Loss: 0.5569
Epoch 28 — Train Loss: 0.5341 — Val Loss: 0.5754
Epoch 29 — Train Loss: 0.5230 — Val Loss: 0.5708
Epoch 30 — Train Loss: 0.5139 — Val Loss: 0.6077
Epoch 31 — Train Loss: 0.5047 — Val Loss: 0.5714
Epoch 32 — Train Loss: 0.4920 — Val Loss: 0.5524
Epoch 33 — Train Loss: 0.4752 — Val Loss: 0.5569
Epoch 34 — Train Loss: 0.4573 — Val Loss: 0.5678
Epoch 35 — Train Loss: 0.4455 — Val Loss: 0.5503
Epoch 36 — Train Loss: 0.4420 — Val Loss: 0.5395
Epoch 37 — Train Loss: 0.4257 — Val Loss: 0.5585
Epoch 38 — Train Loss: 0.4147 — Val Loss: 0.5596
Epoch 39 — Train Loss: 0.4027 — Val Loss: 0.5530
Epoch 40 — Train Loss: 0.3869 — Val Loss: 0.5690
Epoch 41 — Train Loss: 0.3722 — Val Loss: 0.5685
Epoch 42 — Train Loss: 0.3500 — Val Loss: 0.6152
Epoch 43 — Train Loss: 0.3399 — Val Loss: 0.5486
Epoch 44 — Train Loss: 0.3193 — Val Loss: 0.5529
Epoch 45 — Train Loss: 0.3195 — Val Loss: 0.5564
Epoch 46 — Train Loss: 0.3020 — Val Loss: 0.5454
Early stopping.
Epoch 1 — Train Loss: 0.6926 — Val Loss: 0.6898
Epoch 2 — Train Loss: 0.6770 — Val Loss: 0.6566
Epoch 3 — Train Loss: 0.6712 — Val Loss: 0.6547
Epoch 4 — Train Loss: 0.6518 — Val Loss: 0.6473
Epoch 5 — Train Loss: 0.6626 — Val Loss: 0.6434
Epoch 6 — Train Loss: 0.6535 — Val Loss: 0.6436
Epoch 7 — Train Loss: 0.6454 — Val Loss: 0.6335
Epoch 8 — Train Loss: 0.6448 — Val Loss: 0.6253
Epoch 9 — Train Loss: 0.6388 — Val Loss: 0.6219
Epoch 10 — Train Loss: 0.6327 — Val Loss: 0.6109
Epoch 11 — Train Loss: 0.6367 — Val Loss: 0.6144
Epoch 12 — Train Loss: 0.6294 — Val Loss: 0.6236
Epoch 13 — Train Loss: 0.6271 — Val Loss: 0.6152
Epoch 14 — Train Loss: 0.6233 — Val Loss: 0.6036
Epoch 15 — Train Loss: 0.6136 — Val Loss: 0.5981
Epoch 16 — Train Loss: 0.6078 — Val Loss: 0.5823
Epoch 17 — Train Loss: 0.6028 — Val Loss: 0.6000
Epoch 18 — Train Loss: 0.5841 — Val Loss: 0.5910
Epoch 19 — Train Loss: 0.5826 — Val Loss: 0.5907
Epoch 20 — Train Loss: 0.5705 — Val Loss: 0.5729
Epoch 21 — Train Loss: 0.5653 — Val Loss: 0.5728
Epoch 22 — Train Loss: 0.5498 — Val Loss: 0.5517
Epoch 23 — Train Loss: 0.5364 — Val Loss: 0.5807
Epoch 24 — Train Loss: 0.5204 — Val Loss: 0.5637
Epoch 25 — Train Loss: 0.4973 — Val Loss: 0.5570
Epoch 26 — Train Loss: 0.4926 — Val Loss: 0.5677
Epoch 27 — Train Loss: 0.4863 — Val Loss: 0.5582
Epoch 28 — Train Loss: 0.4660 — Val Loss: 0.5475
Epoch 29 — Train Loss: 0.4453 — Val Loss: 0.5525
Epoch 30 — Train Loss: 0.4292 — Val Loss: 0.5623
Epoch 31 — Train Loss: 0.4190 — Val Loss: 0.5588
Epoch 32 — Train Loss: 0.3990 — Val Loss: 0.5524
Epoch 33 — Train Loss: 0.3858 — Val Loss: 0.5505
Epoch 34 — Train Loss: 0.3716 — Val Loss: 0.5729
Epoch 35 — Train Loss: 0.3499 — Val Loss: 0.5559
Epoch 36 — Train Loss: 0.3631 — Val Loss: 0.5403
Epoch 37 — Train Loss: 0.3339 — Val Loss: 0.5969
Epoch 38 — Train Loss: 0.3227 — Val Loss: 0.5656
Epoch 39 — Train Loss: 0.3070 — Val Loss: 0.5895
Epoch 40 — Train Loss: 0.2806 — Val Loss: 0.5468
Epoch 41 — Train Loss: 0.2694 — Val Loss: 0.5744
Epoch 42 — Train Loss: 0.2539 — Val Loss: 0.5680
Epoch 43 — Train Loss: 0.2531 — Val Loss: 0.5724
Epoch 44 — Train Loss: 0.2510 — Val Loss: 0.5778
Epoch 45 — Train Loss: 0.2309 — Val Loss: 0.5948
Epoch 46 — Train Loss: 0.2361 — Val Loss: 0.5815
Early stopping.
Epoch 1 — Train Loss: 0.6897 — Val Loss: 0.6722
Epoch 2 — Train Loss: 0.6752 — Val Loss: 0.6667
Epoch 3 — Train Loss: 0.6652 — Val Loss: 0.6584
Epoch 4 — Train Loss: 0.6587 — Val Loss: 0.6317
Epoch 5 — Train Loss: 0.6581 — Val Loss: 0.6282
Epoch 6 — Train Loss: 0.6535 — Val Loss: 0.6281
Epoch 7 — Train Loss: 0.6375 — Val Loss: 0.6271
Epoch 8 — Train Loss: 0.6351 — Val Loss: 0.6110
Epoch 9 — Train Loss: 0.6259 — Val Loss: 0.5982
Epoch 10 — Train Loss: 0.6190 — Val Loss: 0.6037
Epoch 11 — Train Loss: 0.6204 — Val Loss: 0.6058
Epoch 12 — Train Loss: 0.6108 — Val Loss: 0.6051
Epoch 13 — Train Loss: 0.6139 — Val Loss: 0.5983
Epoch 14 — Train Loss: 0.5980 — Val Loss: 0.5860
Epoch 15 — Train Loss: 0.5956 — Val Loss: 0.5876
Epoch 16 — Train Loss: 0.5795 — Val Loss: 0.5703
Epoch 17 — Train Loss: 0.5780 — Val Loss: 0.5787
Epoch 18 — Train Loss: 0.5675 — Val Loss: 0.5685
Epoch 19 — Train Loss: 0.5579 — Val Loss: 0.5883
Epoch 20 — Train Loss: 0.5442 — Val Loss: 0.5471
Epoch 21 — Train Loss: 0.5272 — Val Loss: 0.5577
Epoch 22 — Train Loss: 0.5215 — Val Loss: 0.5469
Epoch 23 — Train Loss: 0.5108 — Val Loss: 0.5722
Epoch 24 — Train Loss: 0.5082 — Val Loss: 0.5834
Epoch 25 — Train Loss: 0.4967 — Val Loss: 0.5584
Epoch 26 — Train Loss: 0.4793 — Val Loss: 0.5329
Epoch 27 — Train Loss: 0.4586 — Val Loss: 0.5868
Epoch 28 — Train Loss: 0.4519 — Val Loss: 0.5745
Epoch 29 — Train Loss: 0.4282 — Val Loss: 0.5507
Epoch 30 — Train Loss: 0.4105 — Val Loss: 0.5459
Epoch 31 — Train Loss: 0.3930 — Val Loss: 0.5748
Epoch 32 — Train Loss: 0.3996 — Val Loss: 0.5718
Epoch 33 — Train Loss: 0.3657 — Val Loss: 0.5594
Epoch 34 — Train Loss: 0.3632 — Val Loss: 0.5431
Epoch 35 — Train Loss: 0.3437 — Val Loss: 0.5537
Epoch 36 — Train Loss: 0.3365 — Val Loss: 0.5487
Early stopping.
Epoch 1 — Train Loss: 0.6903 — Val Loss: 0.6621
Epoch 2 — Train Loss: 0.6910 — Val Loss: 0.6782
Epoch 3 — Train Loss: 0.6805 — Val Loss: 0.6635
Epoch 4 — Train Loss: 0.6688 — Val Loss: 0.6613
Epoch 5 — Train Loss: 0.6671 — Val Loss: 0.6581
Epoch 6 — Train Loss: 0.6590 — Val Loss: 0.6403
Epoch 7 — Train Loss: 0.6498 — Val Loss: 0.6280
Epoch 8 — Train Loss: 0.6479 — Val Loss: 0.6258
Epoch 9 — Train Loss: 0.6351 — Val Loss: 0.6224
Epoch 10 — Train Loss: 0.6389 — Val Loss: 0.6232
Epoch 11 — Train Loss: 0.6324 — Val Loss: 0.6144
Epoch 12 — Train Loss: 0.6284 — Val Loss: 0.6128
Epoch 13 — Train Loss: 0.6250 — Val Loss: 0.6170
Epoch 14 — Train Loss: 0.6232 — Val Loss: 0.6016
Epoch 15 — Train Loss: 0.6170 — Val Loss: 0.5969
Epoch 16 — Train Loss: 0.6152 — Val Loss: 0.5915
Epoch 17 — Train Loss: 0.5999 — Val Loss: 0.5975
Epoch 18 — Train Loss: 0.6024 — Val Loss: 0.5974
Epoch 19 — Train Loss: 0.5902 — Val Loss: 0.5853
Epoch 20 — Train Loss: 0.5852 — Val Loss: 0.5816
Epoch 21 — Train Loss: 0.5856 — Val Loss: 0.5868
Epoch 22 — Train Loss: 0.5688 — Val Loss: 0.5663
Epoch 23 — Train Loss: 0.5626 — Val Loss: 0.5861
Epoch 24 — Train Loss: 0.5573 — Val Loss: 0.5687
Epoch 25 — Train Loss: 0.5453 — Val Loss: 0.6030
Epoch 26 — Train Loss: 0.5364 — Val Loss: 0.5759
Epoch 27 — Train Loss: 0.5258 — Val Loss: 0.5613
Epoch 28 — Train Loss: 0.5150 — Val Loss: 0.5984
Epoch 29 — Train Loss: 0.5054 — Val Loss: 0.5816
Epoch 30 — Train Loss: 0.4841 — Val Loss: 0.5713
Epoch 31 — Train Loss: 0.4653 — Val Loss: 0.5463
Epoch 32 — Train Loss: 0.4713 — Val Loss: 0.5497
Epoch 33 — Train Loss: 0.4544 — Val Loss: 0.5485
Epoch 34 — Train Loss: 0.4377 — Val Loss: 0.5473
Epoch 35 — Train Loss: 0.4245 — Val Loss: 0.6153
Epoch 36 — Train Loss: 0.4147 — Val Loss: 0.5618
Epoch 37 — Train Loss: 0.3848 — Val Loss: 0.5484
Epoch 38 — Train Loss: 0.3840 — Val Loss: 0.5799
Epoch 39 — Train Loss: 0.3446 — Val Loss: 0.5721
Epoch 40 — Train Loss: 0.3479 — Val Loss: 0.6177
Epoch 41 — Train Loss: 0.3314 — Val Loss: 0.5527
Early stopping.
Epoch 1 — Train Loss: 0.6938 — Val Loss: 0.6928
Epoch 2 — Train Loss: 0.6931 — Val Loss: 0.6921
Epoch 3 — Train Loss: 0.6980 — Val Loss: 0.6930
Epoch 4 — Train Loss: 0.6941 — Val Loss: 0.6928
Epoch 5 — Train Loss: 0.6931 — Val Loss: 0.6923
Epoch 6 — Train Loss: 0.6928 — Val Loss: 0.6889
Epoch 7 — Train Loss: 0.6859 — Val Loss: 0.6804
Epoch 8 — Train Loss: 0.6787 — Val Loss: 0.6550
Epoch 9 — Train Loss: 0.6719 — Val Loss: 0.6488
Epoch 10 — Train Loss: 0.6620 — Val Loss: 0.6462
Epoch 11 — Train Loss: 0.6604 — Val Loss: 0.6478
Epoch 12 — Train Loss: 0.6551 — Val Loss: 0.6503
Epoch 13 — Train Loss: 0.6548 — Val Loss: 0.6364
Epoch 14 — Train Loss: 0.6493 — Val Loss: 0.6287
Epoch 15 — Train Loss: 0.6364 — Val Loss: 0.6286
Epoch 16 — Train Loss: 0.6403 — Val Loss: 0.6198
Epoch 17 — Train Loss: 0.6396 — Val Loss: 0.6071
Epoch 18 — Train Loss: 0.6269 — Val Loss: 0.5962
Epoch 19 — Train Loss: 0.6322 — Val Loss: 0.6060
Epoch 20 — Train Loss: 0.6234 — Val Loss: 0.6008
Epoch 21 — Train Loss: 0.6155 — Val Loss: 0.6084
Epoch 22 — Train Loss: 0.6111 — Val Loss: 0.5992
Epoch 23 — Train Loss: 0.6122 — Val Loss: 0.6082
Epoch 24 — Train Loss: 0.6018 — Val Loss: 0.5908
Epoch 25 — Train Loss: 0.6008 — Val Loss: 0.5947
Epoch 26 — Train Loss: 0.5897 — Val Loss: 0.5736
Epoch 27 — Train Loss: 0.5842 — Val Loss: 0.5907
Epoch 28 — Train Loss: 0.5795 — Val Loss: 0.5805
Epoch 29 — Train Loss: 0.5688 — Val Loss: 0.5894
Epoch 30 — Train Loss: 0.5727 — Val Loss: 0.5664
Epoch 31 — Train Loss: 0.5725 — Val Loss: 0.5634
Epoch 32 — Train Loss: 0.5597 — Val Loss: 0.6004
Epoch 33 — Train Loss: 0.5579 — Val Loss: 0.5610
Epoch 34 — Train Loss: 0.5347 — Val Loss: 0.5904
Epoch 35 — Train Loss: 0.5355 — Val Loss: 0.5947
Epoch 36 — Train Loss: 0.5308 — Val Loss: 0.5890
Epoch 37 — Train Loss: 0.5176 — Val Loss: 0.5662
Epoch 38 — Train Loss: 0.4957 — Val Loss: 0.5765
Epoch 39 — Train Loss: 0.5098 — Val Loss: 0.5645
Epoch 40 — Train Loss: 0.4797 — Val Loss: 0.5566
Epoch 41 — Train Loss: 0.4852 — Val Loss: 0.5669
Epoch 42 — Train Loss: 0.4691 — Val Loss: 0.5611
Epoch 43 — Train Loss: 0.4605 — Val Loss: 0.5884
Epoch 44 — Train Loss: 0.4480 — Val Loss: 0.5628
Epoch 45 — Train Loss: 0.4329 — Val Loss: 0.5791
Epoch 46 — Train Loss: 0.4198 — Val Loss: 0.5607
Epoch 47 — Train Loss: 0.4127 — Val Loss: 0.5637
Epoch 48 — Train Loss: 0.3817 — Val Loss: 0.5668
Epoch 49 — Train Loss: 0.3767 — Val Loss: 0.5794
Epoch 50 — Train Loss: 0.3615 — Val Loss: 0.5950
Early stopping.
Epoch 1 — Train Loss: 0.6948 — Val Loss: 0.6929
Epoch 2 — Train Loss: 0.6911 — Val Loss: 0.6848
Epoch 3 — Train Loss: 0.6857 — Val Loss: 0.6603
Epoch 4 — Train Loss: 0.6821 — Val Loss: 0.6558
Epoch 5 — Train Loss: 0.6738 — Val Loss: 0.6524
Epoch 6 — Train Loss: 0.6655 — Val Loss: 0.6599
Epoch 7 — Train Loss: 0.6587 — Val Loss: 0.6372
Epoch 8 — Train Loss: 0.6526 — Val Loss: 0.6326
Epoch 9 — Train Loss: 0.6489 — Val Loss: 0.6315
Epoch 10 — Train Loss: 0.6355 — Val Loss: 0.6338
Epoch 11 — Train Loss: 0.6302 — Val Loss: 0.6212
Epoch 12 — Train Loss: 0.6256 — Val Loss: 0.6155
Epoch 13 — Train Loss: 0.6224 — Val Loss: 0.6053
Epoch 14 — Train Loss: 0.6179 — Val Loss: 0.6016
Epoch 15 — Train Loss: 0.6157 — Val Loss: 0.5940
Epoch 16 — Train Loss: 0.6010 — Val Loss: 0.6032
Epoch 17 — Train Loss: 0.5928 — Val Loss: 0.6153
Epoch 18 — Train Loss: 0.5947 — Val Loss: 0.5874
Epoch 19 — Train Loss: 0.5884 — Val Loss: 0.5857
Epoch 20 — Train Loss: 0.5743 — Val Loss: 0.5983
Epoch 21 — Train Loss: 0.5659 — Val Loss: 0.5906
Epoch 22 — Train Loss: 0.5517 — Val Loss: 0.5885
Epoch 23 — Train Loss: 0.5466 — Val Loss: 0.5861
Epoch 24 — Train Loss: 0.5350 — Val Loss: 0.5547
Epoch 25 — Train Loss: 0.5198 — Val Loss: 0.5445
Epoch 26 — Train Loss: 0.5122 — Val Loss: 0.5700
Epoch 27 — Train Loss: 0.4829 — Val Loss: 0.6035
Epoch 28 — Train Loss: 0.4823 — Val Loss: 0.5598
Epoch 29 — Train Loss: 0.4683 — Val Loss: 0.5624
Epoch 30 — Train Loss: 0.4572 — Val Loss: 0.5452
Epoch 31 — Train Loss: 0.4361 — Val Loss: 0.5475
Epoch 32 — Train Loss: 0.4144 — Val Loss: 0.5531
Epoch 33 — Train Loss: 0.3943 — Val Loss: 0.5721
Epoch 34 — Train Loss: 0.3907 — Val Loss: 0.5521
Epoch 35 — Train Loss: 0.3654 — Val Loss: 0.5487
Early stopping.
Epoch 1 — Train Loss: 0.6995 — Val Loss: 0.6914
Epoch 2 — Train Loss: 0.6909 — Val Loss: 0.6814
Epoch 3 — Train Loss: 0.6767 — Val Loss: 0.6500
Epoch 4 — Train Loss: 0.6662 — Val Loss: 0.6434
Epoch 5 — Train Loss: 0.6630 — Val Loss: 0.6417
Epoch 6 — Train Loss: 0.6553 — Val Loss: 0.6353
Epoch 7 — Train Loss: 0.6472 — Val Loss: 0.6408
Epoch 8 — Train Loss: 0.6475 — Val Loss: 0.6243
Epoch 9 — Train Loss: 0.6415 — Val Loss: 0.6223
Epoch 10 — Train Loss: 0.6352 — Val Loss: 0.6144
Epoch 11 — Train Loss: 0.6268 — Val Loss: 0.6095
Epoch 12 — Train Loss: 0.6250 — Val Loss: 0.6040
Epoch 13 — Train Loss: 0.6186 — Val Loss: 0.5961
Epoch 14 — Train Loss: 0.6095 — Val Loss: 0.6180
Epoch 15 — Train Loss: 0.6108 — Val Loss: 0.5922
Epoch 16 — Train Loss: 0.5911 — Val Loss: 0.5931
Epoch 17 — Train Loss: 0.5892 — Val Loss: 0.5968
Epoch 18 — Train Loss: 0.5824 — Val Loss: 0.5797
Epoch 19 — Train Loss: 0.5672 — Val Loss: 0.5733
Epoch 20 — Train Loss: 0.5774 — Val Loss: 0.5684
Epoch 21 — Train Loss: 0.5603 — Val Loss: 0.5786
Epoch 22 — Train Loss: 0.5522 — Val Loss: 0.5778
Epoch 23 — Train Loss: 0.5302 — Val Loss: 0.5692
Epoch 24 — Train Loss: 0.5382 — Val Loss: 0.5606
Epoch 25 — Train Loss: 0.5213 — Val Loss: 0.5609
Epoch 26 — Train Loss: 0.5102 — Val Loss: 0.5609
Epoch 27 — Train Loss: 0.4992 — Val Loss: 0.5486
Epoch 28 — Train Loss: 0.4951 — Val Loss: 0.5542
Epoch 29 — Train Loss: 0.4690 — Val Loss: 0.6014
Epoch 30 — Train Loss: 0.4518 — Val Loss: 0.5524
Epoch 31 — Train Loss: 0.4366 — Val Loss: 0.5422
Epoch 32 — Train Loss: 0.4296 — Val Loss: 0.6476
Epoch 33 — Train Loss: 0.4104 — Val Loss: 0.5506
Epoch 34 — Train Loss: 0.3909 — Val Loss: 0.5515
Epoch 35 — Train Loss: 0.3791 — Val Loss: 0.5790
Epoch 36 — Train Loss: 0.3540 — Val Loss: 0.5820
Epoch 37 — Train Loss: 0.3311 — Val Loss: 0.5433
Epoch 38 — Train Loss: 0.3162 — Val Loss: 0.5479
Epoch 39 — Train Loss: 0.3033 — Val Loss: 0.5824
Epoch 40 — Train Loss: 0.2955 — Val Loss: 0.5331
Epoch 41 — Train Loss: 0.2691 — Val Loss: 0.5507
Epoch 42 — Train Loss: 0.2646 — Val Loss: 0.5757
Epoch 43 — Train Loss: 0.2297 — Val Loss: 0.5771
Epoch 44 — Train Loss: 0.2360 — Val Loss: 0.5821
Epoch 45 — Train Loss: 0.2524 — Val Loss: 0.6077
Epoch 46 — Train Loss: 0.2178 — Val Loss: 0.5871
Epoch 47 — Train Loss: 0.2025 — Val Loss: 0.5764
Epoch 48 — Train Loss: 0.1929 — Val Loss: 0.7201
Epoch 49 — Train Loss: 0.1660 — Val Loss: 0.6142
Epoch 50 — Train Loss: 0.1774 — Val Loss: 0.6241
Early stopping.
Epoch 1 — Train Loss: 0.6871 — Val Loss: 0.6721
Epoch 2 — Train Loss: 0.6728 — Val Loss: 0.6531
Epoch 3 — Train Loss: 0.6639 — Val Loss: 0.6419
Epoch 4 — Train Loss: 0.6575 — Val Loss: 0.6418
Epoch 5 — Train Loss: 0.6547 — Val Los