[I 2025-05-10 16:27:08,539] Trial 19 finished with value: 0.6424550901759755 and parameters: {'lr': 0.0001452025139988039, 'weight_decay': 0.00024003688152646636, 'optimizer': 'AdamW', 'dropout_rate': 0.4318073065192887}. Best is trial 16 with value: 0.5663253502412275.
[I 2025-05-10 16:35:01,461] Trial 20 finished with value: 0.584672043540261 and parameters: {'lr': 1.1056030729802826e-05, 'weight_decay': 0.0018181052301489812, 'optimizer': 'Adam', 'dropout_rate': 0.3192518105447764}. Best is trial 16 with value: 0.5663253502412275.
[I 2025-05-10 16:42:38,003] Trial 21 finished with value: 0.6386685783212835 and parameters: {'lr': 4.6626316847886406e-05, 'weight_decay': 0.000475529686837328, 'optimizer': 'Adam', 'dropout_rate': 0.4521898626001319}. Best is trial 16 with value: 0.5663253502412275.
[I 2025-05-10 16:50:36,268] Trial 22 finished with value: 0.5705080639232288 and parameters: {'lr': 3.053618081595004e-05, 'weight_decay': 0.001210738673370098, 'optimizer': 'Adam', 'dropout_rate': 0.4686629977503682}. Best is trial 16 with value: 0.5663253502412275.
[I 2025-05-10 16:57:57,117] Trial 23 finished with value: 0.5507980888540095 and parameters: {'lr': 2.7371881034300182e-05, 'weight_decay': 0.004788056111674968, 'optimizer': 'Adam', 'dropout_rate': 0.4482958352032707}. Best is trial 23 with value: 0.5507980888540095.
[I 2025-05-10 17:06:35,362] Trial 24 finished with value: 0.5569961168549278 and parameters: {'lr': 6.314129939952004e-05, 'weight_decay': 0.005165726095241227, 'optimizer': 'Adam', 'dropout_rate': 0.39151900007520596}. Best is trial 23 with value: 0.5507980888540095.
[I 2025-05-10 17:15:31,724] Trial 25 finished with value: 0.5676856409419667 and parameters: {'lr': 8.779073665533983e-05, 'weight_decay': 0.005162355638267714, 'optimizer': 'Adam', 'dropout_rate': 0.3851581445608028}. Best is trial 23 with value: 0.5507980888540095.
[I 2025-05-10 17:25:29,281] Trial 26 finished with value: 0.5343664689497514 and parameters: {'lr': 0.00022464196855043374, 'weight_decay': 0.0062398539519617465, 'optimizer': 'Adam', 'dropout_rate': 0.3339944605059354}. Best is trial 26 with value: 0.5343664689497514.
[I 2025-05-10 17:28:24,169] Trial 27 finished with value: 0.6931502537293868 and parameters: {'lr': 0.0007124784354923011, 'weight_decay': 0.008477250932017366, 'optimizer': 'Adam', 'dropout_rate': 0.3359059374820256}. Best is trial 26 with value: 0.5343664689497514.
[I 2025-05-10 17:38:33,861] Trial 28 finished with value: 0.5618868350982666 and parameters: {'lr': 0.00032341413612399495, 'weight_decay': 0.0040528673440617825, 'optimizer': 'Adam', 'dropout_rate': 0.278230830195901}. Best is trial 26 with value: 0.5343664689497514.
[I 2025-05-10 17:51:53,296] Trial 29 finished with value: 0.6110292586413297 and parameters: {'lr': 0.00018132016055857122, 'weight_decay': 0.008108933266070033, 'optimizer': 'Adam', 'dropout_rate': 0.18698878310846012}. Best is trial 26 with value: 0.5343664689497514.
[I 2025-05-10 18:05:00,913] Trial 30 finished with value: 0.5598437591032548 and parameters: {'lr': 9.987532291508199e-05, 'weight_decay': 0.009296788009687177, 'optimizer': 'Adam', 'dropout_rate': 0.23494758049360345}. Best is trial 26 with value: 0.5343664689497514.
[I 2025-05-10 18:16:16,642] Trial 31 finished with value: 0.5791813005100597 and parameters: {'lr': 8.977454260833761e-05, 'weight_decay': 0.009565421308265622, 'optimizer': 'Adam', 'dropout_rate': 0.2403227805275146}. Best is trial 26 with value: 0.5343664689497514.
[I 2025-05-10 18:24:22,516] Trial 32 finished with value: 0.5386740901253441 and parameters: {'lr': 0.0003216684033442311, 'weight_decay': 0.004525278995067163, 'optimizer': 'Adam', 'dropout_rate': 0.16444413287599682}. Best is trial 26 with value: 0.5343664689497514.
[I 2025-05-10 18:32:47,153] Trial 33 finished with value: 0.5817664504051209 and parameters: {'lr': 0.00038989671707083574, 'weight_decay': 0.004503162575299738, 'optimizer': 'Adam', 'dropout_rate': 0.08017211225666739}. Best is trial 26 with value: 0.5343664689497514.
[I 2025-05-10 18:38:35,996] Trial 34 finished with value: 0.6374548196792602 and parameters: {'lr': 0.00023925059311997313, 'weight_decay': 0.0003667038412584224, 'optimizer': 'Adam', 'dropout_rate': 0.15465885972257115}. Best is trial 26 with value: 0.5343664689497514.
[I 2025-05-10 18:41:32,806] Trial 35 finished with value: 0.6904318473555825 and parameters: {'lr': 0.0009197696818823769, 'weight_decay': 0.002322200238286057, 'optimizer': 'Adam', 'dropout_rate': 0.04738626147224928}. Best is trial 26 with value: 0.5343664689497514.
[I 2025-05-10 18:46:48,908] Trial 36 finished with value: 0.6337823824449019 and parameters: {'lr': 0.0001385496385035241, 'weight_decay': 7.246715716400651e-05, 'optimizer': 'Adam', 'dropout_rate': 0.39443128774459024}. Best is trial 26 with value: 0.5343664689497514.
[I 2025-05-10 18:50:00,180] Trial 37 finished with value: 0.6780714902010831 and parameters: {'lr': 0.00048198035585445725, 'weight_decay': 0.001280303142008966, 'optimizer': 'AdamW', 'dropout_rate': 0.34752630693464465}. Best is trial 26 with value: 0.5343664689497514.
[I 2025-05-10 18:55:15,419] Trial 38 finished with value: 0.6102306777780706 and parameters: {'lr': 6.147129724524295e-05, 'weight_decay': 2.3546011867767685e-05, 'optimizer': 'Adam', 'dropout_rate': 0.29866044976578254}. Best is trial 26 with value: 0.5343664689497514.
[I 2025-05-10 19:42:34,054] Trial 39 finished with value: 0.6930017926476219 and parameters: {'lr': 0.00026177917262111983, 'weight_decay': 3.0783446760764177e-06, 'optimizer': 'SGD', 'dropout_rate': 0.19835200751513835}. Best is trial 26 with value: 0.5343664689497514.
[I 2025-05-10 19:47:13,319] Trial 40 finished with value: 0.6010024352507157 and parameters: {'lr': 0.00012709022371834835, 'weight_decay': 0.005556406191979697, 'optimizer': 'AdamW', 'dropout_rate': 0.32167009795961515}. Best is trial 26 with value: 0.5343664689497514.
[I 2025-05-10 19:58:48,353] Trial 41 finished with value: 0.5569236386906017 and parameters: {'lr': 6.738517712988989e-05, 'weight_decay': 0.009975149562687037, 'optimizer': 'Adam', 'dropout_rate': 0.22668109115446194}. Best is trial 26 with value: 0.5343664689497514.
[I 2025-05-10 20:07:03,674] Trial 42 finished with value: 0.5448371150276877 and parameters: {'lr': 5.735642294075476e-05, 'weight_decay': 0.0034234091872926095, 'optimizer': 'Adam', 'dropout_rate': 0.1655063380437659}. Best is trial 26 with value: 0.5343664689497514.
[I 2025-05-10 20:17:37,766] Trial 43 finished with value: 0.5828997416929765 and parameters: {'lr': 2.4195817345748254e-05, 'weight_decay': 0.003194305753194647, 'optimizer': 'Adam', 'dropout_rate': 0.17008924157864833}. Best is trial 26 with value: 0.5343664689497514.
[I 2025-05-10 20:26:55,568] Trial 44 finished with value: 0.5653762730685148 and parameters: {'lr': 4.682919587739848e-05, 'weight_decay': 0.0035474837688442367, 'optimizer': 'Adam', 'dropout_rate': 0.1379257734063581}. Best is trial 26 with value: 0.5343664689497514.
[I 2025-05-10 21:14:01,557] Trial 45 finished with value: 0.6931742462244901 and parameters: {'lr': 9.423025849266688e-06, 'weight_decay': 0.006256200699245264, 'optimizer': 'SGD', 'dropout_rate': 0.21431657635854312}. Best is trial 26 with value: 0.5343664689497514.
[I 2025-05-10 21:20:10,334] Trial 46 finished with value: 0.5552536444230514 and parameters: {'lr': 3.0198651684339682e-05, 'weight_decay': 0.0014858177976622758, 'optimizer': 'Adam', 'dropout_rate': 0.2709922914941658}. Best is trial 26 with value: 0.5343664689497514.
