[I 2025-05-10 21:37:55,504] Trial 48 finished with value: 0.6209388624538075 and parameters: {'lr': 5.0142312249853695e-06, 'weight_decay': 0.001959871278305814, 'optimizer': 'RMSprop', 'dropout_rate': 0.11019210714399694}. Best is trial 26 with value: 0.5343664689497514.
[I 2025-05-10 21:47:05,531] Trial 49 finished with value: 0.5891288757324219 and parameters: {'lr': 6.896058053143418e-06, 'weight_decay': 0.0015907131969684436, 'optimizer': 'Adam', 'dropout_rate': 0.1780149327225749}. Best is trial 26 with value: 0.5343664689497514.
[I 2025-05-10 22:33:00,873] Trial 50 finished with value: 0.6931337887590582 and parameters: {'lr': 1.366666092313939e-05, 'weight_decay': 0.0028579875637675363, 'optimizer': 'SGD', 'dropout_rate': 0.2931435963264975}. Best is trial 26 with value: 0.5343664689497514.
[I 2025-05-10 22:41:08,216] Trial 51 finished with value: 0.5728134469552474 and parameters: {'lr': 6.355050018067124e-05, 'weight_decay': 0.006101583923829673, 'optimizer': 'Adam', 'dropout_rate': 0.21938925843365592}. Best is trial 26 with value: 0.5343664689497514.
[I 2025-05-10 22:50:15,211] Trial 52 finished with value: 0.5723985281857578 and parameters: {'lr': 3.9842257859710454e-05, 'weight_decay': 0.003859882511229308, 'optimizer': 'Adam', 'dropout_rate': 0.2518672698740446}. Best is trial 26 with value: 0.5343664689497514.
[I 2025-05-10 22:58:41,841] Trial 53 finished with value: 0.5611524018374356 and parameters: {'lr': 2.1024416654011396e-05, 'weight_decay': 0.007135607565687105, 'optimizer': 'Adam', 'dropout_rate': 0.14905879786888152}. Best is trial 26 with value: 0.5343664689497514.
[I 2025-05-10 23:07:08,177] Trial 54 finished with value: 0.5773279721086676 and parameters: {'lr': 1.581188467748376e-05, 'weight_decay': 0.009769586509845845, 'optimizer': 'Adam', 'dropout_rate': 0.11373712664867751}. Best is trial 26 with value: 0.5343664689497514.
[I 2025-05-10 23:13:07,140] Trial 55 finished with value: 0.5747723189267245 and parameters: {'lr': 0.00018077526065614103, 'weight_decay': 0.0008768011503523121, 'optimizer': 'Adam', 'dropout_rate': 0.28294508182529005}. Best is trial 26 with value: 0.5343664689497514.
[I 2025-05-10 23:20:21,545] Trial 56 finished with value: 0.568996419689872 and parameters: {'lr': 2.6768109124291775e-05, 'weight_decay': 0.002209380058568845, 'optimizer': 'RMSprop', 'dropout_rate': 0.20723558107497653}. Best is trial 26 with value: 0.5343664689497514.
[I 2025-05-10 23:25:02,776] Trial 57 finished with value: 0.593190709027377 and parameters: {'lr': 7.722489262652024e-05, 'weight_decay': 0.004084246538502107, 'optimizer': 'AdamW', 'dropout_rate': 0.0879210246756667}. Best is trial 26 with value: 0.5343664689497514.
[I 2025-05-10 23:29:49,845] Trial 58 finished with value: 0.5738285433162342 and parameters: {'lr': 3.881828088068755e-05, 'weight_decay': 0.00012961338960308568, 'optimizer': 'Adam', 'dropout_rate': 0.23430488745455144}. Best is trial 26 with value: 0.5343664689497514.
[I 2025-05-10 23:37:42,178] Trial 59 finished with value: 0.5851997678930109 and parameters: {'lr': 0.00011750592497251901, 'weight_decay': 0.0027975841151033835, 'optimizer': 'Adam', 'dropout_rate': 0.17126474014479148}. Best is trial 26 with value: 0.5343664689497514.
[I 2025-05-10 23:42:27,501] Trial 60 finished with value: 0.5992512713779102 and parameters: {'lr': 5.0085765677619045e-05, 'weight_decay': 0.0005960809309791415, 'optimizer': 'Adam', 'dropout_rate': 0.2621885908778021}. Best is trial 26 with value: 0.5343664689497514.
[I 2025-05-10 23:51:22,395] Trial 61 finished with value: 0.6196727600964633 and parameters: {'lr': 6.939359971107586e-05, 'weight_decay': 0.006199780904846799, 'optimizer': 'Adam', 'dropout_rate': 0.3723507904404276}. Best is trial 26 with value: 0.5343664689497514.
[I 2025-05-11 00:00:48,335] Trial 62 finished with value: 0.5485712831670587 and parameters: {'lr': 0.00026375538342364284, 'weight_decay': 0.004518489689106264, 'optimizer': 'Adam', 'dropout_rate': 0.4021576119528346}. Best is trial 26 with value: 0.5343664689497514.
[I 2025-05-11 00:09:25,174] Trial 63 finished with value: 0.550667049668052 and parameters: {'lr': 0.000241953962253039, 'weight_decay': 0.0047067440769084125, 'optimizer': 'Adam', 'dropout_rate': 0.45202382014627207}. Best is trial 26 with value: 0.5343664689497514.
[I 2025-05-11 00:19:40,741] Trial 64 finished with value: 0.5739203734831376 and parameters: {'lr': 0.00041370534112166433, 'weight_decay': 0.004442821536937615, 'optimizer': 'Adam', 'dropout_rate': 0.47976510121461474}. Best is trial 26 with value: 0.5343664689497514.
[I 2025-05-11 00:29:30,951] Trial 65 finished with value: 0.5823299451307817 and parameters: {'lr': 0.0002748075946038168, 'weight_decay': 0.0016342379378921313, 'optimizer': 'Adam', 'dropout_rate': 0.44739200688468284}. Best is trial 26 with value: 0.5343664689497514.
[I 2025-05-11 00:33:18,516] Trial 66 finished with value: 0.679524407603524 and parameters: {'lr': 0.0006269973346669722, 'weight_decay': 0.0025218073367086454, 'optimizer': 'Adam', 'dropout_rate': 0.4196852134385333}. Best is trial 26 with value: 0.5343664689497514.
[I 2025-05-11 00:44:17,866] Trial 67 finished with value: 0.5824589924378829 and parameters: {'lr': 0.00018480608650758506, 'weight_decay': 0.001139876112065709, 'optimizer': 'RMSprop', 'dropout_rate': 0.43680199428678756}. Best is trial 26 with value: 0.5343664689497514.
[I 2025-05-11 00:57:30,707] Trial 68 finished with value: 0.5668761058287187 and parameters: {'lr': 0.00022321625435823878, 'weight_decay': 0.007102281929694996, 'optimizer': 'Adam', 'dropout_rate': 0.47197574670747316}. Best is trial 26 with value: 0.5343664689497514.
[I 2025-05-11 01:46:25,690] Trial 69 finished with value: 0.6929133816198869 and parameters: {'lr': 0.0004459339219685183, 'weight_decay': 0.0034139398821752334, 'optimizer': 'SGD', 'dropout_rate': 0.4037006183169374}. Best is trial 26 with value: 0.5343664689497514.
[I 2025-05-11 01:57:02,284] Trial 70 finished with value: 0.5800468455661427 and parameters: {'lr': 3.2291544535627147e-06, 'weight_decay': 0.004893369019187724, 'optimizer': 'Adam', 'dropout_rate': 0.3163019427168545}. Best is trial 26 with value: 0.5343664689497514.
[I 2025-05-11 02:04:58,281] Trial 71 finished with value: 0.565769245407798 and parameters: {'lr': 0.00033778536771290614, 'weight_decay': 0.006812857330805736, 'optimizer': 'Adam', 'dropout_rate': 0.4080682991646839}. Best is trial 26 with value: 0.5343664689497514.
[I 2025-05-11 02:09:07,491] Trial 72 finished with value: 0.5603216474706476 and parameters: {'lr': 0.00010234013535437852, 'weight_decay': 3.4213257154597644e-05, 'optimizer': 'Adam', 'dropout_rate': 0.4349161021387755}. Best is trial 26 with value: 0.5343664689497514.
[I 2025-05-11 02:21:27,915] Trial 73 finished with value: 0.5729046561501243 and parameters: {'lr': 0.0007887794978289178, 'weight_decay': 0.009889678033830245, 'optimizer': 'Adam', 'dropout_rate': 0.36135448170566686}. Best is trial 26 with value: 0.5343664689497514.
[I 2025-05-11 02:34:11,982] Trial 74 finished with value: 0.5861307935281234 and parameters: {'lr': 0.00015352941301705191, 'weight_decay': 0.004958186552054179, 'optimizer': 'Adam', 'dropout_rate': 0.48306014710317785}. Best is trial 26 with value: 0.5343664689497514.
[I 2025-05-11 02:38:23,350] Trial 75 finished with value: 0.6495402877981012 and parameters: {'lr': 0.00033830391731198427, 'weight_decay': 0.002207361446189144, 'optimizer': 'AdamW', 'dropout_rate': 0.4579639756328703}. Best is trial 26 with value: 0.5343664689497514.
