[I 2025-05-11 06:11:22,466] Trial 99 finished with value: 0.5557889363982461 and parameters: {'lr': 7.764180740556615e-05, 'weight_decay': 0.007256620158690501, 'optimizer': 'Adam', 'dropout_rate': 0.4778009656669415}. Best is trial 26 with value: 0.5343664689497514.
Epoch 5 — Train Loss: 0.5537 — Val Loss: 0.5481
Epoch 6 — Train Loss: 0.5039 — Val Loss: 0.5249
Epoch 7 — Train Loss: 0.4521 — Val Loss: 0.5463
Epoch 8 — Train Loss: 0.3945 — Val Loss: 0.5763
Epoch 9 — Train Loss: 0.3477 — Val Loss: 0.5813
Epoch 10 — Train Loss: 0.3076 — Val Loss: 0.5303
Epoch 11 — Train Loss: 0.2412 — Val Loss: 0.5519
Epoch 12 — Train Loss: 0.2110 — Val Loss: 0.5345
Epoch 13 — Train Loss: 0.1651 — Val Loss: 0.5602
Epoch 14 — Train Loss: 0.1274 — Val Loss: 0.5507
Epoch 15 — Train Loss: 0.1197 — Val Loss: 0.5447
Epoch 16 — Train Loss: 0.0985 — Val Loss: 0.5603
Early stopping.
Epoch 1 — Train Loss: 0.6893 — Val Loss: 0.6891
Epoch 2 — Train Loss: 0.6841 — Val Loss: 0.6919
Epoch 3 — Train Loss: 0.6900 — Val Loss: 0.6693
Epoch 4 — Train Loss: 0.6852 — Val Loss: 0.7004
Epoch 5 — Train Loss: 0.6801 — Val Loss: 0.6917
Epoch 6 — Train Loss: 0.6824 — Val Loss: 0.6630
Epoch 7 — Train Loss: 0.6728 — Val Loss: 0.6832
Epoch 8 — Train Loss: 0.6759 — Val Loss: 0.6802
Epoch 9 — Train Loss: 0.6806 — Val Loss: 0.6455
Epoch 10 — Train Loss: 0.6884 — Val Loss: 0.6811
Epoch 11 — Train Loss: 0.6803 — Val Loss: 0.6600
Epoch 12 — Train Loss: 0.6697 — Val Loss: 0.6968
Epoch 13 — Train Loss: 0.6714 — Val Loss: 0.6426
Epoch 14 — Train Loss: 0.6569 — Val Loss: 0.6271
Epoch 15 — Train Loss: 0.6542 — Val Loss: 0.6400
Epoch 16 — Train Loss: 0.6614 — Val Loss: 0.6330
Epoch 17 — Train Loss: 0.6449 — Val Loss: 0.6191
Epoch 18 — Train Loss: 0.6494 — Val Loss: 0.6340
Epoch 19 — Train Loss: 0.6473 — Val Loss: 0.6464
Epoch 20 — Train Loss: 0.6541 — Val Loss: 0.6223
Epoch 21 — Train Loss: 0.6484 — Val Loss: 0.6211
Epoch 22 — Train Loss: 0.6319 — Val Loss: 0.6188
Epoch 23 — Train Loss: 0.6285 — Val Loss: 0.6152
Epoch 24 — Train Loss: 0.6358 — Val Loss: 0.6025
Epoch 25 — Train Loss: 0.6282 — Val Loss: 0.5942
Epoch 26 — Train Loss: 0.6189 — Val Loss: 0.5959
Epoch 27 — Train Loss: 0.6202 — Val Loss: 0.5953
Epoch 28 — Train Loss: 0.6213 — Val Loss: 0.6015
Epoch 29 — Train Loss: 0.6268 — Val Loss: 0.6322
Epoch 30 — Train Loss: 0.6138 — Val Loss: 0.5977
Epoch 31 — Train Loss: 0.6127 — Val Loss: 0.5981
Epoch 32 — Train Loss: 0.6144 — Val Loss: 0.5697
Epoch 33 — Train Loss: 0.6000 — Val Loss: 0.5861
Epoch 34 — Train Loss: 0.6036 — Val Loss: 0.5777
Epoch 35 — Train Loss: 0.6008 — Val Loss: 0.5919
Epoch 36 — Train Loss: 0.5869 — Val Loss: 0.5986
Epoch 37 — Train Loss: 0.5877 — Val Loss: 0.5688
Epoch 38 — Train Loss: 0.5852 — Val Loss: 0.5857
Epoch 39 — Train Loss: 0.5777 — Val Loss: 0.5735
Epoch 40 — Train Loss: 0.5759 — Val Loss: 0.5802
Epoch 41 — Train Loss: 0.5710 — Val Loss: 0.5808
Epoch 42 — Train Loss: 0.5773 — Val Loss: 0.5883
Epoch 43 — Train Loss: 0.5785 — Val Loss: 0.5818
Epoch 44 — Train Loss: 0.5669 — Val Loss: 0.5719
Epoch 45 — Train Loss: 0.5650 — Val Loss: 0.5690
Epoch 46 — Train Loss: 0.5550 — Val Loss: 0.5779
Epoch 47 — Train Loss: 0.5578 — Val Loss: 0.5729
Early stopping.
Epoch 1 — Train Loss: 0.6805 — Val Loss: 0.6628
Epoch 2 — Train Loss: 0.6647 — Val Loss: 0.6395
Epoch 3 — Train Loss: 0.6481 — Val Loss: 0.6374
Epoch 4 — Train Loss: 0.6432 — Val Loss: 0.6401
Epoch 5 — Train Loss: 0.6340 — Val Loss: 0.5992
Epoch 6 — Train Loss: 0.6257 — Val Loss: 0.6046
Epoch 7 — Train Loss: 0.6174 — Val Loss: 0.6058
Epoch 8 — Train Loss: 0.6204 — Val Loss: 0.5984
Epoch 9 — Train Loss: 0.6063 — Val Loss: 0.6171
Epoch 10 — Train Loss: 0.5913 — Val Loss: 0.5992
Epoch 11 — Train Loss: 0.5960 — Val Loss: 0.5996
Epoch 12 — Train Loss: 0.5701 — Val Loss: 0.5992
Epoch 13 — Train Loss: 0.5691 — Val Loss: 0.5836
Epoch 14 — Train Loss: 0.5555 — Val Loss: 0.5635
Epoch 15 — Train Loss: 0.5430 — Val Loss: 0.5680
Epoch 16 — Train Loss: 0.5196 — Val Loss: 0.5662
Epoch 17 — Train Loss: 0.5035 — Val Loss: 0.5766
Epoch 18 — Train Loss: 0.4758 — Val Loss: 0.5776
Epoch 19 — Train Loss: 0.4630 — Val Loss: 0.5699
Epoch 20 — Train Loss: 0.4276 — Val Loss: 0.5585
Epoch 21 — Train Loss: 0.4272 — Val Loss: 0.5942
Epoch 22 — Train Loss: 0.3952 — Val Loss: 0.5588
Epoch 23 — Train Loss: 0.3848 — Val Loss: 0.5449
Epoch 24 — Train Loss: 0.3591 — Val Loss: 0.5566
Epoch 25 — Train Loss: 0.3476 — Val Loss: 0.5463
Epoch 26 — Train Loss: 0.3124 — Val Loss: 0.5319
Epoch 27 — Train Loss: 0.3029 — Val Loss: 0.5318
Epoch 28 — Train Loss: 0.2933 — Val Loss: 0.5621
Epoch 29 — Train Loss: 0.2669 — Val Loss: 0.5354
Epoch 30 — Train Loss: 0.2412 — Val Loss: 0.5590
Epoch 31 — Train Loss: 0.2199 — Val Loss: 0.5423
Epoch 32 — Train Loss: 0.2155 — Val Loss: 0.5466
Epoch 33 — Train Loss: 0.2099 — Val Loss: 0.5628
Epoch 34 — Train Loss: 0.1988 — Val Loss: 0.5728
Epoch 35 — Train Loss: 0.1802 — Val Loss: 0.5428
Epoch 36 — Train Loss: 0.1692 — Val Loss: 0.5312
Epoch 37 — Train Loss: 0.1634 — Val Loss: 0.5574
Epoch 38 — Train Loss: 0.1537 — Val Loss: 0.5710
Epoch 39 — Train Loss: 0.1321 — Val Loss: 0.5582
Epoch 40 — Train Loss: 0.1248 — Val Loss: 0.5590
Epoch 41 — Train Loss: 0.1235 — Val Loss: 0.5834
Epoch 42 — Train Loss: 0.1230 — Val Loss: 0.5738
Epoch 43 — Train Loss: 0.1140 — Val Loss: 0.5716
Epoch 44 — Train Loss: 0.0970 — Val Loss: 0.6097
Epoch 45 — Train Loss: 0.0912 — Val Loss: 0.5893
Epoch 46 — Train Loss: 0.0881 — Val Loss: 0.5861
Early stopping.
Epoch 1 — Train Loss: 0.6748 — Val Loss: 0.6205
Epoch 2 — Train Loss: 0.6477 — Val Loss: 0.6071
Epoch 3 — Train Loss: 0.6209 — Val Loss: 0.6023
Epoch 4 — Train Loss: 0.5951 — Val Loss: 0.5995
Epoch 5 — Train Loss: 0.5789 — Val Loss: 0.5941
Epoch 6 — Train Loss: 0.5447 — Val Loss: 0.5519
Epoch 7 — Train Loss: 0.4885 — Val Loss: 0.5789
Epoch 8 — Train Loss: 0.4126 — Val Loss: 0.6023
Epoch 9 — Train Loss: 0.3556 — Val Loss: 0.5523
Epoch 10 — Train Loss: 0.2926 — Val Loss: 0.5652
Epoch 11 — Train Loss: 0.2123 — Val Loss: 0.5682
Epoch 12 — Train Loss: 0.1793 — Val Loss: 0.5778
Epoch 13 — Train Loss: 0.1606 — Val Loss: 0.5745
Epoch 14 — Train Loss: 0.1042 — Val Loss: 0.6200
Epoch 15 — Train Loss: 0.0805 — Val Loss: 0.7055
Epoch 16 — Train Loss: 0.0612 — Val Loss: 0.6495
Early stopping.
Epoch 1 — Train Loss: 0.6787 — Val Loss: 0.6480
Epoch 2 — Train Loss: 0.6434 — Val Loss: 0.6394
Epoch 3 — Train Loss: 0.6406 — Val Loss: 0.6206
Epoch 4 — Train Loss: 0.6257 — Val Loss: 0.6142
Epoch 5 — Train Loss: 0.6144 — Val Loss: 0.6033
Epoch 6 — Train Loss: 0.5825 — Val Loss: 0.5876
Epoch 7 — Train Loss: 0.5859 — Val Loss: 0.5800
Epoch 8 — Train Loss: 0.5592 — Val Loss: 0.5620
Epoch 9 — Train Loss: 0.5478 — Val Loss: 0.5610
Epoch 10 — Train Loss: 0.5149 — Val Loss: 0.5783
Epoch 11 — Train Loss: 0.4934 — Val Loss: 0.5715
Epoch 12 — Train Loss: 0.4599 — Val Loss: 0.5511
Epoch 13 — Train Loss: 0.4342 — Val Loss: 0.5520
Epoch 14 — Train Loss: 0.4068 — Val Loss: 0.5588
Epoch 15 — Train Loss: 0.3834 — Val Loss: 0.6008
Epoch 16 — Train Loss: 0.3575 — Val Loss: 0.5473
Epoch 17 — Train Loss: 0.3258 — Val Loss: 0.5529
Epoch 18 — Train Loss: 0.3247 — Val Loss: 0.5614
Epoch 19 — Train Loss: 0.3008 — Val Loss: 0.5463
Epoch 20 — Train Loss: 0.2653 — Val Loss: 0.5350
Epoch 21 — Train Loss: 0.2514 — Val Loss: 0.5498
Epoch 22 — Train Loss: 0.2290 — Val Loss: 0.5351
Epoch 23 — Train Loss: 0.2091 — Val Loss: 0.5673
Epoch 24 — Train Loss: 0.2014 — Val Loss: 0.5628
Epoch 25 — Train Loss: 0.1896 — Val Loss: 0.5565
Epoch 26 — Train Loss: 0.1811 — Val Loss: 0.5544
Epoch 27 — Train Loss: 0.1639 — Val Loss: 0.5904
Epoch 28 — Train Loss: 0.1531 — Val Loss: 0.5406
Epoch 29 — Train Loss: 0.1287 — Val Loss: 0.5520
Epoch 30 — Train Loss: 0.1180 — Val Loss: 0.5648
Early stopping.
Epoch 1 — Train Loss: 0.6819 — Val Loss: 0.6618
Epoch 2 — Train Loss: 0.6713 — Val Loss: 0.6525
Epoch 3 — Train Loss: 0.6730 — Val Loss: 0.6588
Epoch 4 — Train Loss: 0.6634 — Val Loss: 0.6268
Epoch 5 — Train Loss: 0.6615 — Val Loss: 0.6430
Epoch 6 — Train Loss: 0.6516 — Val Loss: 0.6648
Epoch 7 — Train Loss: 0.6553 — Val Loss: 0.6508
Epoch 8 — Train Loss: 0.6674 — Val Loss: 0.7078
Epoch 9 — Train Loss: 0.6620 — Val Loss: 0.6430
Epoch 10 — Train Loss: 0.6502 — Val Loss: 0.6400
Epoch 11 — Train Loss: 0.6445 — Val Loss: 0.6384
Epoch 12 — Train Loss: 0.6407 — Val Loss: 0.6359
Epoch 13 — Train Loss: 0.6286 — Val Loss: 0.6087
Epoch 14 — Train Loss: 0.6252 — Val Loss: 0.6340
Epoch 15 — Train Loss: 0.6352 — Val Loss: 0.6160
Epoch 16 — Train Loss: 0.6318 — Val Loss: 0.6031
Epoch 17 — Train Loss: 0.6213 — Val Loss: 0.6148
Epoch 18 — Train Loss: 0.6288 — Val Loss: 0.6097
Epoch 19 — Train Loss: 0.6209 — Val Loss: 0.5994
Epoch 20 — Train Loss: 0.6140 — Val Loss: 0.6068
Epoch 21 — Train Loss: 0.6130 — Val Loss: 0.5767
Epoch 22 — Train Loss: 0.6131 — Val Loss: 0.5970
Epoch 23 — Train Loss: 0.6000 — Val Loss: 0.5995
Epoch 24 — Train Loss: 0.5927 — Val Loss: 0.6147
Epoch 25 — Train Loss: 0.5844 — Val Loss: 0.5806
Epoch 26 — Train Loss: 0.5824 — Val Loss: 0.5649
Epoch 27 — Train Loss: 0.5688 — Val Loss: 0.5760
Epoch 28 — Train Loss: 0.5653 — Val Loss: 0.6246
Epoch 29 — Train Loss: 0.5643 — Val Loss: 0.5696
Epoch 30 — Train Loss: 0.5556 — Val Loss: 0.5809
Epoch 31 — Train Loss: 0.5517 — Val Loss: 0.6609
Epoch 32 — Train Loss: 0.5500 — Val Loss: 0.5825
Epoch 33 — Train Loss: 0.5392 — Val Loss: 0.5625
Epoch 34 — Train Loss: 0.5392 — Val Loss: 0.5729
Epoch 35 — Train Loss: 0.5217 — Val Loss: 0.5494
Epoch 36 — Train Loss: 0.5284 — Val Loss: 0.5635
Epoch 37 — Train Loss: 0.5162 — Val Loss: 0.5716
Epoch 38 — Train Loss: 0.5051 — Val Loss: 0.5608
Epoch 39 — Train Loss: 0.5067 — Val Loss: 0.5526
Epoch 40 — Train Loss: 0.4935 — Val Loss: 0.5922
Epoch 41 — Train Loss: 0.4856 — Val Loss: 0.5825
Epoch 42 — Train Loss: 0.4941 — Val Loss: 0.5687
Epoch 43 — Train Loss: 0.4650 — Val Loss: 0.5859
Epoch 44 — Train Loss: 0.4622 — Val Loss: 0.5535
Epoch 45 — Train Loss: 0.4485 — Val Loss: 0.5405
Epoch 46 — Train Loss: 0.4385 — Val Loss: 0.5454
Epoch 47 — Train Loss: 0.4272 — Val Loss: 0.5546
Epoch 48 — Train Loss: 0.4093 — Val Loss: 0.5476
Epoch 49 — Train Loss: 0.3942 — Val Loss: 0.5537
Epoch 50 — Train Loss: 0.3894 — Val Loss: 0.5554
Epoch 51 — Train Loss: 0.4029 — Val Loss: 0.5376
Epoch 52 — Train Loss: 0.3706 — Val Loss: 0.5169
Epoch 53 — Train Loss: 0.3535 — Val Loss: 0.5511
Epoch 54 — Train Loss: 0.3777 — Val Loss: 0.5605
Epoch 55 — Train Loss: 0.3478 — Val Loss: 0.5548
Epoch 56 — Train Loss: 0.3425 — Val Loss: 0.5565
Epoch 57 — Train Loss: 0.3275 — Val Loss: 0.6274
Epoch 58 — Train Loss: 0.3354 — Val Loss: 0.5680
Epoch 59 — Train Loss: 0.3304 — Val Loss: 0.5650
Epoch 60 — Train Loss: 0.2995 — Val Loss: 0.5710
Epoch 61 — Train Loss: 0.3160 — Val Loss: 0.5624
Epoch 62 — Train Loss: 0.2919 — Val Loss: 0.5876
Early stopping.
Epoch 1 — Train Loss: 0.6725 — Val Loss: 0.6551
Epoch 2 — Train Loss: 0.6496 — Val Loss: 0.6314
Epoch 3 — Train Loss: 0.6327 — Val Loss: 0.6070
Epoch 4 — Train Loss: 0.6014 — Val Loss: 0.5928
Epoch 5 — Train Loss: 0.5812 — Val Loss: 0.6109
Epoch 6 — Train Loss: 0.5611 — Val Loss: 0.5620
Epoch 7 — Train Loss: 0.5209 — Val Loss: 0.5644
Epoch 8 — Train Loss: 0.4782 — Val Loss: 0.5638
Epoch 9 — Train Loss: 0.4473 — Val Loss: 0.5381
Epoch 10 — Train Loss: 0.3922 — Val Loss: 0.5397
Epoch 11 — Train Loss: 0.3576 — Val Loss: 0.5526
Epoch 12 — Train Loss: 0.2909 — Val Loss: 0.5387
Epoch 13 — Train Loss: 0.2413 — Val Loss: 0.5527
Epoch 14 — Train Loss: 0.2141 — Val Loss: 0.5528
Epoch 15 — Train Loss: 0.1881 — Val Loss: 0.5573
Epoch 16 — Train Loss: 0.1627 — Val Loss: 0.5660
Epoch 17 — Train Loss: 0.1431 — Val Loss: 0.5701
Epoch 18 — Train Loss: 0.1067 — Val Loss: 0.5968
Epoch 19 — Train Loss: 0.0961 — Val Loss: 0.5888
Early stopping.
Epoch 1 — Train Loss: 0.6824 — Val Loss: 0.6512
Epoch 2 — Train Loss: 0.6515 — Val Loss: 0.6394
Epoch 3 — Train Loss: 0.6368 — Val Loss: 0.6165
Epoch 4 — Train Loss: 0.6297 — Val Loss: 0.6098
Epoch 5 — Train Loss: 0.6281 — Val Loss: 0.6186
Epoch 6 — Train Loss: 0.6117 — Val Loss: 0.6132
Epoch 7 — Train Loss: 0.6020 — Val Loss: 0.5869
Epoch 8 — Train Loss: 0.5886 — Val Loss: 0.5764
Epoch 9 — Train Loss: 0.5694 — Val Loss: 0.5855
Epoch 10 — Train Loss: 0.5412 — Val Loss: 0.5825
Epoch 11 — Train Loss: 0.5319 — Val Loss: 0.6050
Epoch 12 — Train Loss: 0.5041 — Val Loss: 0.5616
Epoch 13 — Train Loss: 0.5091 — Val Loss: 0.5587
Epoch 14 — Train Loss: 0.4664 — Val Loss: 0.5496
Epoch 15 — Train Loss: 0.4459 — Val Loss: 0.5384
Epoch 16 — Train Loss: 0.4202 — Val Loss: 0.5485
Epoch 17 — Train Loss: 0.4042 — Val Loss: 0.5501
Epoch 18 — Train Loss: 0.3801 — Val Loss: 0.5198
Epoch 19 — Train Loss: 0.3519 — Val Loss: 0.5444
Epoch 20 — Train Loss: 0.3392 — Val Loss: 0.5585
Epoch 21 — Train Loss: 0.2993 — Val Loss: 0.5463
Epoch 22 — Train Loss: 0.3021 — Val Loss: 0.5349
Epoch 23 — Train Loss: 0.2805 — Val Loss: 0.5443
Epoch 24 — Train Loss: 0.2611 — Val Loss: 0.5407
Epoch 25 — Train Loss: 0.2470 — Val Loss: 0.5395
Epoch 26 — Train Loss: 0.2464 — Val Loss: 0.5638
Epoch 27 — Train Loss: 0.2167 — Val Loss: 0.5427
Epoch 28 — Train Loss: 0.2143 — Val Loss: 0.5425
Early stopping.
Epoch 1 — Train Loss: 0.6784 — Val Loss: 0.6534
Epoch 2 — Train Loss: 0.6490 — Val Loss: 0.6372
Epoch 3 — Train Loss: 0.6282 — Val Loss: 0.6179
Epoch 4 — Train Loss: 0.6116 — Val Loss: 0.6174
Epoch 5 — Train Loss: 0.5916 — Val Loss: 0.6092
Epoch 6 — Train Loss: 0.5733 — Val Loss: 0.5852
Epoch 7 — Train Loss: 0.5545 — Val Loss: 0.5846
Epoch 8 — Train Loss: 0.5272 — Val Loss: 0.6041
Epoch 9 — Train Loss: 0.5084 — Val Loss: 0.6093
Epoch 10 — Train Loss: 0.4836 — Val Loss: 0.5984
Epoch 11 — Train Loss: 0.4374 — Val Loss: 0.5623
Epoch 12 — Train Loss: 0.4220 — Val Loss: 0.5930
Epoch 13 — Train Loss: 0.3958 — Val Loss: 0.5712
Epoch 14 — Train Loss: 0.3733 — Val Loss: 0.5415
Epoch 15 — Train Loss: 0.3351 — Val Loss: 0.5393
Epoch 16 — Train Loss: 0.3024 — Val Loss: 0.5440
Epoch 17 — Train Loss: 0.2766 — Val Loss: 0.5709
Epoch 18 — Train Loss: 0.2656 — Val Loss: 0.5543
Epoch 19 — Train Loss: 0.2366 — Val Loss: 0.5714
Epoch 20 — Train Loss: 0.2133 — Val Loss: 0.5527
Epoch 21 — Train Loss: 0.2110 — Val Loss: 0.5860
Epoch 22 — Train Loss: 0.1892 — Val Loss: 0.5502
Epoch 23 — Train Loss: 0.1689 — Val Loss: 0.5711
Epoch 24 — Train Loss: 0.1524 — Val Loss: 0.5787
Epoch 25 — Train Loss: 0.1363 — Val Loss: 0.5560
Early stopping.
Epoch 1 — Train Loss: 0.6776 — Val Loss: 0.6448
Epoch 2 — Train Loss: 0.6504 — Val Loss: 0.6290
Epoch 3 — Train Loss: 0.6251 — Val Loss: 0.5972
Epoch 4 — Train Loss: 0.6027 — Val Loss: 0.6093
Epoch 5 — Train Loss: 0.5902 — Val Loss: 0.6016
Epoch 6 — Train Loss: 0.5725 — Val Loss: 0.6075
Epoch 7 — Train Loss: 0.5500 — Val Loss: 0.5889
Epoch 8 — Train Loss: 0.5225 — Val Loss: 0.5799
Epoch 9 — Train Loss: 0.4930 — Val Loss: 0.5734
Epoch 10 — Train Loss: 0.4600 — Val Loss: 0.5507
Epoch 11 — Train Loss: 0.4380 — Val Loss: 0.5349
Epoch 12 — Train Loss: 0.4044 — Val Loss: 0.5318
Epoch 13 — Train Loss: 0.3630 — Val Loss: 0.5570
Epoch 14 — Train Loss: 0.3425 — Val Loss: 0.5618
Epoch 15 — Train Loss: 0.3122 — Val Loss: 0.5432
Epoch 16 — Train Loss: 0.2929 — Val Loss: 0.5541
Epoch 17 — Train Loss: 0.2703 — Val Loss: 0.5629
Epoch 18 — Train Loss: 0.2333 — Val Loss: 0.5511
Epoch 19 — Train Loss: 0.1963 — Val Loss: 0.5909
Epoch 20 — Train Loss: 0.1917 — Val Loss: 0.5800
Epoch 21 — Train Loss: 0.1757 — Val Loss: 0.5382
Epoch 22 — Train Loss: 0.1598 — Val Loss: 0.5385
Early stopping.
Epoch 1 — Train Loss: 0.6863 — Val Loss: 0.6608
Epoch 2 — Train Loss: 0.6564 — Val Loss: 0.6340
Epoch 3 — Train Loss: 0.6428 — Val Loss: 0.6290
Epoch 4 — Train Loss: 0.6291 — Val Loss: 0.6189
Epoch 5 — Train Loss: 0.6104 — Val Loss: 0.6107
Epoch 6 — Train Loss: 0.6020 — Val Loss: 0.5939
Epoch 7 — Train Loss: 0.5841 — Val Loss: 0.6041
Epoch 8 — Train Loss: 0.5519 — Val Loss: 0.6171
Epoch 9 — Train Loss: 0.5396 — Val Loss: 0.5943
Epoch 10 — Train Loss: 0.5296 — Val Loss: 0.5884
Epoch 11 — Train Loss: 0.4997 — Val Loss: 0.5799
Epoch 12 — Train Loss: 0.4786 — Val Loss: 0.5848
Epoch 13 — Train Loss: 0.4609 — Val Loss: 0.6087
Epoch 14 — Train Loss: 0.4377 — Val Loss: 0.5894
Epoch 15 — Train Loss: 0.4033 — Val Loss: 0.5761
Epoch 16 — Train Loss: 0.4037 — Val Loss: 0.5843
Epoch 17 — Train Loss: 0.3670 — Val Loss: 0.5583
Epoch 18 — Train Loss: 0.3674 — Val Loss: 0.5477
Epoch 19 — Train Loss: 0.3469 — Val Loss: 0.5526
Epoch 20 — Train Loss: 0.3073 — Val Loss: 0.5652
Epoch 21 — Train Loss: 0.2895 — Val Loss: 0.6028
Epoch 22 — Train Loss: 0.2809 — Val Loss: 0.5722
Epoch 23 — Train Loss: 0.2521 — Val Loss: 0.5913
Epoch 24 — Train Loss: 0.2510 — Val Loss: 0.5848
Epoch 25 — Train Loss: 0.2400 — Val Loss: 0.5864
Epoch 26 — Train Loss: 0.2187 — Val Loss: 0.5684
Epoch 27 — Train Loss: 0.2026 — Val Loss: 0.5651
Epoch 28 — Train Loss: 0.1783 — Val Loss: 0.5748
Early stopping.
Epoch 1 — Train Loss: 0.6800 — Val Loss: 0.6615
Epoch 2 — Train Loss: 0.6459 — Val Loss: 0.6364
Epoch 3 — Train Loss: 0.6295 — Val Loss: 0.6160
Epoch 4 — Train Loss: 0.6032 — Val Loss: 0.6088
Epoch 5 — Train Loss: 0.5944 — Val Loss: 0.5901
Epoch 6 — Train Loss: 0.5659 — Val Loss: 0.5674
Epoch 7 — Train Loss: 0.5494 — Val Loss: 0.5649
Epoch 8 — Train Loss: 0.5278 — Val Loss: 0.5641
Epoch 9 — Train Loss: 0.5051 — Val Loss: 0.5607
Epoch 10 — Train Loss: 0.4788 — Val Loss: 0.5520
Epoch 11 — Train Loss: 0.4398 — Val Loss: 0.5740
Epoch 12 — Train Loss: 0.4082 — Val Loss: 0.5629
Epoch 13 — Train Loss: 0.3927 — Val Loss: 0.5597
Epoch 14 — Train Loss: 0.3484 — Val Loss: 0.5634
Epoch 15 — Train Loss: 0.3323 — Val Loss: 0.5414
Epoch 16 — Train Loss: 0.3106 — Val Loss: 0.5498
Epoch 17 — Train Loss: 0.2761 — Val Loss: 0.5625
Epoch 18 — Train Loss: 0.2590 — Val Loss: 0.5470
Epoch 19 — Train Loss: 0.2341 — Val Loss: 0.6556
Epoch 20 — Train Loss: 0.2302 — Val Loss: 0.5546
Epoch 21 — Train Loss: 0.1863 — Val Loss: 0.5480
Epoch 22 — Train Loss: 0.1759 — Val Loss: 0.5551
Epoch 23 — Train Loss: 0.1573 — Val Loss: 0.5581
Epoch 24 — Train Loss: 0.1399 — Val Loss: 0.5547
Epoch 25 — Train Loss: 0.1270 — Val Loss: 0.5721
Early stopping.
Epoch 1 — Train Loss: 0.6762 — Val Loss: 0.6368
Epoch 2 — Train Loss: 0.6457 — Val Loss: 0.6225
Epoch 3 — Train Loss: 0.6188 — Val Loss: 0.6049
Epoch 4 — Train Loss: 0.6050 — Val Loss: 0.6212
Epoch 5 — Train Loss: 0.5843 — Val Loss: 0.6155
Epoch 6 — Train Loss: 0.5759 — Val Loss: 0.5888
Epoch 7 — Train Loss: 0.5474 — Val Loss: 0.5964
Epoch 8 — Train Loss: 0.5244 — Val Loss: 0.5915
Epoch 9 — Train Loss: 0.5036 — Val Loss: 0.5933
Epoch 10 — Train Loss: 0.4759 — Val Loss: 0.5922
Epoch 11 — Train Loss: 0.4575 — Val Loss: 0.5767
Epoch 12 — Train Loss: 0.4166 — Val Loss: 0.5579
Epoch 13 — Train Loss: 0.3795 — Val Loss: 0.5588
Epoch 14 — Train Loss: 0.3567 — Val Loss: 0.5789
Epoch 15 — Train Loss: 0.3426 — Val Loss: 0.5753
Epoch 16 — Train Loss: 0.2969 — Val Loss: 0.5711
Epoch 17 — Train Loss: 0.2775 — Val Loss: 0.5682
Epoch 18 — Train Loss: 0.2496 — Val Loss: 0.5619
Epoch 19 — Train Loss: 0.2369 — Val Loss: 0.5724
Epoch 20 — Train Loss: 0.2223 — Val Loss: 0.5660
Epoch 21 — Train Loss: 0.1923 — Val Loss: 0.5839
Epoch 22 — Train Loss: 0.1744 — Val Loss: 0.5843
Early stopping.
Epoch 1 — Train Loss: 0.6747 — Val Loss: 0.6585
Epoch 2 — Train Loss: 0.6917 — Val Loss: 0.6901
Epoch 3 — Train Loss: 0.6703 — Val Loss: 0.6655
Epoch 4 — Train Loss: 0.6659 — Val Loss: 0.6502
Epoch 5 — Train Loss: 0.6579 — Val Loss: 0.6435
Epoch 6 — Train Loss: 0.6556 — Val Loss: 0.6212
Epoch 7 — Train Loss: 0.6427 — Val Loss: 0.6182
Epoch 8 — Train Loss: 0.6307 — Val Loss: 0.6045
Epoch 9 — Train Loss: 0.6233 — Val Loss: 0.6168
Epoch 10 — Train Loss: 0.6167 — Val Loss: 0.5987
Epoch 11 — Train Loss: 0.6155 — Val Loss: 0.5908
Epoch 12 — Train Loss: 0.5996 — Val Loss: 0.6001
Epoch 13 — Train Loss: 0.5923 — Val Loss: 0.5955
Epoch 14 — Train Loss: 0.5767 — Val Loss: 0.6057
Epoch 15 — Train Loss: 0.5730 — Val Loss: 0.5846
Epoch 16 — Train Loss: 0.5661 — Val Loss: 0.5824
Epoch 17 — Train Loss: 0.5573 — Val Loss: 0.5868
Epoch 18 — Train Loss: 0.5410 — Val Loss: 0.5655
Epoch 19 — Train Loss: 0.5364 — Val Loss: 0.5720
Epoch 20 — Train Loss: 0.5289 — Val Loss: 0.5771
Epoch 21 — Train Loss: 0.5014 — Val Loss: 0.5561
Epoch 22 — Train Loss: 0.4905 — Val Loss: 0.5720
Epoch 23 — Train Loss: 0.4790 — Val Loss: 0.5449
Epoch 24 — Train Loss: 0.4815 — Val Loss: 0.5745
Epoch 25 — Train Loss: 0.4656 — Val Loss: 0.5830
Epoch 26 — Train Loss: 0.4464 — Val Loss: 0.5652
Epoch 27 — Train Loss: 0.4336 — Val Loss: 0.5573
Epoch 28 — Train Loss: 0.4207 — Val Loss: 0.5585
Epoch 29 — Train Loss: 0.3959 — Val Loss: 0.5474
Epoch 30 — Train Loss: 0.3851 — Val Loss: 0.5485
Epoch 31 — Train Loss: 0.3841 — Val Loss: 0.5724
Epoch 32 — Train Loss: 0.3653 — Val Loss: 0.5605
Epoch 33 — Train Loss: 0.3498 — Val Loss: 0.5785
Early stopping.
Epoch 1 — Train Loss: 0.6785 — Val Loss: 0.6564
Epoch 2 — Train Loss: 0.6467 — Val Loss: 0.6420
Epoch 3 — Train Loss: 0.6341 — Val Loss: 0.6202
Epoch 4 — Train Loss: 0.6126 — Val Loss: 0.6214
Epoch 5 — Train Loss: 0.6003 — Val Loss: 0.6053
Epoch 6 — Train Loss: 0.5726 — Val Loss: 0.5994
Epoch 7 — Train Loss: 0.5552 — Val Loss: 0.6106
Epoch 8 — Train Loss: 0.5196 — Val Loss: 0.5896
Epoch 9 — Train Loss: 0.5169 — Val Loss: 0.5812
Epoch 10 — Train Loss: 0.4794 — Val Loss: 0.5972
Epoch 11 — Train Loss: 0.4597 — Val Loss: 0.5842
Epoch 12 — Train Loss: 0.4336 — Val Loss: 0.5778
Epoch 13 — Train Loss: 0.4086 — Val Loss: 0.5838
Epoch 14 — Train Loss: 0.3753 — Val Loss: 0.5552
Epoch 15 — Train Loss: 0.3567 — Val Loss: 0.5719
Epoch 16 — Train Loss: 0.3441 — Val Loss: 0.5646
Epoch 17 — Train Loss: 0.3116 — Val Loss: 0.5645
Epoch 18 — Train Loss: 0.2940 — Val Loss: 0.5573
Epoch 19 — Train Loss: 0.2721 — Val Loss: 0.5754
Epoch 20 — Train Loss: 0.2444 — Val Loss: 0.5926
Epoch 21 — Train Loss: 0.2365 — Val Loss: 0.5846
Epoch 22 — Train Loss: 0.2217 — Val Loss: 0.5981
Epoch 23 — Train Loss: 0.1991 — Val Loss: 0.5982
Epoch 24 — Train Loss: 0.1877 — Val Loss: 0.6060
Early stopping.
Epoch 1 — Train Loss: 0.6931 — Val Loss: 0.6931
Epoch 2 — Train Loss: 0.6931 — Val Loss: 0.6931
Epoch 3 — Train 