[I 2025-05-09 05:07:40,540] Trial 36 finished with value: 0.5957715608856895 and parameters: {'lr': 3.347601650361409e-05, 'weight_decay': 0.009675548666097863, 'optimizer': 'RMSprop', 'dropout_rate': 0.07303147761011214}. Best is trial 35 with value: 0.53901874368841.
[I 2025-05-09 05:09:58,161] Trial 37 finished with value: 0.6902354858138344 and parameters: {'lr': 0.0009337944904009941, 'weight_decay': 0.005348758293835324, 'optimizer': 'RMSprop', 'dropout_rate': 0.24193847829438841}. Best is trial 35 with value: 0.53901874368841.
[I 2025-05-09 05:14:32,240] Trial 38 finished with value: 0.7313304478471929 and parameters: {'lr': 0.00015718797001137842, 'weight_decay': 0.00027936702897873145, 'optimizer': 'RMSprop', 'dropout_rate': 0.1992420024430003}. Best is trial 35 with value: 0.53901874368841.
[I 2025-05-09 05:20:21,806] Trial 39 finished with value: 0.6287475694309581 and parameters: {'lr': 2.132167922786464e-05, 'weight_decay': 0.0006372391111302047, 'optimizer': 'RMSprop', 'dropout_rate': 0.38648630901690184}. Best is trial 35 with value: 0.53901874368841.
[I 2025-05-09 05:25:08,772] Trial 40 finished with value: 0.5787476756355979 and parameters: {'lr': 6.334239779496413e-05, 'weight_decay': 0.0013073498351143925, 'optimizer': 'RMSprop', 'dropout_rate': 0.35089573518730166}. Best is trial 35 with value: 0.53901874368841.
[I 2025-05-09 05:32:06,444] Trial 41 finished with value: 0.5838243029334328 and parameters: {'lr': 3.313528815190204e-05, 'weight_decay': 0.003518928163553242, 'optimizer': 'Adam', 'dropout_rate': 0.27469434784191843}. Best is trial 35 with value: 0.53901874368841.
[I 2025-05-09 05:42:39,901] Trial 42 finished with value: 0.5955908699469132 and parameters: {'lr': 6.600953535347918e-06, 'weight_decay': 0.006276934872685526, 'optimizer': 'Adam', 'dropout_rate': 0.2981844808788561}. Best is trial 35 with value: 0.53901874368841.
[I 2025-05-09 05:57:35,661] Trial 43 finished with value: 0.6004960276863792 and parameters: {'lr': 2.7717488813020183e-06, 'weight_decay': 0.002859790799347317, 'optimizer': 'RMSprop', 'dropout_rate': 0.32147875054675495}. Best is trial 35 with value: 0.53901874368841.
[I 2025-05-09 06:03:31,900] Trial 44 finished with value: 0.5853335770693693 and parameters: {'lr': 1.7772125524141996e-05, 'weight_decay': 0.007335586105485085, 'optimizer': 'AdamW', 'dropout_rate': 0.451930187974926}. Best is trial 35 with value: 0.53901874368841.
[I 2025-05-09 06:11:12,125] Trial 45 finished with value: 0.6173499280756171 and parameters: {'lr': 1.3205834839873831e-05, 'weight_decay': 0.0023051391226364473, 'optimizer': 'Adam', 'dropout_rate': 0.26713101403966344}. Best is trial 35 with value: 0.53901874368841.
[I 2025-05-09 06:15:27,064] Trial 46 finished with value: 0.6322651624679565 and parameters: {'lr': 8.550911934028723e-05, 'weight_decay': 1.3924299512242148e-06, 'optimizer': 'Adam', 'dropout_rate': 0.3611605953150384}. Best is trial 35 with value: 0.53901874368841.
[I 2025-05-09 06:21:06,289] Trial 47 finished with value: 0.5878036520697854 and parameters: {'lr': 2.5088381037910308e-05, 'weight_decay': 0.00035075869934271807, 'optimizer': 'RMSprop', 'dropout_rate': 0.2478987965095493}. Best is trial 35 with value: 0.53901874368841.
[I 2025-05-09 06:26:12,184] Trial 48 finished with value: 0.5967105995525014 and parameters: {'lr': 5.3029200274715354e-05, 'weight_decay': 6.97354426345601e-05, 'optimizer': 'Adam', 'dropout_rate': 0.18349625091450028}. Best is trial 35 with value: 0.53901874368841.
[I 2025-05-09 06:30:51,967] Trial 49 finished with value: 0.5821852261369879 and parameters: {'lr': 0.00016480865439094663, 'weight_decay': 0.0015790539168012141, 'optimizer': 'Adam', 'dropout_rate': 0.15495074597951988}. Best is trial 35 with value: 0.53901874368841.
[I 2025-05-09 06:35:17,688] Trial 50 finished with value: 0.5975434725934808 and parameters: {'lr': 3.4689928551740536e-05, 'weight_decay': 3.019905155324476e-05, 'optimizer': 'AdamW', 'dropout_rate': 0.28804505671388125}. Best is trial 35 with value: 0.53901874368841.
[I 2025-05-09 06:44:30,957] Trial 51 finished with value: 0.5736625758084384 and parameters: {'lr': 9.985964944694701e-06, 'weight_decay': 0.003609981716458929, 'optimizer': 'Adam', 'dropout_rate': 0.27074774406335494}. Best is trial 35 with value: 0.53901874368841.
[I 2025-05-09 06:53:23,641] Trial 52 finished with value: 0.5556164253841747 and parameters: {'lr': 1.3045333727972757e-05, 'weight_decay': 0.0033994983114193906, 'optimizer': 'Adam', 'dropout_rate': 0.33600248848455605}. Best is trial 35 with value: 0.53901874368841.
[I 2025-05-09 07:01:00,120] Trial 53 finished with value: 0.6209420691836964 and parameters: {'lr': 7.118731264692583e-06, 'weight_decay': 0.006027120246802176, 'optimizer': 'Adam', 'dropout_rate': 0.338131747455701}. Best is trial 35 with value: 0.53901874368841.
[I 2025-05-09 07:08:19,492] Trial 54 finished with value: 0.5952245213768699 and parameters: {'lr': 1.4576831422144047e-05, 'weight_decay': 0.0071702635326387236, 'optimizer': 'Adam', 'dropout_rate': 0.3058512924837}. Best is trial 35 with value: 0.53901874368841.
[I 2025-05-09 07:14:17,609] Trial 55 finished with value: 0.5617412317882885 and parameters: {'lr': 2.336751639973654e-05, 'weight_decay': 0.002424966942517433, 'optimizer': 'Adam', 'dropout_rate': 0.33272511751609035}. Best is trial 35 with value: 0.53901874368841.
[I 2025-05-09 07:20:09,280] Trial 56 finished with value: 0.5823656103827737 and parameters: {'lr': 2.6465883436085006e-05, 'weight_decay': 0.0005424707594824622, 'optimizer': 'Adam', 'dropout_rate': 0.42339841319928373}. Best is trial 35 with value: 0.53901874368841.
[I 2025-05-09 07:24:33,286] Trial 57 finished with value: 0.6263528000224721 and parameters: {'lr': 7.665123706709052e-05, 'weight_decay': 4.140983159457064e-06, 'optimizer': 'Adam', 'dropout_rate': 0.3961272296895493}. Best is trial 35 with value: 0.53901874368841.
[I 2025-05-09 07:29:59,332] Trial 58 finished with value: 0.6485827467658303 and parameters: {'lr': 0.0002808358998646543, 'weight_decay': 0.002186631201162954, 'optimizer': 'Adam', 'dropout_rate': 0.36450469152235676}. Best is trial 35 with value: 0.53901874368841.
[I 2025-05-09 07:35:24,561] Trial 59 finished with value: 0.5708209005269137 and parameters: {'lr': 2.1504386333259484e-05, 'weight_decay': 0.001041289717745763, 'optimizer': 'RMSprop', 'dropout_rate': 0.3217506050508182}. Best is trial 35 with value: 0.53901874368841.
[I 2025-05-09 07:42:32,328] Trial 60 finished with value: 0.5707546960223805 and parameters: {'lr': 0.00010090241966995445, 'weight_decay': 0.004260635319948146, 'optimizer': 'Adam', 'dropout_rate': 0.47652707501297287}. Best is trial 35 with value: 0.53901874368841.
[I 2025-05-09 07:49:44,312] Trial 61 finished with value: 0.5722358096729625 and parameters: {'lr': 1.8734316835058824e-05, 'weight_decay': 0.002644007474479731, 'optimizer': 'Adam', 'dropout_rate': 0.2331164631742863}. Best is trial 35 with value: 0.53901874368841.
[I 2025-05-09 07:58:59,323] Trial 62 finished with value: 0.5514525435187599 and parameters: {'lr': 4.031331556818653e-05, 'weight_decay': 0.009631099959438725, 'optimizer': 'Adam', 'dropout_rate': 0.25746916698642636}. Best is trial 35 with value: 0.53901874368841.
[I 2025-05-09 08:06:39,947] Trial 63 finished with value: 0.5436985568566756 and parameters: {'lr': 3.823349391017258e-05, 'weight_decay': 0.009045495876444034, 'optimizer': 'Adam', 'dropout_rate': 0.33175281801269807}. Best is trial 35 with value: 0.53901874368841.
[I 2025-05-09 08:14:46,211] Trial 64 finished with value: 0.5315759723836725 and parameters: {'lr': 4.08367006057259e-05, 'weight_decay': 0.008757687339341956, 'optimizer': 'Adam', 'dropout_rate': 0.3357751894656019}. Best is trial 64 with value: 0.5315759723836725.
[I 2025-05-09 08:23:10,030] Trial 65 finished with value: 0.5766919374465942 and parameters: {'lr': 4.312639571160675e-05, 'weight_decay': 0.008877999830624336, 'optimizer': 'Adam', 'dropout_rate': 0.25583970364439856}. Best is trial 64 with value: 0.5315759723836725.
[I 2025-05-09 08:33:38,344] Trial 66 finished with value: 0.5725107117132707 and parameters: {'lr': 5.976285599913164e-05, 'weight_decay': 0.009829464295706025, 'optimizer': 'Adam', 'dropout_rate': 0.20817588077765134}. Best is trial 64 with value: 0.5315759723836725.
[I 2025-05-09 08:38:16,582] Trial 67 finished with value: 0.6021689306605946 and parameters: {'lr': 4.130213342285039e-05, 'weight_decay': 0.006044517732196349, 'optimizer': 'AdamW', 'dropout_rate': 0.30742479545843704}. Best is trial 64 with value: 0.5315759723836725.
[I 2025-05-09 08:45:00,074] Trial 68 finished with value: 0.5595356897874312 and parameters: {'lr': 3.051948053096639e-05, 'weight_decay': 0.004516192326242572, 'optimizer': 'Adam', 'dropout_rate': 0.3460512341664426}. Best is trial 64 with value: 0.5315759723836725.
[I 2025-05-09 08:52:31,019] Trial 69 finished with value: 0.5470704891464927 and parameters: {'lr': 5.07621620869762e-05, 'weight_decay': 0.007196824724383266, 'optimizer': 'Adam', 'dropout_rate': 0.2864699827604931}. Best is trial 64 with value: 0.5315759723836725.
[I 2025-05-09 09:01:32,459] Trial 70 finished with value: 0.5592872229489413 and parameters: {'lr': 3.7642430271889634e-05, 'weight_decay': 0.0075191415559395895, 'optimizer': 'Adam', 'dropout_rate': 0.3746792021349906}. Best is trial 64 with value: 0.5315759723836725.
[I 2025-05-09 09:07:40,012] Trial 71 finished with value: 0.5635261069644582 and parameters: {'lr': 5.1586727662863786e-05, 'weight_decay': 0.005181092884208374, 'optimizer': 'Adam', 'dropout_rate': 0.28199479884041256}. Best is trial 64 with value: 0.5315759723836725.
[I 2025-05-09 09:15:55,435] Trial 72 finished with value: 0.5656057065183466 and parameters: {'lr': 6.989962325250735e-05, 'weight_decay': 0.0075232447572183975, 'optimizer': 'Adam', 'dropout_rate': 0.3123371200680407}. Best is trial 64 with value: 0.5315759723836725.
