[I 2025-05-09 04:57:27,877] Trial 35 finished with value: 0.53901874368841 and parameters: {'lr': 3.26613280947996e-05, 'weight_decay': 0.009942801186202586, 'optimizer': 'RMSprop', 'dropout_rate': 0.2742567559118134}. Best is trial 35 with value: 0.53901874368841.
Full train CSV contained 2200 samples
 → using 1760 for training, 440 for validation
Test : 1000 samples
Epoch 1 — Train Loss: 0.6905 — Val Loss: 0.6552
Epoch 2 — Train Loss: 0.6581 — Val Loss: 0.6258
Epoch 3 — Train Loss: 0.6442 — Val Loss: 0.6244
Epoch 4 — Train Loss: 0.6230 — Val Loss: 0.6065
Epoch 5 — Train Loss: 0.6111 — Val Loss: 0.5910
Epoch 6 — Train Loss: 0.5851 — Val Loss: 0.5822
Epoch 7 — Train Loss: 0.5655 — Val Loss: 0.5655
Epoch 8 — Train Loss: 0.5391 — Val Loss: 0.5879
Epoch 9 — Train Loss: 0.4967 — Val Loss: 0.5548
Epoch 10 — Train Loss: 0.4685 — Val Loss: 0.5627
Epoch 11 — Train Loss: 0.4283 — Val Loss: 0.5540
Epoch 12 — Train Loss: 0.4033 — Val Loss: 0.5342
Epoch 13 — Train Loss: 0.3579 — Val Loss: 0.5485
Epoch 14 — Train Loss: 0.3295 — Val Loss: 0.5641
Epoch 15 — Train Loss: 0.3054 — Val Loss: 0.5285
Epoch 16 — Train Loss: 0.2752 — Val Loss: 0.5601
Epoch 17 — Train Loss: 0.2374 — Val Loss: 0.6450
Epoch 18 — Train Loss: 0.2058 — Val Loss: 0.5612
Epoch 19 — Train Loss: 0.2037 — Val Loss: 0.5713
Epoch 20 — Train Loss: 0.1635 — Val Loss: 0.6032
Epoch 21 — Train Loss: 0.1344 — Val Loss: 0.6011
Epoch 22 — Train Loss: 0.1318 — Val Loss: 0.5961
Epoch 23 — Train Loss: 0.1051 — Val Loss: 0.5867
Epoch 24 — Train Loss: 0.0940 — Val Loss: 0.6389
Epoch 25 — Train Loss: 0.0837 — Val Loss: 0.6650
Early stopping.
Epoch 1 — Train Loss: 0.6913 — Val Loss: 0.6846
Epoch 2 — Train Loss: 0.6789 — Val Loss: 0.6643
Epoch 3 — Train Loss: 0.6658 — Val Loss: 0.6535
Epoch 4 — Train Loss: 0.6531 — Val Loss: 0.6428
Epoch 5 — Train Loss: 0.6537 — Val Loss: 0.6384
Epoch 6 — Train Loss: 0.6465 — Val Loss: 0.6337
Epoch 7 — Train Loss: 0.6417 — Val Loss: 0.6311
Epoch 8 — Train Loss: 0.6418 — Val Loss: 0.6268
Epoch 9 — Train Loss: 0.6329 — Val Loss: 0.6234
Epoch 10 — Train Loss: 0.6302 — Val Loss: 0.6192
Epoch 11 — Train Loss: 0.6343 — Val Loss: 0.6203
Epoch 12 — Train Loss: 0.6288 — Val Loss: 0.6168
Epoch 13 — Train Loss: 0.6223 — Val Loss: 0.6165
Epoch 14 — Train Loss: 0.6102 — Val Loss: 0.6150
Epoch 15 — Train Loss: 0.6118 — Val Loss: 0.6119
Epoch 16 — Train Loss: 0.6147 — Val Loss: 0.6089
Epoch 17 — Train Loss: 0.6042 — Val Loss: 0.6067
Epoch 18 — Train Loss: 0.6030 — Val Loss: 0.6040
Epoch 19 — Train Loss: 0.5956 — Val Loss: 0.6001
Epoch 20 — Train Loss: 0.5897 — Val Loss: 0.6012
Epoch 21 — Train Loss: 0.5851 — Val Loss: 0.6042
Epoch 22 — Train Loss: 0.5815 — Val Loss: 0.6013
Epoch 23 — Train Loss: 0.5726 — Val Loss: 0.5942
Epoch 24 — Train Loss: 0.5669 — Val Loss: 0.5978
Epoch 25 — Train Loss: 0.5610 — Val Loss: 0.5916
Epoch 26 — Train Loss: 0.5625 — Val Loss: 0.5955
Epoch 27 — Train Loss: 0.5587 — Val Loss: 0.5919
Epoch 28 — Train Loss: 0.5575 — Val Loss: 0.5851
Epoch 29 — Train Loss: 0.5380 — Val Loss: 0.5890
Epoch 30 — Train Loss: 0.5374 — Val Loss: 0.5867
Epoch 31 — Train Loss: 0.5273 — Val Loss: 0.5814
Epoch 32 — Train Loss: 0.5183 — Val Loss: 0.5872
Epoch 33 — Train Loss: 0.5182 — Val Loss: 0.5833
Epoch 34 — Train Loss: 0.5186 — Val Loss: 0.5785
Epoch 35 — Train Loss: 0.5133 — Val Loss: 0.5771
Epoch 36 — Train Loss: 0.5032 — Val Loss: 0.5797
Epoch 37 — Train Loss: 0.5006 — Val Loss: 0.5823
Epoch 38 — Train Loss: 0.4887 — Val Loss: 0.5827
Epoch 39 — Train Loss: 0.4813 — Val Loss: 0.5887
Epoch 40 — Train Loss: 0.4743 — Val Loss: 0.5782
Epoch 41 — Train Loss: 0.4775 — Val Loss: 0.5863
Epoch 42 — Train Loss: 0.4668 — Val Loss: 0.5758
Epoch 43 — Train Loss: 0.4634 — Val Loss: 0.5830
Epoch 44 — Train Loss: 0.4612 — Val Loss: 0.5742
Epoch 45 — Train Loss: 0.4562 — Val Loss: 0.5776
Epoch 46 — Train Loss: 0.4385 — Val Loss: 0.5769
Epoch 47 — Train Loss: 0.4355 — Val Loss: 0.5695
Epoch 48 — Train Loss: 0.4406 — Val Loss: 0.5751
Epoch 49 — Train Loss: 0.4256 — Val Loss: 0.5716
Epoch 50 — Train Loss: 0.4222 — Val Loss: 0.5697
Epoch 51 — Train Loss: 0.4107 — Val Loss: 0.5832
Epoch 52 — Train Loss: 0.4108 — Val Loss: 0.5701
Epoch 53 — Train Loss: 0.4034 — Val Loss: 0.5732
Epoch 54 — Train Loss: 0.4012 — Val Loss: 0.5990
Epoch 55 — Train Loss: 0.4032 — Val Loss: 0.5802
Epoch 56 — Train Loss: 0.3907 — Val Loss: 0.5793
Epoch 57 — Train Loss: 0.3833 — Val Loss: 0.6012
Early stopping.
Epoch 1 — Train Loss: 0.6983 — Val Loss: 0.6922
Epoch 2 — Train Loss: 0.6926 — Val Loss: 0.6924
Epoch 3 — Train Loss: 0.6933 — Val Loss: 0.6936
Epoch 4 — Train Loss: 0.6936 — Val Loss: 0.6932
Epoch 5 — Train Loss: 0.6929 — Val Loss: 0.6921
Epoch 6 — Train Loss: 0.6931 — Val Loss: 0.6932
Epoch 7 — Train Loss: 0.6977 — Val Loss: 0.6913
Epoch 8 — Train Loss: 0.6959 — Val Loss: 0.6904
Epoch 9 — Train Loss: 0.6928 — Val Loss: 0.7011
Epoch 10 — Train Loss: 0.6964 — Val Loss: 0.6934
Epoch 11 — Train Loss: 0.6938 — Val Loss: 0.6930
Epoch 12 — Train Loss: 0.6932 — Val Loss: 0.6932
Epoch 13 — Train Loss: 0.6933 — Val Loss: 0.6944
Epoch 14 — Train Loss: 0.6971 — Val Loss: 0.6911
Epoch 15 — Train Loss: 0.6942 — Val Loss: 0.6931
Epoch 16 — Train Loss: 0.6932 — Val Loss: 0.6928
Epoch 17 — Train Loss: 0.6932 — Val Loss: 0.6932
Epoch 18 — Train Loss: 0.6933 — Val Loss: 0.6928
Early stopping.
Epoch 1 — Train Loss: 0.6921 — Val Loss: 0.6882
Epoch 2 — Train Loss: 0.6799 — Val Loss: 0.6618
Epoch 3 — Train Loss: 0.6580 — Val Loss: 0.6499
Epoch 4 — Train Loss: 0.6512 — Val Loss: 0.6330
Epoch 5 — Train Loss: 0.6377 — Val Loss: 0.6286
Epoch 6 — Train Loss: 0.6286 — Val Loss: 0.6236
Epoch 7 — Train Loss: 0.6232 — Val Loss: 0.6258
Epoch 8 — Train Loss: 0.6140 — Val Loss: 0.6067
Epoch 9 — Train Loss: 0.6037 — Val Loss: 0.6016
Epoch 10 — Train Loss: 0.5926 — Val Loss: 0.5968
Epoch 11 — Train Loss: 0.5785 — Val Loss: 0.5935
Epoch 12 — Train Loss: 0.5641 — Val Loss: 0.5989
Epoch 13 — Train Loss: 0.5447 — Val Loss: 0.5987
Epoch 14 — Train Loss: 0.5328 — Val Loss: 0.5881
Epoch 15 — Train Loss: 0.5257 — Val Loss: 0.5964
Epoch 16 — Train Loss: 0.5020 — Val Loss: 0.5850
Epoch 17 — Train Loss: 0.4866 — Val Loss: 0.5921
Epoch 18 — Train Loss: 0.4837 — Val Loss: 0.5831
Epoch 19 — Train Loss: 0.4616 — Val Loss: 0.5743
Epoch 20 — Train Loss: 0.4447 — Val Loss: 0.5769
Epoch 21 — Train Loss: 0.4469 — Val Loss: 0.5924
Epoch 22 — Train Loss: 0.4291 — Val Loss: 0.5746
Epoch 23 — Train Loss: 0.4161 — Val Loss: 0.5995
Epoch 24 — Train Loss: 0.4053 — Val Loss: 0.5869
Epoch 25 — Train Loss: 0.3867 — Val Loss: 0.5917
Epoch 26 — Train Loss: 0.3714 — Val Loss: 0.5688
Epoch 27 — Train Loss: 0.3574 — Val Loss: 0.5761
Epoch 28 — Train Loss: 0.3516 — Val Loss: 0.5746
Epoch 29 — Train Loss: 0.3289 — Val Loss: 0.5849
Epoch 30 — Train Loss: 0.3309 — Val Loss: 0.5711
Epoch 31 — Train Loss: 0.3131 — Val Loss: 0.5640
Epoch 32 — Train Loss: 0.3031 — Val Loss: 0.5775
Epoch 33 — Train Loss: 0.2904 — Val Loss: 0.5730
Epoch 34 — Train Loss: 0.2845 — Val Loss: 0.5713
Epoch 35 — Train Loss: 0.2618 — Val Loss: 0.5941
Epoch 36 — Train Loss: 0.2513 — Val Loss: 0.5751
Epoch 37 — Train Loss: 0.2527 — Val Loss: 0.5839
Epoch 38 — Train Loss: 0.2378 — Val Loss: 0.5725
Epoch 39 — Train Loss: 0.2227 — Val Loss: 0.5744
Epoch 40 — Train Loss: 0.2148 — Val Loss: 0.5841
Epoch 41 — Train Loss: 0.2050 — Val Loss: 0.6060
Early stopping.
Epoch 1 — Train Loss: 0.6921 — Val Loss: 0.6879
Epoch 2 — Train Loss: 0.6756 — Val Loss: 0.6456
Epoch 3 — Train Loss: 0.6476 — Val Loss: 0.6243
Epoch 4 — Train Loss: 0.6349 — Val Loss: 0.6177
Epoch 5 — Train Loss: 0.6203 — Val Loss: 0.6201
Epoch 6 — Train Loss: 0.6113 — Val Loss: 0.6084
Epoch 7 — Train Loss: 0.6013 — Val Loss: 0.6001
Epoch 8 — Train Loss: 0.5777 — Val Loss: 0.6000
Epoch 9 — Train Loss: 0.5593 — Val Loss: 0.6021
Epoch 10 — Train Loss: 0.5398 — Val Loss: 0.5914
Epoch 11 — Train Loss: 0.5216 — Val Loss: 0.5819
Epoch 12 — Train Loss: 0.4974 — Val Loss: 0.5743
Epoch 13 — Train Loss: 0.4720 — Val Loss: 0.5991
Epoch 14 — Train Loss: 0.4697 — Val Loss: 0.5823
Epoch 15 — Train Loss: 0.4305 — Val Loss: 0.5647
Epoch 16 — Train Loss: 0.4079 — Val Loss: 0.5697
Epoch 17 — Train Loss: 0.3815 — Val Loss: 0.5819
Epoch 18 — Train Loss: 0.3588 — Val Loss: 0.5632
Epoch 19 — Train Loss: 0.3420 — Val Loss: 0.5606
Epoch 20 — Train Loss: 0.3160 — Val Loss: 0.5760
Epoch 21 — Train Loss: 0.3002 — Val Loss: 0.5784
Epoch 22 — Train Loss: 0.2769 — Val Loss: 0.5908
Epoch 23 — Train Loss: 0.2600 — Val Loss: 0.5800
Epoch 24 — Train Loss: 0.2432 — Val Loss: 0.6003
Epoch 25 — Train Loss: 0.2227 — Val Loss: 0.5844
Epoch 26 — Train Loss: 0.2128 — Val Loss: 0.5825
Epoch 27 — Train Loss: 0.1910 — Val Loss: 0.5902
Epoch 28 — Train Loss: 0.1716 — Val Loss: 0.5807
Epoch 29 — Train Loss: 0.1640 — Val Loss: 0.5923
Early stopping.
Epoch 1 — Train Loss: 0.6892 — Val Loss: 0.6733
Epoch 2 — Train Loss: 0.6694 — Val Loss: 0.6459
Epoch 3 — Train Loss: 0.6513 — Val Loss: 0.6288
Epoch 4 — Train Loss: 0.6377 — Val Loss: 0.6174
Epoch 5 — Train Loss: 0.6263 — Val Loss: 0.6209
Epoch 6 — Train Loss: 0.6225 — Val Loss: 0.6076
Epoch 7 — Train Loss: 0.6004 — Val Loss: 0.5998
Epoch 8 — Train Loss: 0.5862 — Val Loss: 0.5890
Epoch 9 — Train Loss: 0.5698 — Val Loss: 0.5865
Epoch 10 — Train Loss: 0.5558 — Val Loss: 0.5966
Epoch 11 — Train Loss: 0.5357 — Val Loss: 0.5784
Epoch 12 — Train Loss: 0.5264 — Val Loss: 0.5676
Epoch 13 — Train Loss: 0.4858 — Val Loss: 0.5737
Epoch 14 — Train Loss: 0.4776 — Val Loss: 0.5626
Epoch 15 — Train Loss: 0.4513 — Val Loss: 0.5564
Epoch 16 — Train Loss: 0.4269 — Val Loss: 0.6089
Epoch 17 — Train Loss: 0.4112 — Val Loss: 0.5497
Epoch 18 — Train Loss: 0.3929 — Val Loss: 0.5757
Epoch 19 — Train Loss: 0.3699 — Val Loss: 0.5774
Epoch 20 — Train Loss: 0.3500 — Val Loss: 0.5584
Epoch 21 — Train Loss: 0.3316 — Val Loss: 0.5447
Epoch 22 — Train Loss: 0.3155 — Val Loss: 0.5531
Epoch 23 — Train Loss: 0.2861 — Val Loss: 0.5686
Epoch 24 — Train Loss: 0.2808 — Val Loss: 0.5565
Epoch 25 — Train Loss: 0.2712 — Val Loss: 0.5484
Epoch 26 — Train Loss: 0.2428 — Val Loss: 0.5800
Epoch 27 — Train Loss: 0.2250 — Val Loss: 0.5725
Epoch 28 — Train Loss: 0.2211 — Val Loss: 0.5544
Epoch 29 — Train Loss: 0.1950 — Val Loss: 0.5622
Epoch 30 — Train Loss: 0.1848 — Val Loss: 0.5738
Epoch 31 — Train Loss: 0.1706 — Val Loss: 0.5708
Early stopping.
Epoch 1 — Train Loss: 0.6985 — Val Loss: 0.6932
Epoch 2 — Train Loss: 0.6932 — Val Loss: 0.6931
Epoch 3 — Train Loss: 0.6932 — Val Loss: 0.6932
Epoch 4 — Train Loss: 0.6937 — Val Loss: 0.6932
Epoch 5 — Train Loss: 0.6931 — Val Loss: 0.6932
Epoch 6 — Train Loss: 0.6931 — Val Loss: 0.6931
Epoch 7 — Train Loss: 0.6932 — Val Loss: 0.6931
Epoch 8 — Train Loss: 0.6931 — Val Loss: 0.6932
Epoch 9 — Train Loss: 0.6932 — Val Loss: 0.6927
Epoch 10 — Train Loss: 0.6930 — Val Loss: 0.6921
Epoch 11 — Train Loss: 0.6928 — Val Loss: 0.6915
Epoch 12 — Train Loss: 0.6959 — Val Loss: 0.6904
Epoch 13 — Train Loss: 0.6904 — Val Loss: 0.6910
Epoch 14 — Train Loss: 0.6911 — Val Loss: 0.6934
Epoch 15 — Train Loss: 0.6931 — Val Loss: 0.6936
Epoch 16 — Train Loss: 0.6931 — Val Loss: 0.6931
Epoch 17 — Train Loss: 0.6927 — Val Loss: 0.6929
Epoch 18 — Train Loss: 0.6934 — Val Loss: 0.6930
Epoch 19 — Train Loss: 0.6929 — Val Loss: 0.6936
Epoch 20 — Train Loss: 0.6929 — Val Loss: 0.6923
Epoch 21 — Train Loss: 0.6929 — Val Loss: 0.6928
Epoch 22 — Train Loss: 0.6907 — Val Loss: 0.6893
Epoch 23 — Train Loss: 0.6888 — Val Loss: 0.6910
Epoch 24 — Train Loss: 0.6878 — Val Loss: 0.6881
Epoch 25 — Train Loss: 0.6864 — Val Loss: 0.6877
Epoch 26 — Train Loss: 0.6922 — Val Loss: 0.6880
Epoch 27 — Train Loss: 0.6906 — Val Loss: 0.6869
Epoch 28 — Train Loss: 0.6920 — Val Loss: 0.6881
Epoch 29 — Train Loss: 0.6900 — Val Loss: 0.6835
Epoch 30 — Train Loss: 0.6849 — Val Loss: 0.6864
Epoch 31 — Train Loss: 0.6851 — Val Loss: 0.6848
Epoch 32 — Train Loss: 0.6850 — Val Loss: 0.6884
Epoch 33 — Train Loss: 0.6841 — Val Loss: 0.6826
Epoch 34 — Train Loss: 0.6825 — Val Loss: 0.6831
Epoch 35 — Train Loss: 0.6826 — Val Loss: 0.6820
Epoch 36 — Train Loss: 0.6837 — Val Loss: 0.6831
Epoch 37 — Train Loss: 0.6835 — Val Loss: 0.6826
Epoch 38 — Train Loss: 0.6807 — Val Loss: 0.6800
Epoch 39 — Train Loss: 0.6824 — Val Loss: 0.6842
Epoch 40 — Train Loss: 0.6831 — Val Loss: 0.6839
Epoch 41 — Train Loss: 0.6819 — Val Loss: 0.6835
Epoch 42 — Train Loss: 0.6831 — Val Loss: 0.6845
Epoch 43 — Train Loss: 0.6838 — Val Loss: 0.6837
Epoch 44 — Train Loss: 0.6830 — Val Loss: 0.6837
Epoch 45 — Train Loss: 0.6808 — Val Loss: 0.6839
Epoch 46 — Train Loss: 0.6818 — Val Loss: 0.6843
Epoch 47 — Train Loss: 0.6785 — Val Loss: 0.6818
Epoch 48 — Train Loss: 0.6795 — Val Loss: 0.6811
Early stopping.
Epoch 1 — Train Loss: 0.6922 — Val Loss: 0.6902
Epoch 2 — Train Loss: 0.6867 — Val Loss: 0.6808
Epoch 3 — Train Loss: 0.6752 — Val Loss: 0.6680
Epoch 4 — Train Loss: 0.6661 — Val Loss: 0.6579
Epoch 5 — Train Loss: 0.6623 — Val Loss: 0.6507
Epoch 6 — Train Loss: 0.6584 — Val Loss: 0.6466
Epoch 7 — Train Loss: 0.6521 — Val Loss: 0.6454
Epoch 8 — Train Loss: 0.6514 — Val Loss: 0.6412
Epoch 9 — Train Loss: 0.6492 — Val Loss: 0.6342
Epoch 10 — Train Loss: 0.6441 — Val Loss: 0.6343
Epoch 11 — Train Loss: 0.6424 — Val Loss: 0.6301
Epoch 12 — Train Loss: 0.6386 — Val Loss: 0.6328
Epoch 13 — Train Loss: 0.6356 — Val Loss: 0.6256
Epoch 14 — Train Loss: 0.6383 — Val Loss: 0.6254
Epoch 15 — Train Loss: 0.6328 — Val Loss: 0.6220
Epoch 16 — Train Loss: 0.6246 — Val Loss: 0.6217
Epoch 17 — Train Loss: 0.6230 — Val Loss: 0.6206
Epoch 18 — Train Loss: 0.6297 — Val Loss: 0.6183
Epoch 19 — Train Loss: 0.6202 — Val Loss: 0.6176
Epoch 20 — Train Loss: 0.6048 — Val Loss: 0.6170
Epoch 21 — Train Loss: 0.6168 — Val Loss: 0.6142
Epoch 22 — Train Loss: 0.6078 — Val Loss: 0.6101
Epoch 23 — Train Loss: 0.6015 — Val Loss: 0.6114
Epoch 24 — Train Loss: 0.6033 — Val Loss: 0.6099
Epoch 25 — Train Loss: 0.6049 — Val Loss: 0.6126
Epoch 26 — Train Loss: 0.5911 — Val Loss: 0.6067
Epoch 27 — Train Loss: 0.6018 — Val Loss: 0.6134
Epoch 28 — Train Loss: 0.5860 — Val Loss: 0.6013
Epoch 29 — Train Loss: 0.5873 — Val Loss: 0.6008
Epoch 30 — Train Loss: 0.5912 — Val Loss: 0.6008
Epoch 31 — Train Loss: 0.5792 — Val Loss: 0.6029
Epoch 32 — Train Loss: 0.5708 — Val Loss: 0.5973
Epoch 33 — Train Loss: 0.5658 — Val Loss: 0.6012
Epoch 34 — Train Loss: 0.5608 — Val Loss: 0.5988
Epoch 35 — Train Loss: 0.5469 — Val Loss: 0.6042
Epoch 36 — Train Loss: 0.5523 — Val Loss: 0.5958
Epoch 37 — Train Loss: 0.5386 — Val Loss: 0.5968
Epoch 38 — Train Loss: 0.5375 — Val Loss: 0.5922
Epoch 39 — Train Loss: 0.5357 — Val Loss: 0.5957
Epoch 40 — Train Loss: 0.5207 — Val Loss: 0.5994
Epoch 41 — Train Loss: 0.5316 — Val Loss: 0.5977
Epoch 42 — Train Loss: 0.5116 — Val Loss: 0.5949
Epoch 43 — Train Loss: 0.5033 — Val Loss: 0.5919
Epoch 44 — Train Loss: 0.5131 — Val Loss: 0.5911
Epoch 45 — Train Loss: 0.5063 — Val Loss: 0.5829
Epoch 46 — Train Loss: 0.4909 — Val Loss: 0.5990
Epoch 47 — Train Loss: 0.4899 — Val Loss: 0.5915
Epoch 48 — Train Loss: 0.4764 — Val Loss: 0.5918
Epoch 49 — Train Loss: 0.4741 — Val Loss: 0.5928
Epoch 50 — Train Loss: 0.4652 — Val Loss: 0.5930
Epoch 51 — Train Loss: 0.4633 — Val Loss: 0.5910
Epoch 52 — Train Loss: 0.4534 — Val Loss: 0.5913
Epoch 53 — Train Loss: 0.4462 — Val Loss: 0.6328
Epoch 54 — Train Loss: 0.4451 — Val Loss: 0.5925
Epoch 55 — Train Loss: 0.4334 — Val Loss: 0.5824
Epoch 56 — Train Loss: 0.4309 — Val Loss: 0.5829
Epoch 57 — Train Loss: 0.4165 — Val Loss: 0.5967
Epoch 58 — Train Loss: 0.4090 — Val Loss: 0.5975
Epoch 59 — Train Loss: 0.3967 — Val Loss: 0.5968
Epoch 60 — Train Loss: 0.3984 — Val Loss: 0.5940
Epoch 61 — Train Loss: 0.3860 — Val Loss: 0.5919
Epoch 62 — Train Loss: 0.3899 — Val Loss: 0.6329
Epoch 63 — Train Loss: 0.3754 — Val Loss: 0.6011
Epoch 64 — Train Loss: 0.3643 — Val Loss: 0.6113
Epoch 65 — Train Loss: 0.3590 — Val Loss: 0.5964
Early stopping.
Epoch 1 — Train Loss: 0.6914 — Val Loss: 0.6862
Epoch 2 — Train Loss: 0.6773 — Val Loss: 0.6593
Epoch 3 — Train Loss: 0.6584 — Val Loss: 0.6405
Epoch 4 — Train Loss: 0.6487 — Val Loss: 0.6306
Epoch 5 — Train Loss: 0.6411 — Val Loss: 0.6256
Epoch 6 — Train Loss: 0.6318 — Val Loss: 0.6137
Epoch 7 — Train Loss: 0.6221 — Val Loss: 0.6190
Epoch 8 — Train Loss: 0.6104 — Val Loss: 0.6092
Epoch 9 — Train Loss: 0.6152 — Val Loss: 0.6027
Epoch 10 — Train Loss: 0.5994 — Val Loss: 0.5958
Epoch 11 — Train Loss: 0.5882 — Val Loss: 0.5951
Epoch 12 — Train Loss: 0.5811 — Val Loss: 0.5917
Epoch 13 — Train Loss: 0.5692 — Val Loss: 0.5888
Epoch 14 — Train Loss: 0.5652 — Val Loss: 0.5949
Epoch 15 — Train Loss: 0.5475 — Val Loss: 0.5980
Epoch 16 — Train Loss: 0.5407 — Val Loss: 0.6235
Epoch 17 — Train Loss: 0.5228 — Val Loss: 0.5897
Epoch 18 — Train Loss: 0.5174 — Val Loss: 0.5855
Epoch 19 — Train Loss: 0.5048 — Val Loss: 0.5827
Epoch 20 — Train Loss: 0.4937 — Val Loss: 0.5850
Epoch 21 — Train Loss: 0.4717 — Val Loss: 0.5790
Epoch 22 — Train Loss: 0.4694 — Val Loss: 0.5740
Epoch 23 — Train Loss: 0.4449 — Val Loss: 0.5839
Epoch 24 — Train Loss: 0.4414 — Val Loss: 0.5757
Epoch 25 — Train Loss: 0.4248 — Val Loss: 0.5769
Epoch 26 — Train Loss: 0.4169 — Val Loss: 0.5742
Epoch 27 — Train Loss: 0.4019 — Val Loss: 0.5803
Epoch 28 — Train Loss: 0.3933 — Val Loss: 0.5776
Epoch 29 — Train Loss: 0.3803 — Val Loss: 0.5797
Epoch 30 — Train Loss: 0.3549 — Val Loss: 0.5744
Epoch 31 — Train Loss: 0.3546 — Val Loss: 0.5779
Epoch 32 — Train Loss: 0.3360 — Val Loss: 0.5714
Epoch 33 — Train Loss: 0.3299 — Val Loss: 0.5980
Epoch 34 — Train Loss: 0.3175 — Val Loss: 0.5805
Epoch 35 — Train Loss: 0.3106 — Val Loss: 0.5711
Epoch 36 — Train Loss: 0.2994 — Val Loss: 0.5710
Epoch 37 — Train Loss: 0.3028 — Val Loss: 0.5752
Epoch 38 — Train Loss: 0.2742 — Val Loss: 0.5789
Epoch 39 — Train Loss: 0.2697 — Val Loss: 0.5814
Epoch 40 — Train Loss: 0.2565 — Val Loss: 0.5859
Epoch 41 — Train Loss: 0.2382 — Val Loss: 0.5925
Epoch 42 — Train Loss: 0.2409 — Val Loss: 0.5789
Epoch 43 — Train Loss: 0.2237 — Val Loss: 0.5920
Epoch 44 — Train Loss: 0.2173 — Val Loss: 0.5929
Epoch 45 — Train Loss: 0.2049 — Val Loss: 0.5718
Epoch 46 — Train Loss: 0.1951 — Val Loss: 0.6033
Early stopping.
Epoch 1 — Train Loss: 0.6926 — Val Loss: 0.6916
Epoch 2 — Train Loss: 0.6908 — Val Loss: 0.6891
Epoch 3 — Train Loss: 0.6883 — Val Loss: 0.6858
Epoch 4 — Train Loss: 0.6851 — Val Loss: 0.6819
Epoch 5 — Train Loss: 0.6813 — Val Loss: 0.6773
Epoch 6 — Train Loss: 0.6771 — Val Loss: 0.6722
Epoch 7 — Train Loss: 0.6726 — Val Loss: 0.6671
Epoch 8 — Train Loss: 0.6697 — Val Loss: 0.6625
Epoch 9 — Train Loss: 0.6633 — Val Loss: 0.6571
Epoch 10 — Train Loss: 0.6636 — Val Loss: 0.6538
Epoch 11 — Train Loss: 0.6551 — Val Loss: 0.6492
Epoch 12 — Train Loss: 0.6480 — Val Loss: 0.6446
Epoch 13 — Train Loss: 0.6481 — Val Loss: 0.6413
Epoch 14 — Train Loss: 0.6519 — Val Loss: 0.6395
Epoch 15 — Train Loss: 0.6483 — Val Loss: 0.6364
Epoch 16 — Train Loss: 0.6461 — Val Loss: 0.6343
Epoch 17 — Train Loss: 0.6425 — Val Loss: 0.6332
Epoch 18 — Train Loss: 0.6439 — Val Loss: 0.6308
Epoch 19 — Train Loss: 0.6425 — Val Loss: 0.6296
Epoch 20 — Train Loss: 0.6425 — Val Loss: 0.6295
Epoch 21 — Train Loss: 0.6385 — Val Loss: 0.6277
Epoch 22 — Train Loss: 0.6416 — Val Loss: 0.6259
Epoch 23 — Train Loss: 0.6290 — Val Loss: 0.6241
Epoch 24 — Train Loss: 0.6368 — Val Loss: 0.6236
Epoch 25 — Train Loss: 0.6362 — Val Loss: 0.6226
Epoch 26 — Train Loss: 0.6294 — Val Loss: 0.6210
Epoch 27 — Train Loss: 0.6294 — Val Loss: 0.6210
Epoch 28 — Train Loss: 0.6316 — Val Loss: 0.6211
Epoch 29 — Train Loss: 0.6234 — Val Loss: 0.6188
Epoch 30 — Train Loss: 0.6229 — Val Loss: 0.6184
Epoch 31 — Train Loss: 0.6244 — Val Loss: 0.6182
Epoch 32 — Train Loss: 0.6257 — Val Loss: 0.6172
Epoch 33 — Train Loss: 0.6167 — Val Loss: 0.6149
Epoch 34 — Train Loss: 0.6206 — Val Loss: 0.6134
Epoch 35 — Train Loss: 0.6121 — Val Loss: 0.6125
Epoch 36 — Train Loss: 0.6170 — Val Loss: 0.6115
Epoch 37 — Train Loss: 0.6096 — Val Loss: 0.6105
Epoch 38 — Train Loss: 0.6176 — Val Loss: 0.6109
Epoch 39 — Train Loss: 0.6118 — Val Loss: 0.6095
Epoch 40 — Train Loss: 0.6062 — Val Loss: 0.6067
Epoch 41 — Train Loss: 0.6053 — Val Loss: 0.6054
Epoch 42 — Train Loss: 0.6080 — Val Loss: 0.6048
Epoch 43 — Train Loss: 0.6019 — Val Loss: 0.6039
Epoch 44 — Train Loss: 0.6037 — Val Loss: 0.6042
Epoch 45 — Train Loss: 0.6015 — Val Loss: 0.6037
Epoch 46 — Train Loss: 0.5966 — Val Loss: 0.6026
Epoch 47 — Train Loss: 0.5950 — Val Loss: 0.6027
Epoch 48 — Train Loss: 0.5930 — Val Loss: 0.6034
Epoch 49 — Train Loss: 0.5936 — Val Loss: 0.6018
Epoch 50 — Train Loss: 0.5944 — Val Loss: 0.6018
Epoch 51 — Train Loss: 0.5882 — Val Loss: 0.6007
Epoch 52 — Train Loss: 0.5884 — Val Loss: 0.6016
Epoch 53 — Train Loss: 0.5885 — Val Loss: 0.5993
Epoch 54 — Train Loss: 0.5832 — Val Loss: 0.5995
Epoch 55 — Train Loss: 0.5869 — Val Loss: 0.5993
Epoch 56 — Train Loss: 0.5809 — Val Loss: 0.5993
Epoch 57 — Train Loss: 0.5766 — Val Loss: 0.5981
Epoch 58 — Train Loss: 0.5751 — Val Loss: 0.5985
Epoch 59 — Train Loss: 0.5728 — Val Loss: 0.5981
Epoch 60 — Train Loss: 0.5766 — Val Loss: 0.5963
Epoch 61 — Train Loss: 0.5649 — Val Loss: 0.5956
Epoch 62 — Train Loss: 0.5663 — Val Loss: 0.5980
Epoch 63 — Train Loss: 0.5618 — Val Loss: 0.5956
Epoch 64 — Train Loss: 0.5601 — Val Loss: 0.5938
Epoch 65 — Train Loss: 0.5609 — Val Loss: 0.5944
Epoch 66 — Train Loss: 0.5509 — Val Loss: 0.5932
Epoch 67 — Train Loss: 0.5583 — Val Loss: 0.5941
Epoch 68 — Train Loss: 0.5507 — Val Loss: 0.5938
Epoch 69 — Train Loss: 0.5515 — Val Loss: 0.5950
Epoch 70 — Train Loss: 0.5462 — Val Loss: 0.5924
Epoch 71 — Train Loss: 0.5454 — Val Loss: 0.5933
Epoch 72 — Train Loss: 0.5464 — Val Loss: 0.5954
Epoch 73 — Train Loss: 0.5437 — Val Loss: 0.5923
Epoch 74 — Train Loss: 0.5382 — Val Loss: 0.5938
Epoch 75 — Train Loss: 0.5355 — Val Loss: 0.5923
Epoch 76 — Train Loss: 0.5316 — Val Loss: 0.5909
Epoch 77 — Train Loss: 0.5302 — Val Loss: 0.5929
Epoch 78 — Train Loss: 0.5333 — Val Loss: 0.5886
Epoch 79 — Train Loss: 0.5313 — Val Loss: 0.5958
Epoch 80 — Train Loss: 0.5171 — Val Loss: 0.5927
Epoch 81 — Trai