nohup: ignoring input
[I 2025-05-09 00:10:10,857] A new study created in memory with name: no-name-eddb8937-442a-46e8-91d7-c9dd8d8f84d7
/sise/home/shirmord/hw/layla_tov.py:209: FutureWarning: suggest_loguniform has been deprecated in v3.0.0. This feature will be removed in v6.0.0. See https://github.com/optuna/optuna/releases/tag/v3.0.0. Use suggest_float(..., log=True) instead.
  lr = trial.suggest_loguniform('lr', 1e-6, 1e-3)
/sise/home/shirmord/hw/layla_tov.py:210: FutureWarning: suggest_loguniform has been deprecated in v3.0.0. This feature will be removed in v6.0.0. See https://github.com/optuna/optuna/releases/tag/v3.0.0. Use suggest_float(..., log=True) instead.
  weight_decay = trial.suggest_loguniform('weight_decay', 1e-6, 1e-2)
[I 2025-05-09 00:16:47,801] Trial 0 finished with value: 0.6650228912180121 and parameters: {'lr': 5.426237373711102e-05, 'weight_decay': 7.126239823780911e-05, 'optimizer': 'RMSprop', 'dropout_rate': 0.07738544443306655}. Best is trial 0 with value: 0.6650228912180121.
[I 2025-05-09 00:29:22,661] Trial 1 finished with value: 0.6011788552457636 and parameters: {'lr': 3.697484638109127e-06, 'weight_decay': 0.00031359134430164937, 'optimizer': 'RMSprop', 'dropout_rate': 0.16289878693319515}. Best is trial 1 with value: 0.6011788552457636.
[I 2025-05-09 00:33:11,913] Trial 2 finished with value: 0.6927823630246249 and parameters: {'lr': 0.0007851310077194194, 'weight_decay': 0.001148340721519912, 'optimizer': 'RMSprop', 'dropout_rate': 0.193161625051346}. Best is trial 1 with value: 0.6011788552457636.
[I 2025-05-09 00:42:00,880] Trial 3 finished with value: 0.6059955965388905 and parameters: {'lr': 9.155427525213544e-06, 'weight_decay': 0.00046076184415912163, 'optimizer': 'AdamW', 'dropout_rate': 0.040545007497151564}. Best is trial 1 with value: 0.6011788552457636.
[I 2025-05-09 00:48:16,429] Trial 4 finished with value: 0.592334707216783 and parameters: {'lr': 1.7952021144757583e-05, 'weight_decay': 4.0986191240726e-05, 'optimizer': 'Adam', 'dropout_rate': 0.32972035412061784}. Best is trial 4 with value: 0.592334707216783.
[I 2025-05-09 00:55:09,543] Trial 5 finished with value: 0.5708219614895907 and parameters: {'lr': 1.7577173531172546e-05, 'weight_decay': 0.0004517784977955365, 'optimizer': 'Adam', 'dropout_rate': 0.43949025271099856}. Best is trial 5 with value: 0.5708219614895907.
[I 2025-05-09 01:05:51,998] Trial 6 finished with value: 0.6810901403427124 and parameters: {'lr': 0.0006308033223695983, 'weight_decay': 4.993968416596079e-05, 'optimizer': 'Adam', 'dropout_rate': 0.012440280360736855}. Best is trial 5 with value: 0.5708219614895907.
[I 2025-05-09 01:19:40,417] Trial 7 finished with value: 0.5964023503390226 and parameters: {'lr': 4.854411933549331e-06, 'weight_decay': 0.007458828296609901, 'optimizer': 'RMSprop', 'dropout_rate': 0.42641819021123}. Best is trial 5 with value: 0.5708219614895907.
[I 2025-05-09 01:29:35,891] Trial 8 finished with value: 0.6033142046494917 and parameters: {'lr': 8.303629618070938e-06, 'weight_decay': 0.0002873664061896236, 'optimizer': 'Adam', 'dropout_rate': 0.26299453477819484}. Best is trial 5 with value: 0.5708219614895907.
[I 2025-05-09 01:50:43,419] Trial 9 finished with value: 0.5954649253325028 and parameters: {'lr': 1.5191193172804112e-06, 'weight_decay': 0.0004920667483831957, 'optimizer': 'RMSprop', 'dropout_rate': 0.37243040215883755}. Best is trial 5 with value: 0.5708219614895907.
[I 2025-05-09 01:54:36,751] Trial 10 finished with value: 0.624199880253185 and parameters: {'lr': 8.597558615268436e-05, 'weight_decay': 2.1041227799337853e-06, 'optimizer': 'AdamW', 'dropout_rate': 0.4881850998577458}. Best is trial 5 with value: 0.5708219614895907.
[I 2025-05-09 01:59:25,396] Trial 11 finished with value: 0.6083880229429766 and parameters: {'lr': 2.9336143959726073e-05, 'weight_decay': 1.0930060042234655e-05, 'optimizer': 'Adam', 'dropout_rate': 0.32464154921690214}. Best is trial 5 with value: 0.5708219614895907.
[I 2025-05-09 02:03:53,186] Trial 12 finished with value: 0.5992629679766568 and parameters: {'lr': 2.3240163764702856e-05, 'weight_decay': 7.395065681446916e-06, 'optimizer': 'Adam', 'dropout_rate': 0.48555458222106684}. Best is trial 5 with value: 0.5708219614895907.
[I 2025-05-09 02:07:55,593] Trial 13 finished with value: 0.6582013346932151 and parameters: {'lr': 0.00015919499047159955, 'weight_decay': 1.748094940437021e-05, 'optimizer': 'Adam', 'dropout_rate': 0.3562228073032312}. Best is trial 5 with value: 0.5708219614895907.
[I 2025-05-09 02:16:41,544] Trial 14 finished with value: 0.569784059307792 and parameters: {'lr': 1.3899387675301466e-05, 'weight_decay': 0.002947661091456632, 'optimizer': 'Adam', 'dropout_rate': 0.2838999192768955}. Best is trial 14 with value: 0.569784059307792.
[I 2025-05-09 02:45:46,765] Trial 15 finished with value: 0.5924444241957231 and parameters: {'lr': 1.001189827316292e-06, 'weight_decay': 0.004145766247477206, 'optimizer': 'Adam', 'dropout_rate': 0.25262612818512725}. Best is trial 14 with value: 0.569784059307792.
[I 2025-05-09 02:50:41,345] Trial 16 finished with value: 0.5626492088491266 and parameters: {'lr': 0.0001818662777894983, 'weight_decay': 0.0025046514679053274, 'optimizer': 'Adam', 'dropout_rate': 0.4189828670198841}. Best is trial 16 with value: 0.5626492088491266.
[I 2025-05-09 02:54:58,891] Trial 17 finished with value: 0.6424104278737849 and parameters: {'lr': 0.00029353409609389095, 'weight_decay': 0.002649645883912873, 'optimizer': 'AdamW', 'dropout_rate': 0.1763897689424668}. Best is trial 16 with value: 0.5626492088491266.
[I 2025-05-09 03:00:57,921] Trial 18 finished with value: 0.6090348091992465 and parameters: {'lr': 0.00020488938680819068, 'weight_decay': 0.0014158046858025102, 'optimizer': 'Adam', 'dropout_rate': 0.4024732649217752}. Best is trial 16 with value: 0.5626492088491266.
[I 2025-05-09 03:10:17,742] Trial 19 finished with value: 0.5538469379598444 and parameters: {'lr': 8.273437875792358e-05, 'weight_decay': 0.009182324832365918, 'optimizer': 'Adam', 'dropout_rate': 0.2864930274013586}. Best is trial 19 with value: 0.5538469379598444.
[I 2025-05-09 03:14:21,006] Trial 20 finished with value: 0.6031221476468173 and parameters: {'lr': 7.14417264610202e-05, 'weight_decay': 0.008116981466400114, 'optimizer': 'AdamW', 'dropout_rate': 0.1271740384193086}. Best is trial 19 with value: 0.5538469379598444.
[I 2025-05-09 03:21:48,763] Trial 21 finished with value: 0.594060725515539 and parameters: {'lr': 0.00011825326635360601, 'weight_decay': 0.0022531057928827985, 'optimizer': 'Adam', 'dropout_rate': 0.2951429017373259}. Best is trial 19 with value: 0.5538469379598444.
[I 2025-05-09 03:32:29,857] Trial 22 finished with value: 0.5744346943768588 and parameters: {'lr': 0.00037009730528549833, 'weight_decay': 0.004818857069642537, 'optimizer': 'Adam', 'dropout_rate': 0.218970337465265}. Best is trial 19 with value: 0.5538469379598444.
[I 2025-05-09 03:38:39,376] Trial 23 finished with value: 0.5567481593652205 and parameters: {'lr': 5.118088384913997e-05, 'weight_decay': 0.0013279997492401622, 'optimizer': 'Adam', 'dropout_rate': 0.2928603743103713}. Best is trial 19 with value: 0.5538469379598444.
[I 2025-05-09 03:43:45,554] Trial 24 finished with value: 0.5865592327984896 and parameters: {'lr': 4.120418216867216e-05, 'weight_decay': 0.0009117210587130452, 'optimizer': 'Adam', 'dropout_rate': 0.3812982588609304}. Best is trial 19 with value: 0.5538469379598444.
[I 2025-05-09 03:48:27,228] Trial 25 finished with value: 0.6332137606360696 and parameters: {'lr': 0.00012136433254504665, 'weight_decay': 0.00016140329808065807, 'optimizer': 'Adam', 'dropout_rate': 0.2272348326193461}. Best is trial 19 with value: 0.5538469379598444.
[I 2025-05-09 03:50:48,978] Trial 26 finished with value: 0.6931674881414933 and parameters: {'lr': 0.00046575651115391987, 'weight_decay': 0.00993367324395756, 'optimizer': 'Adam', 'dropout_rate': 0.31394404149895316}. Best is trial 19 with value: 0.5538469379598444.
[I 2025-05-09 03:56:07,406] Trial 27 finished with value: 0.5985022414814342 and parameters: {'lr': 0.0002233264919240552, 'weight_decay': 0.0010876035612650038, 'optimizer': 'Adam', 'dropout_rate': 0.45371736280541747}. Best is trial 19 with value: 0.5538469379598444.
[I 2025-05-09 04:00:34,677] Trial 28 finished with value: 0.6245463371276856 and parameters: {'lr': 4.4655753461371364e-05, 'weight_decay': 0.0001376805799455157, 'optimizer': 'AdamW', 'dropout_rate': 0.12669314681935387}. Best is trial 19 with value: 0.5538469379598444.
[I 2025-05-09 04:06:07,290] Trial 29 finished with value: 0.5910917780616066 and parameters: {'lr': 6.407813507344956e-05, 'weight_decay': 0.00186408878210838, 'optimizer': 'Adam', 'dropout_rate': 0.3419544992251276}. Best is trial 19 with value: 0.5538469379598444.
[I 2025-05-09 04:12:59,588] Trial 30 finished with value: 0.607875796881589 and parameters: {'lr': 0.00010325664566164328, 'weight_decay': 0.004281357620758078, 'optimizer': 'RMSprop', 'dropout_rate': 0.41166361331283136}. Best is trial 19 with value: 0.5538469379598444.
[I 2025-05-09 04:19:51,392] Trial 31 finished with value: 0.5703598748553883 and parameters: {'lr': 1.1213605657606704e-05, 'weight_decay': 0.003055369667747437, 'optimizer': 'Adam', 'dropout_rate': 0.2783205932888147}. Best is trial 19 with value: 0.5538469379598444.
[I 2025-05-09 04:25:41,500] Trial 32 finished with value: 0.5978989904577082 and parameters: {'lr': 4.909896594803605e-05, 'weight_decay': 0.0007661291459356073, 'optimizer': 'Adam', 'dropout_rate': 0.29919438763657213}. Best is trial 19 with value: 0.5538469379598444.
[I 2025-05-09 04:33:11,968] Trial 33 finished with value: 0.5754832885482094 and parameters: {'lr': 1.369224778133248e-05, 'weight_decay': 0.005219372652514046, 'optimizer': 'Adam', 'dropout_rate': 0.21853398382416617}. Best is trial 19 with value: 0.5538469379598444.
[I 2025-05-09 04:45:43,283] Trial 34 finished with value: 0.5812138622457331 and parameters: {'lr': 5.1084052586294e-06, 'weight_decay': 0.0017917499847330636, 'optimizer': 'Adam', 'dropout_rate': 0.1372159677300144}. Best is trial 19 with value: 0.5538469379598444.
