[I 2025-05-09 09:32:00,581] Trial 74 finished with value: 0.5453704259612343 and parameters: {'lr': 5.496436556913816e-05, 'weight_decay': 0.00995759029379947, 'optimizer': 'Adam', 'dropout_rate': 0.26373310617543966}. Best is trial 64 with value: 0.5315759723836725.
[I 2025-05-09 09:42:45,905] Trial 75 finished with value: 0.5815476720983331 and parameters: {'lr': 2.897020770875256e-05, 'weight_decay': 0.009833742797312738, 'optimizer': 'Adam', 'dropout_rate': 0.258059872929776}. Best is trial 64 with value: 0.5315759723836725.
[I 2025-05-09 09:52:03,471] Trial 76 finished with value: 0.5486924908377907 and parameters: {'lr': 9.693380934737124e-05, 'weight_decay': 0.00641114632685289, 'optimizer': 'RMSprop', 'dropout_rate': 0.32545837104997444}. Best is trial 64 with value: 0.5315759723836725.
[I 2025-05-09 10:01:20,670] Trial 77 finished with value: 0.5526898340745405 and parameters: {'lr': 8.460819355906954e-05, 'weight_decay': 0.006315850817971173, 'optimizer': 'RMSprop', 'dropout_rate': 0.23063468449707694}. Best is trial 64 with value: 0.5315759723836725.
[I 2025-05-09 10:12:03,972] Trial 78 finished with value: 0.5950480504469438 and parameters: {'lr': 9.669946894501364e-05, 'weight_decay': 0.006369088182196385, 'optimizer': 'RMSprop', 'dropout_rate': 0.21947826429249295}. Best is trial 64 with value: 0.5315759723836725.
[I 2025-05-09 10:21:40,862] Trial 79 finished with value: 0.5486811150204052 and parameters: {'lr': 0.0001449144729376592, 'weight_decay': 0.004910163970101457, 'optimizer': 'RMSprop', 'dropout_rate': 0.2296958587992288}. Best is trial 64 with value: 0.5315759723836725.
[I 2025-05-09 10:32:34,732] Trial 80 finished with value: 0.6240514690225775 and parameters: {'lr': 0.0001347436079634917, 'weight_decay': 0.005016184899279772, 'optimizer': 'RMSprop', 'dropout_rate': 0.23616580183994867}. Best is trial 64 with value: 0.5315759723836725.
[I 2025-05-09 10:41:50,982] Trial 81 finished with value: 0.5489086107774215 and parameters: {'lr': 5.747369538531546e-05, 'weight_decay': 0.007611820031545756, 'optimizer': 'RMSprop', 'dropout_rate': 0.20343812116552987}. Best is trial 64 with value: 0.5315759723836725.
[I 2025-05-09 10:49:15,132] Trial 82 finished with value: 0.5872425989671187 and parameters: {'lr': 6.742998841820812e-05, 'weight_decay': 0.008100571834308814, 'optimizer': 'RMSprop', 'dropout_rate': 0.2045087780405269}. Best is trial 64 with value: 0.5315759723836725.
[I 2025-05-09 10:56:09,897] Trial 83 finished with value: 0.5593940669840033 and parameters: {'lr': 4.738912877274845e-05, 'weight_decay': 0.004733248123949402, 'optimizer': 'RMSprop', 'dropout_rate': 0.17886222916649608}. Best is trial 64 with value: 0.5315759723836725.
[I 2025-05-09 11:01:48,497] Trial 84 finished with value: 0.5635058803991838 and parameters: {'lr': 5.810348056741624e-05, 'weight_decay': 0.004050591968483032, 'optimizer': 'RMSprop', 'dropout_rate': 0.2465159891290653}. Best is trial 64 with value: 0.5315759723836725.
[I 2025-05-09 11:17:10,322] Trial 85 finished with value: 0.5556049650365656 and parameters: {'lr': 0.000228368528563105, 'weight_decay': 0.009966507811774054, 'optimizer': 'RMSprop', 'dropout_rate': 0.0025309392216241733}. Best is trial 64 with value: 0.5315759723836725.
[I 2025-05-09 11:25:41,669] Trial 86 finished with value: 0.5536374894055454 and parameters: {'lr': 3.6180941315034806e-05, 'weight_decay': 0.006903547524988562, 'optimizer': 'RMSprop', 'dropout_rate': 0.26427743965741546}. Best is trial 64 with value: 0.5315759723836725.
[I 2025-05-09 11:34:22,496] Trial 87 finished with value: 0.5660323749889027 and parameters: {'lr': 9.762481621476881e-05, 'weight_decay': 0.007887565383663258, 'optimizer': 'RMSprop', 'dropout_rate': 0.18895900970527135}. Best is trial 64 with value: 0.5315759723836725.
[I 2025-05-09 11:42:30,357] Trial 88 finished with value: 0.539111707427285 and parameters: {'lr': 4.480764661467741e-05, 'weight_decay': 0.005155539269671874, 'optimizer': 'RMSprop', 'dropout_rate': 0.2156787900663717}. Best is trial 64 with value: 0.5315759723836725.
[I 2025-05-09 11:48:34,076] Trial 89 finished with value: 0.5829502755945379 and parameters: {'lr': 0.00012943597758527064, 'weight_decay': 0.00567722772996976, 'optimizer': 'RMSprop', 'dropout_rate': 0.16968916307136384}. Best is trial 64 with value: 0.5315759723836725.
[I 2025-05-09 11:54:01,872] Trial 90 finished with value: 0.5713891657915983 and parameters: {'lr': 5.589212370835702e-05, 'weight_decay': 0.0018892389260862594, 'optimizer': 'RMSprop', 'dropout_rate': 0.14432461416889467}. Best is trial 64 with value: 0.5315759723836725.
[I 2025-05-09 12:01:08,963] Trial 91 finished with value: 0.5548441507599571 and parameters: {'lr': 4.208802267457883e-05, 'weight_decay': 0.004040789428046954, 'optimizer': 'RMSprop', 'dropout_rate': 0.2102811217321952}. Best is trial 64 with value: 0.5315759723836725.
[I 2025-05-09 12:08:22,797] Trial 92 finished with value: 0.579302721673792 and parameters: {'lr': 2.869345959551655e-05, 'weight_decay': 0.007831774140002697, 'optimizer': 'RMSprop', 'dropout_rate': 0.2730222611308691}. Best is trial 64 with value: 0.5315759723836725.
[I 2025-05-09 12:16:38,303] Trial 93 finished with value: 0.6760303323919122 and parameters: {'lr': 3.81555307942577e-05, 'weight_decay': 0.0057394819527638, 'optimizer': 'RMSprop', 'dropout_rate': 0.3242677332178699}. Best is trial 64 with value: 0.5315759723836725.
[I 2025-05-09 12:23:37,222] Trial 94 finished with value: 0.5752301259474321 and parameters: {'lr': 7.327125123505225e-05, 'weight_decay': 0.002977966841532308, 'optimizer': 'RMSprop', 'dropout_rate': 0.22118664031215618}. Best is trial 64 with value: 0.5315759723836725.
[I 2025-05-09 12:31:46,595] Trial 95 finished with value: 0.5603888034820557 and parameters: {'lr': 4.8161290075338656e-05, 'weight_decay': 0.008335241036995296, 'optimizer': 'RMSprop', 'dropout_rate': 0.2511015994039351}. Best is trial 64 with value: 0.5315759723836725.
[I 2025-05-09 12:36:35,088] Trial 96 finished with value: 0.6198116627606478 and parameters: {'lr': 5.749516200802111e-05, 'weight_decay': 0.003750207897668994, 'optimizer': 'AdamW', 'dropout_rate': 0.19257901350099918}. Best is trial 64 with value: 0.5315759723836725.
[I 2025-05-09 12:43:29,071] Trial 97 finished with value: 0.585374653339386 and parameters: {'lr': 8.03430865658746e-05, 'weight_decay': 0.005071397039062111, 'optimizer': 'RMSprop', 'dropout_rate': 0.2949456574402924}. Best is trial 64 with value: 0.5315759723836725.
[I 2025-05-09 12:51:08,676] Trial 98 finished with value: 0.5699025132439354 and parameters: {'lr': 3.0971552651112745e-05, 'weight_decay': 0.006083682804086897, 'optimizer': 'RMSprop', 'dropout_rate': 0.2431932499239602}. Best is trial 64 with value: 0.5315759723836725.
