[I 2025-05-10 16:21:37,324] Trial 18 finished with value: 0.5820315035906705 and parameters: {'lr': 1.6870609590612806e-05, 'weight_decay': 0.002911965197405132, 'optimizer': 'RMSprop', 'dropout_rate': 0.36030211806504836}. Best is trial 16 with value: 0.5663253502412275.
Full train CSV contained 2200 samples
 → using 1760 for training, 440 for validation
Test : 1000 samples
Epoch 1 — Train Loss: 0.6929 — Val Loss: 0.6924
Epoch 2 — Train Loss: 0.6903 — Val Loss: 0.6842
Epoch 3 — Train Loss: 0.6749 — Val Loss: 0.6627
Epoch 4 — Train Loss: 0.6607 — Val Loss: 0.6472
Epoch 5 — Train Loss: 0.6532 — Val Loss: 0.6432
Epoch 6 — Train Loss: 0.6405 — Val Loss: 0.6418
Epoch 7 — Train Loss: 0.6315 — Val Loss: 0.6378
Epoch 8 — Train Loss: 0.6253 — Val Loss: 0.6175
Epoch 9 — Train Loss: 0.6227 — Val Loss: 0.6206
Epoch 10 — Train Loss: 0.6098 — Val Loss: 0.6299
Epoch 11 — Train Loss: 0.6062 — Val Loss: 0.6209
Epoch 12 — Train Loss: 0.6015 — Val Loss: 0.6184
Epoch 13 — Train Loss: 0.5936 — Val Loss: 0.6224
Epoch 14 — Train Loss: 0.5895 — Val Loss: 0.6332
Epoch 15 — Train Loss: 0.5791 — Val Loss: 0.6113
Epoch 16 — Train Loss: 0.5740 — Val Loss: 0.5955
Epoch 17 — Train Loss: 0.5736 — Val Loss: 0.5932
Epoch 18 — Train Loss: 0.5688 — Val Loss: 0.5944
Epoch 19 — Train Loss: 0.5613 — Val Loss: 0.5908
Epoch 20 — Train Loss: 0.5451 — Val Loss: 0.5959
Epoch 21 — Train Loss: 0.5454 — Val Loss: 0.5955
Epoch 22 — Train Loss: 0.5346 — Val Loss: 0.6143
Epoch 23 — Train Loss: 0.5282 — Val Loss: 0.5901
Epoch 24 — Train Loss: 0.5156 — Val Loss: 0.5890
Epoch 25 — Train Loss: 0.5172 — Val Loss: 0.5898
Epoch 26 — Train Loss: 0.5020 — Val Loss: 0.5875
Epoch 27 — Train Loss: 0.4842 — Val Loss: 0.6019
Epoch 28 — Train Loss: 0.4761 — Val Loss: 0.5696
Epoch 29 — Train Loss: 0.4679 — Val Loss: 0.5733
Epoch 30 — Train Loss: 0.4508 — Val Loss: 0.5911
Epoch 31 — Train Loss: 0.4423 — Val Loss: 0.5884
Epoch 32 — Train Loss: 0.4326 — Val Loss: 0.6024
Epoch 33 — Train Loss: 0.4139 — Val Loss: 0.5919
Epoch 34 — Train Loss: 0.4117 — Val Loss: 0.5733
Epoch 35 — Train Loss: 0.3899 — Val Loss: 0.6058
Epoch 36 — Train Loss: 0.3822 — Val Loss: 0.5696
Epoch 37 — Train Loss: 0.3659 — Val Loss: 0.5854
Epoch 38 — Train Loss: 0.3530 — Val Loss: 0.5846
Early stopping.
Epoch 1 — Train Loss: 0.6633 — Val Loss: 0.6342
Epoch 2 — Train Loss: 0.6316 — Val Loss: 0.6100
Epoch 3 — Train Loss: 0.6037 — Val Loss: 0.6049
Epoch 4 — Train Loss: 0.5861 — Val Loss: 0.5954
Epoch 5 — Train Loss: 0.5518 — Val Loss: 0.6107
Epoch 6 — Train Loss: 0.5317 — Val Loss: 0.5907
Epoch 7 — Train Loss: 0.4984 — Val Loss: 0.5991
Epoch 8 — Train Loss: 0.4796 — Val Loss: 0.5764
Epoch 9 — Train Loss: 0.4463 — Val Loss: 0.5599
Epoch 10 — Train Loss: 0.4071 — Val Loss: 0.5498
Epoch 11 — Train Loss: 0.3785 — Val Loss: 0.5630
Epoch 12 — Train Loss: 0.3476 — Val Loss: 0.5700
Epoch 13 — Train Loss: 0.3368 — Val Loss: 0.5578
Epoch 14 — Train Loss: 0.2933 — Val Loss: 0.5721
Epoch 15 — Train Loss: 0.2769 — Val Loss: 0.5694
Epoch 16 — Train Loss: 0.2628 — Val Loss: 0.5471
Epoch 17 — Train Loss: 0.2472 — Val Loss: 0.5864
Epoch 18 — Train Loss: 0.2154 — Val Loss: 0.5620
Epoch 19 — Train Loss: 0.1941 — Val Loss: 0.5751
Epoch 20 — Train Loss: 0.1767 — Val Loss: 0.5885
Epoch 21 — Train Loss: 0.1523 — Val Loss: 0.5735
Epoch 22 — Train Loss: 0.1480 — Val Loss: 0.5878
Epoch 23 — Train Loss: 0.1237 — Val Loss: 0.5775
Epoch 24 — Train Loss: 0.1193 — Val Loss: 0.5888
Epoch 25 — Train Loss: 0.1065 — Val Loss: 0.6076
Epoch 26 — Train Loss: 0.0985 — Val Loss: 0.5939
Early stopping.
Epoch 1 — Train Loss: 0.6932 — Val Loss: 0.6931
Epoch 2 — Train Loss: 0.6932 — Val Loss: 0.6931
Epoch 3 — Train Loss: 0.6932 — Val Loss: 0.6931
Epoch 4 — Train Loss: 0.6932 — Val Loss: 0.6931
Epoch 5 — Train Loss: 0.6932 — Val Loss: 0.6931
Epoch 6 — Train Loss: 0.6932 — Val Loss: 0.6931
Epoch 7 — Train Loss: 0.6932 — Val Loss: 0.6931
Epoch 8 — Train Loss: 0.6932 — Val Loss: 0.6931
Epoch 9 — Train Loss: 0.6932 — Val Loss: 0.6931
Epoch 10 — Train Loss: 0.6932 — Val Loss: 0.6931
Epoch 11 — Train Loss: 0.6932 — Val Loss: 0.6931
Epoch 12 — Train Loss: 0.6932 — Val Loss: 0.6931
Epoch 13 — Train Loss: 0.6932 — Val Loss: 0.6931
Epoch 14 — Train Loss: 0.6932 — Val Loss: 0.6931
Epoch 15 — Train Loss: 0.6932 — Val Loss: 0.6931
Epoch 16 — Train Loss: 0.6932 — Val Loss: 0.6931
Epoch 17 — Train Loss: 0.6932 — Val Loss: 0.6931
Epoch 18 — Train Loss: 0.6932 — Val Loss: 0.6931
Epoch 19 — Train Loss: 0.6932 — Val Loss: 0.6931
Epoch 20 — Train Loss: 0.6932 — Val Loss: 0.6931
Epoch 21 — Train Loss: 0.6932 — Val Loss: 0.6931
Epoch 22 — Train Loss: 0.6932 — Val Loss: 0.6931
Epoch 23 — Train Loss: 0.6932 — Val Loss: 0.6931
Epoch 24 — Train Loss: 0.6932 — Val Loss: 0.6931
Epoch 25 — Train Loss: 0.6932 — Val Loss: 0.6931
Epoch 26 — Train Loss: 0.6932 — Val Loss: 0.6931
Epoch 27 — Train Loss: 0.6932 — Val Loss: 0.6931
Epoch 28 — Train Loss: 0.6932 — Val Loss: 0.6931
Epoch 29 — Train Loss: 0.6932 — Val Loss: 0.6931
Early stopping.
Epoch 1 — Train Loss: 0.6932 — Val Loss: 0.6931
Epoch 2 — Train Loss: 0.6931 — Val Loss: 0.6931
Epoch 3 — Train Loss: 0.6932 — Val Loss: 0.6931
Epoch 4 — Train Loss: 0.6932 — Val Loss: 0.6931
Epoch 5 — Train Loss: 0.6932 — Val Loss: 0.6931
Epoch 6 — Train Loss: 0.6932 — Val Loss: 0.6931
Epoch 7 — Train Loss: 0.6932 — Val Loss: 0.6931
Epoch 8 — Train Loss: 0.6932 — Val Loss: 0.6931
Epoch 9 — Train Loss: 0.6932 — Val Loss: 0.6931
Epoch 10 — Train Loss: 0.6932 — Val Loss: 0.6931
Epoch 11 — Train Loss: 0.6932 — Val Loss: 0.6931
Epoch 12 — Train Loss: 0.6932 — Val Loss: 0.6931
Epoch 13 — Train Loss: 0.6932 — Val Loss: 0.6931
Epoch 14 — Train Loss: 0.6932 — Val Loss: 0.6931
Epoch 15 — Train Loss: 0.6932 — Val Loss: 0.6931
Epoch 16 — Train Loss: 0.6932 — Val Loss: 0.6931
Epoch 17 — Train Loss: 0.6932 — Val Loss: 0.6931
Epoch 18 — Train Loss: 0.6932 — Val Loss: 0.6931
Epoch 19 — Train Loss: 0.6932 — Val Loss: 0.6931
Epoch 20 — Train Loss: 0.6932 — Val Loss: 0.6931
Epoch 21 — Train Loss: 0.6932 — Val Loss: 0.6931
Epoch 22 — Train Loss: 0.6932 — Val Loss: 0.6931
Epoch 23 — Train Loss: 0.6932 — Val Loss: 0.6931
Epoch 24 — Train Loss: 0.6932 — Val Loss: 0.6931
Epoch 25 — Train Loss: 0.6932 — Val Loss: 0.6931
Epoch 26 — Train Loss: 0.6932 — Val Loss: 0.6931
Epoch 27 — Train Loss: 0.6932 — Val Loss: 0.6931
Epoch 28 — Train Loss: 0.6932 — Val Loss: 0.6931
Epoch 29 — Train Loss: 0.6932 — Val Loss: 0.6931
Epoch 30 — Train Loss: 0.6932 — Val Loss: 0.6931
Epoch 31 — Train Loss: 0.6932 — Val Loss: 0.6931
Epoch 32 — Train Loss: 0.6931 — Val Loss: 0.6931
Epoch 33 — Train Loss: 0.6932 — Val Loss: 0.6931
Epoch 34 — Train Loss: 0.6932 — Val Loss: 0.6931
Epoch 35 — Train Loss: 0.6932 — Val Loss: 0.6931
Epoch 36 — Train Loss: 0.6932 — Val Loss: 0.6931
Epoch 37 — Train Loss: 0.6932 — Val Loss: 0.6931
Epoch 38 — Train Loss: 0.6931 — Val Loss: 0.6931
Epoch 39 — Train Loss: 0.6931 — Val Loss: 0.6931
Epoch 40 — Train Loss: 0.6932 — Val Loss: 0.6931
Epoch 41 — Train Loss: 0.6932 — Val Loss: 0.6931
Epoch 42 — Train Loss: 0.6931 — Val Loss: 0.6931
Epoch 43 — Train Loss: 0.6932 — Val Loss: 0.6931
Epoch 44 — Train Loss: 0.6931 — Val Loss: 0.6931
Epoch 45 — Train Loss: 0.6932 — Val Loss: 0.6931
Epoch 46 — Train Loss: 0.6931 — Val Loss: 0.6931
Epoch 47 — Train Loss: 0.6931 — Val Loss: 0.6931
Epoch 48 — Train Loss: 0.6931 — Val Loss: 0.6931
Epoch 49 — Train Loss: 0.6931 — Val Loss: 0.6931
Epoch 50 — Train Loss: 0.6932 — Val Loss: 0.6931
Epoch 51 — Train Loss: 0.6931 — Val Loss: 0.6931
Epoch 52 — Train Loss: 0.6931 — Val Loss: 0.6931
Epoch 53 — Train Loss: 0.6932 — Val Loss: 0.6931
Epoch 54 — Train Loss: 0.6931 — Val Loss: 0.6931
Epoch 55 — Train Loss: 0.6931 — Val Loss: 0.6931
Epoch 56 — Train Loss: 0.6931 — Val Loss: 0.6931
Epoch 57 — Train Loss: 0.6932 — Val Loss: 0.6931
Epoch 58 — Train Loss: 0.6931 — Val Loss: 0.6931
Epoch 59 — Train Loss: 0.6931 — Val Loss: 0.6931
Epoch 60 — Train Loss: 0.6931 — Val Loss: 0.6931
Epoch 61 — Train Loss: 0.6931 — Val Loss: 0.6931
Epoch 62 — Train Loss: 0.6931 — Val Loss: 0.6931
Epoch 63 — Train Loss: 0.6931 — Val Loss: 0.6931
Epoch 64 — Train Loss: 0.6931 — Val Loss: 0.6931
Epoch 65 — Train Loss: 0.6931 — Val Loss: 0.6931
Epoch 66 — Train Loss: 0.6931 — Val Loss: 0.6931
Epoch 67 — Train Loss: 0.6931 — Val Loss: 0.6931
Epoch 68 — Train Loss: 0.6931 — Val Loss: 0.6931
Epoch 69 — Train Loss: 0.6931 — Val Loss: 0.6931
Epoch 70 — Train Loss: 0.6931 — Val Loss: 0.6931
Epoch 71 — Train Loss: 0.6931 — Val Loss: 0.6931
Epoch 72 — Train Loss: 0.6931 — Val Loss: 0.6931
Epoch 73 — Train Loss: 0.6931 — Val Loss: 0.6931
Epoch 74 — Train Loss: 0.6931 — Val Loss: 0.6931
Epoch 75 — Train Loss: 0.6931 — Val Loss: 0.6931
Epoch 76 — Train Loss: 0.6931 — Val Loss: 0.6931
Epoch 77 — Train Loss: 0.6931 — Val Loss: 0.6931
Epoch 78 — Train Loss: 0.6931 — Val Loss: 0.6931
Epoch 79 — Train Loss: 0.6931 — Val Loss: 0.6931
Epoch 80 — Train Loss: 0.6931 — Val Loss: 0.6931
Epoch 81 — Train Loss: 0.6931 — Val Loss: 0.6931
Epoch 82 — Train Loss: 0.6931 — Val Loss: 0.6931
Epoch 83 — Train Loss: 0.6931 — Val Loss: 0.6931
Epoch 84 — Train Loss: 0.6931 — Val Loss: 0.6931
Epoch 85 — Train Loss: 0.6931 — Val Loss: 0.6931
Epoch 86 — Train Loss: 0.6931 — Val Loss: 0.6931
Epoch 87 — Train Loss: 0.6931 — Val Loss: 0.6931
Epoch 88 — Train Loss: 0.6931 — Val Loss: 0.6931
Epoch 89 — Train Loss: 0.6931 — Val Loss: 0.6931
Epoch 90 — Train Loss: 0.6931 — Val Loss: 0.6931
Epoch 91 — Train Loss: 0.6931 — Val Loss: 0.6931
Epoch 92 — Train Loss: 0.6931 — Val Loss: 0.6931
Epoch 93 — Train Loss: 0.6931 — Val Loss: 0.6931
Epoch 94 — Train Loss: 0.6931 — Val Loss: 0.6931
Epoch 95 — Train Loss: 0.6931 — Val Loss: 0.6931
Epoch 96 — Train Loss: 0.6931 — Val Loss: 0.6931
Epoch 97 — Train Loss: 0.6931 — Val Loss: 0.6931
Epoch 98 — Train Loss: 0.6931 — Val Loss: 0.6931
Epoch 99 — Train Loss: 0.6931 — Val Loss: 0.6931
Epoch 100 — Train Loss: 0.6931 — Val Loss: 0.6931
Epoch 101 — Train Loss: 0.6931 — Val Loss: 0.6931
Epoch 102 — Train Loss: 0.6931 — Val Loss: 0.6931
Epoch 103 — Train Loss: 0.6931 — Val Loss: 0.6931
Epoch 104 — Train Loss: 0.6931 — Val Loss: 0.6931
Epoch 105 — Train Loss: 0.6931 — Val Loss: 0.6931
Epoch 106 — Train Loss: 0.6931 — Val Loss: 0.6931
Epoch 107 — Train Loss: 0.6931 — Val Loss: 0.6931
Epoch 108 — Train Loss: 0.6931 — Val Loss: 0.6931
Epoch 109 — Train Loss: 0.6931 — Val Loss: 0.6931
Epoch 110 — Train Loss: 0.6931 — Val Loss: 0.6931
Epoch 111 — Train Loss: 0.6931 — Val Loss: 0.6931
Epoch 112 — Train Loss: 0.6931 — Val Loss: 0.6931
Epoch 113 — Train Loss: 0.6931 — Val Loss: 0.6931
Epoch 114 — Train Loss: 0.6931 — Val Loss: 0.6931
Epoch 115 — Train Loss: 0.6931 — Val Loss: 0.6931
Epoch 116 — Train Loss: 0.6931 — Val Loss: 0.6931
Epoch 117 — Train Loss: 0.6931 — Val Loss: 0.6931
Epoch 118 — Train Loss: 0.6931 — Val Loss: 0.6931
Epoch 119 — Train Loss: 0.6931 — Val Loss: 0.6931
Epoch 120 — Train Loss: 0.6931 — Val Loss: 0.6931
Epoch 121 — Train Loss: 0.6931 — Val Loss: 0.6931
Epoch 122 — Train Loss: 0.6931 — Val Loss: 0.6931
Epoch 123 — Train Loss: 0.6931 — Val Loss: 0.6931
Epoch 124 — Train Loss: 0.6931 — Val Loss: 0.6931
Epoch 125 — Train Loss: 0.6931 — Val Loss: 0.6931
Epoch 126 — Train Loss: 0.6931 — Val Loss: 0.6931
Epoch 127 — Train Loss: 0.6931 — Val Loss: 0.6931
Epoch 128 — Train Loss: 0.6931 — Val Loss: 0.6931
Epoch 129 — Train Loss: 0.6931 — Val Loss: 0.6931
Epoch 130 — Train Loss: 0.6931 — Val Loss: 0.6931
Epoch 131 — Train Loss: 0.6931 — Val Loss: 0.6931
Epoch 132 — Train Loss: 0.6931 — Val Loss: 0.6931
Epoch 133 — Train Loss: 0.6931 — Val Loss: 0.6931
Epoch 134 — Train Loss: 0.6931 — Val Loss: 0.6931
Epoch 135 — Train Loss: 0.6931 — Val Loss: 0.6931
Epoch 136 — Train Loss: 0.6931 — Val Loss: 0.6931
Epoch 137 — Train Loss: 0.6931 — Val Loss: 0.6931
Epoch 138 — Train Loss: 0.6931 — Val Loss: 0.6931
Epoch 139 — Train Loss: 0.6931 — Val Loss: 0.6931
Epoch 140 — Train Loss: 0.6931 — Val Loss: 0.6931
Epoch 141 — Train Loss: 0.6931 — Val Loss: 0.6931
Epoch 142 — Train Loss: 0.6931 — Val Loss: 0.6931
Epoch 143 — Train Loss: 0.6931 — Val Loss: 0.6931
Epoch 144 — Train Loss: 0.6931 — Val Loss: 0.6931
Epoch 145 — Train Loss: 0.6931 — Val Loss: 0.6931
Epoch 146 — Train Loss: 0.6931 — Val Loss: 0.6931
Epoch 147 — Train Loss: 0.6931 — Val Loss: 0.6931
Epoch 148 — Train Loss: 0.6931 — Val Loss: 0.6931
Epoch 149 — Train Loss: 0.6931 — Val Loss: 0.6931
Epoch 150 — Train Loss: 0.6931 — Val Loss: 0.6931
Epoch 151 — Train Loss: 0.6931 — Val Loss: 0.6931
Epoch 152 — Train Loss: 0.6931 — Val Loss: 0.6931
Epoch 153 — Train Loss: 0.6931 — Val Loss: 0.6931
Epoch 154 — Train Loss: 0.6931 — Val Loss: 0.6931
Epoch 155 — Train Loss: 0.6931 — Val Loss: 0.6931
Epoch 156 — Train Loss: 0.6931 — Val Loss: 0.6931
Epoch 157 — Train Loss: 0.6931 — Val Loss: 0.6931
Epoch 158 — Train Loss: 0.6931 — Val Loss: 0.6931
Epoch 159 — Train Loss: 0.6931 — Val Loss: 0.6931
Epoch 160 — Train Loss: 0.6931 — Val Loss: 0.6931
Epoch 161 — Train Loss: 0.6931 — Val Loss: 0.6931
Epoch 162 — Train Loss: 0.6931 — Val Loss: 0.6931
Epoch 163 — Train Loss: 0.6931 — Val Loss: 0.6931
Epoch 164 — Train Loss: 0.6931 — Val Loss: 0.6931
Epoch 165 — Train Loss: 0.6931 — Val Loss: 0.6931
Epoch 166 — Train Loss: 0.6931 — Val Loss: 0.6931
Epoch 167 — Train Loss: 0.6931 — Val Loss: 0.6931
Epoch 168 — Train Loss: 0.6931 — Val Loss: 0.6931
Epoch 169 — Train Loss: 0.6931 — Val Loss: 0.6931
Epoch 170 — Train Loss: 0.6931 — Val Loss: 0.6931
Epoch 171 — Train Loss: 0.6931 — Val Loss: 0.6931
Epoch 172 — Train Loss: 0.6931 — Val Loss: 0.6931
Epoch 173 — Train Loss: 0.6931 — Val Loss: 0.6931
Epoch 174 — Train Loss: 0.6931 — Val Loss: 0.6931
Epoch 175 — Train Loss: 0.6931 — Val Loss: 0.6931
Epoch 176 — Train Loss: 0.6931 — Val Loss: 0.6931
Epoch 177 — Train Loss: 0.6931 — Val Loss: 0.6931
Epoch 178 — Train Loss: 0.6931 — Val Loss: 0.6931
Epoch 179 — Train Loss: 0.6931 — Val Loss: 0.6931
Epoch 180 — Train Loss: 0.6931 — Val Loss: 0.6931
Epoch 181 — Train Loss: 0.6931 — Val Loss: 0.6931
Epoch 182 — Train Loss: 0.6931 — Val Loss: 0.6931
Epoch 183 — Train Loss: 0.6931 — Val Loss: 0.6931
Epoch 184 — Train Loss: 0.6931 — Val Loss: 0.6931
Epoch 185 — Train Loss: 0.6931 — Val Loss: 0.6931
Epoch 186 — Train Loss: 0.6931 — Val Loss: 0.6931
Epoch 187 — Train Loss: 0.6931 — Val Loss: 0.6931
Epoch 188 — Train Loss: 0.6931 — Val Loss: 0.6931
Epoch 189 — Train Loss: 0.6931 — Val Loss: 0.6931
Epoch 190 — Train Loss: 0.6931 — Val Loss: 0.6931
Epoch 191 — Train Loss: 0.6931 — Val Loss: 0.6931
Epoch 192 — Train Loss: 0.6931 — Val Loss: 0.6931
Epoch 193 — Train Loss: 0.6931 — Val Loss: 0.6931
Epoch 194 — Train Loss: 0.6931 — Val Loss: 0.6931
Epoch 195 — Train Loss: 0.6931 — Val Loss: 0.6931
Epoch 196 — Train Loss: 0.6931 — Val Loss: 0.6931
Epoch 197 — Train Loss: 0.6931 — Val Loss: 0.6931
Epoch 198 — Train Loss: 0.6931 — Val Loss: 0.6931
Epoch 199 — Train Loss: 0.6931 — Val Loss: 0.6931
Epoch 200 — Train Loss: 0.6931 — Val Loss: 0.6931
Epoch 1 — Train Loss: 0.6768 — Val Loss: 0.6396
Epoch 2 — Train Loss: 0.6458 — Val Loss: 0.6281
Epoch 3 — Train Loss: 0.6274 — Val Loss: 0.6170
Epoch 4 — Train Loss: 0.6177 — Val Loss: 0.6015
Epoch 5 — Train Loss: 0.5888 — Val Loss: 0.6134
Epoch 6 — Train Loss: 0.5703 — Val Loss: 0.5887
Epoch 7 — Train Loss: 0.5502 — Val Loss: 0.5859
Epoch 8 — Train Loss: 0.5314 — Val Loss: 0.5818
Epoch 9 — Train Loss: 0.5013 — Val Loss: 0.5821
Epoch 10 — Train Loss: 0.4802 — Val Loss: 0.5709
Epoch 11 — Train Loss: 0.4653 — Val Loss: 0.5683
Epoch 12 — Train Loss: 0.4374 — Val Loss: 0.5749
Epoch 13 — Train Loss: 0.4197 — Val Loss: 0.5637
Epoch 14 — Train Loss: 0.3990 — Val Loss: 0.5511
Epoch 15 — Train Loss: 0.3845 — Val Loss: 0.5718
Epoch 16 — Train Loss: 0.3662 — Val Loss: 0.5425
Epoch 17 — Train Loss: 0.3275 — Val Loss: 0.5673
Epoch 18 — Train Loss: 0.3327 — Val Loss: 0.5569
Epoch 19 — Train Loss: 0.2978 — Val Loss: 0.6153
Epoch 20 — Train Loss: 0.2783 — Val Loss: 0.5745
Epoch 21 — Train Loss: 0.2665 — Val Loss: 0.5961
Epoch 22 — Train Loss: 0.2523 — Val Loss: 0.5709
Epoch 23 — Train Loss: 0.2354 — Val Loss: 0.5796
Epoch 24 — Train Loss: 0.2166 — Val Loss: 0.5674
Epoch 25 — Train Loss: 0.2156 — Val Loss: 0.5574
Epoch 26 — Train Loss: 0.1829 — Val Loss: 0.5757
Early stopping.
Epoch 1 — Train Loss: 0.6921 — Val Loss: 0.6903
Epoch 2 — Train Loss: 0.6866 — Val Loss: 0.6811
Epoch 3 — Train Loss: 0.6755 — Val Loss: 0.6679
Epoch 4 — Train Loss: 0.6618 — Val Loss: 0.6551
Epoch 5 — Train Loss: 0.6527 — Val Loss: 0.6448
Epoch 6 — Train Loss: 0.6459 — Val Loss: 0.6393
Epoch 7 — Train Loss: 0.6361 — Val Loss: 0.6337
Epoch 8 — Train Loss: 0.6263 — Val Loss: 0.6289
Epoch 9 — Train Loss: 0.6252 — Val Loss: 0.6241
Epoch 10 — Train Loss: 0.6192 — Val Loss: 0.6207
Epoch 11 — Train Loss: 0.6091 — Val Loss: 0.6160
Epoch 12 — Train Loss: 0.6036 — Val Loss: 0.6111
Epoch 13 — Train Loss: 0.5973 — Val Loss: 0.6114
Epoch 14 — Train Loss: 0.5894 — Val Loss: 0.6166
Epoch 15 — Train Loss: 0.5931 — Val Loss: 0.6055
Epoch 16 — Train Loss: 0.5792 — Val Loss: 0.6082
Epoch 17 — Train Loss: 0.5712 — Val Loss: 0.6092
Epoch 18 — Train Loss: 0.5686 — Val Loss: 0.6009
Epoch 19 — Train Loss: 0.5623 — Val Loss: 0.5958
Epoch 20 — Train Loss: 0.5557 — Val Loss: 0.5987
Epoch 21 — Train Loss: 0.5476 — Val Loss: 0.6011
Epoch 22 — Train Loss: 0.5378 — Val Loss: 0.6103
Epoch 23 — Train Loss: 0.5400 — Val Loss: 0.5988
Epoch 24 — Train Loss: 0.5254 — Val Loss: 0.5967
Epoch 25 — Train Loss: 0.5184 — Val Loss: 0.5910
Epoch 26 — Train Loss: 0.5210 — Val Loss: 0.5915
Epoch 27 — Train Loss: 0.5043 — Val Loss: 0.6005
Epoch 28 — Train Loss: 0.4896 — Val Loss: 0.5984
Epoch 29 — Train Loss: 0.4991 — Val Loss: 0.5923
Epoch 30 — Train Loss: 0.4863 — Val Loss: 0.5947
Epoch 31 — Train Loss: 0.4830 — Val Loss: 0.5914
Epoch 32 — Train Loss: 0.4714 — Val Loss: 0.5907
Epoch 33 — Train Loss: 0.4670 — Val Loss: 0.5950
Epoch 34 — Train Loss: 0.4649 — Val Loss: 0.5893
Epoch 35 — Train Loss: 0.4556 — Val Loss: 0.5955
Epoch 36 — Train Loss: 0.4511 — Val Loss: 0.5856
Epoch 37 — Train Loss: 0.4336 — Val Loss: 0.5984
Epoch 38 — Train Loss: 0.4265 — Val Loss: 0.6071
Epoch 39 — Train Loss: 0.4368 — Val Loss: 0.5904
Epoch 40 — Train Loss: 0.4191 — Val Loss: 0.5960
Epoch 41 — Train Loss: 0.4229 — Val Loss: 0.5939
Epoch 42 — Train Loss: 0.4140 — Val Loss: 0.6030
Epoch 43 — Train Loss: 0.4082 — Val Loss: 0.5983
Epoch 44 — Train Loss: 0.4004 — Val Loss: 0.5973
Epoch 45 — Train Loss: 0.3984 — Val Loss: 0.5865
Epoch 46 — Train Loss: 0.3928 — Val Loss: 0.5813
Epoch 47 — Train Loss: 0.3799 — Val Loss: 0.5856
Epoch 48 — Train Loss: 0.3689 — Val Loss: 0.5816
Epoch 49 — Train Loss: 0.3802 — Val Loss: 0.5805
Epoch 50 — Train Loss: 0.3702 — Val Loss: 0.5889
Epoch 51 — Train Loss: 0.3572 — Val Loss: 0.6017
Epoch 52 — Train Loss: 0.3543 — Val Loss: 0.5777
Epoch 53 — Train Loss: 0.3469 — Val Loss: 0.5837
Epoch 54 — Train Loss: 0.3365 — Val Loss: 0.5833
Epoch 55 — Train Loss: 0.3338 — Val Loss: 0.5953
Epoch 56 — Train Loss: 0.3385 — Val Loss: 0.5833
Epoch 57 — Train Loss: 0.3329 — Val Loss: 0.5925
Epoch 58 — Train Loss: 0.3175 — Val Loss: 0.5910
Epoch 59 — Train Loss: 0.3162 — Val Loss: 0.5788
Epoch 60 — Train Loss: 0.3086 — Val Loss: 0.5820
Epoch 61 — Train Loss: 0.3094 — Val Loss: 0.5833
Epoch 62 — Train Loss: 0.3049 — Val Loss: 0.5948
Early stopping.
Epoch 1 — Train Loss: 0.6928 — Val Loss: 0.6921
Epoch 2 — Train Loss: 0.6908 — Val Loss: 0.6889
Epoch 3 — Train Loss: 0.6857 — Val Loss: 0.6820
Epoch 4 — Train Loss: 0.6776 — Val Loss: 0.6728
Epoch 5 — Train Loss: 0.6697 — Val Loss: 0.6641
Epoch 6 — Train Loss: 0.6601 — Val Loss: 0.6540
Epoch 7 — Train Loss: 0.6556 — Val Loss: 0.6478
Epoch 8 — Train Loss: 0.6478 — Val Loss: 0.6412
Epoch 9 — Train Loss: 0.6427 — Val Loss: 0.6366
Epoch 10 — Train Loss: 0.6359 — Val Loss: 0.6330
Epoch 11 — Train Loss: 0.6323 — Val Loss: 0.6308
Epoch 12 — Train Loss: 0.6267 — Val Loss: 0.6275
Epoch 13 — Train Loss: 0.6203 — Val Loss: 0.6239
Epoch 14 — Train Loss: 0.6179 — Val Loss: 0.6201
Epoch 15 — Train Loss: 0.6061 — Val Loss: 0.6164
Epoch 16 — Train Loss: 0.6100 — Val Loss: 0.6149
Epoch 17 — Train Loss: 0.5996 — Val Loss: 0.6134
Epoch 18 — Train Loss: 0.5952 — Val Loss: 0.6095
Epoch 19 — Train Loss: 0.5919 — Val Loss: 0.6067
Epoch 20 — Train Loss: 0.5831 — Val Loss: 0.6050
Epoch 21 — Train Loss: 0.5785 — Val Loss: 0.6040
Epoch 22 — Train Loss: 0.5739 — Val Loss: 0.5995
Epoch 23 — Train Loss: 0.5732 — Val Loss: 0.5955
Epoch 24 — Train Loss: 0.5605 — Val Loss: 0.5982
Epoch 25 — Train Loss: 0.5566 — Val Loss: 0.5939
Epoch 26 — Train Loss: 0.5527 — Val Loss: 0.5946
Epoch 27 — Train Loss: 0.5438 — Val Loss: 0.5959
Epoch 28 — Train Loss: 0.5372 — Val Loss: 0.5980
Epoch 29 — Train Loss: 0.5354 — Val Loss: 0.5951
Epoch 30 — Train Loss: 0.5259 — Val Loss: 0.5892
Epoch 31 — Train Loss: 0.5199 — Val Loss: 0.5907
Epoch 32 — Train Loss: 0.5209 — Val Loss: 0.5852
Epoch 33 — Train Loss: 0.5147 — Val Loss: 0.5880
Epoch 34 — Train Loss: 0.5049 — Val Loss: 0.5886
Epoch 35 — Train Loss: 0.5070 — Val Loss: 0.5873
Epoch 36 — Train Loss: 0.4888 — Val Loss: 0.5893
Epoch 37 — Train Loss: 0.4903 — Val Loss: 0.5862
Epoch 38 — Train Loss: 0.4896 — Val Loss: 0.5849
Epoch 39 — Train Loss: 0.4792 — Val Loss: 0.5811
Epoch 40 — Train Loss: 0.4770 — Val Loss: 0.5860
Epoch 41 — Train Loss: 0.4694 — Val Loss: 0.5880
Epoch 42 — Train Loss: 0.4609 — Val Loss: 0.5838
Epoch 43 — Train Loss: 0.4623 — Val Loss: 0.5860
Epoch 44 — Train Loss: 0.4519 — Val Loss: 0.5825
Epoch 45 — Train Loss: 0.4547 — Val Loss: 0.5867
Epoch 46 — Train Loss: 0.4398 — Val Loss: 0.5893
Epoch 47 — Train Loss: 0.4388 — Val Loss: 0.5882
Epoch 48 — Train Loss: 0.4334 — Val Loss: 0.5853
Epoch 49 — Train Loss: 0.4276 — Val Loss: 0.5827
Early stopping.
Epoch 1 — Train Loss: 0.6931 — Val Loss: 0.6932
Epoch 2 — Train Loss: 0.6931 — Val Loss: 0.6932
Epoch 3 — Train Loss: 0.6931 — Val Loss: 0.6932
Epoch 4 — Train Loss: 0.6931 — Val Loss: 0.6932
Epoch 5 — Train Loss: 0.6931 — Val Loss: 0.6932
Epoch 6 — Train Loss: 0.6931 — Val Loss: 0.6932
Epoch 7 — Train Loss: 0.6931 — Val Loss: 0.6932
Epoch 8 — Train Loss: 0.6931 — Val Loss: 0.6932
Epoch 9 — Train Loss: 0.6931 — Val