[I 2025-05-11 02:46:23,213] Trial 76 finished with value: 0.5647532192143527 and parameters: {'lr': 5.521030197398119e-05, 'weight_decay': 0.0034417769435422414, 'optimizer': 'Adam', 'dropout_rate': 0.19166222823008694}. Best is trial 26 with value: 0.5343664689497514.
Epoch 135 — Train Loss: 0.6932 — Val Loss: 0.6932
Epoch 136 — Train Loss: 0.6932 — Val Loss: 0.6932
Epoch 137 — Train Loss: 0.6932 — Val Loss: 0.6932
Epoch 138 — Train Loss: 0.6932 — Val Loss: 0.6932
Epoch 139 — Train Loss: 0.6932 — Val Loss: 0.6932
Epoch 140 — Train Loss: 0.6932 — Val Loss: 0.6932
Epoch 141 — Train Loss: 0.6932 — Val Loss: 0.6932
Epoch 142 — Train Loss: 0.6932 — Val Loss: 0.6932
Epoch 143 — Train Loss: 0.6932 — Val Loss: 0.6932
Epoch 144 — Train Loss: 0.6932 — Val Loss: 0.6932
Epoch 145 — Train Loss: 0.6932 — Val Loss: 0.6932
Epoch 146 — Train Loss: 0.6932 — Val Loss: 0.6932
Epoch 147 — Train Loss: 0.6932 — Val Loss: 0.6932
Epoch 148 — Train Loss: 0.6932 — Val Loss: 0.6932
Epoch 149 — Train Loss: 0.6932 — Val Loss: 0.6932
Epoch 150 — Train Loss: 0.6932 — Val Loss: 0.6932
Epoch 151 — Train Loss: 0.6932 — Val Loss: 0.6932
Epoch 152 — Train Loss: 0.6932 — Val Loss: 0.6932
Epoch 153 — Train Loss: 0.6932 — Val Loss: 0.6932
Epoch 154 — Train Loss: 0.6932 — Val Loss: 0.6932
Epoch 155 — Train Loss: 0.6932 — Val Loss: 0.6932
Epoch 156 — Train Loss: 0.6932 — Val Loss: 0.6932
Epoch 157 — Train Loss: 0.6932 — Val Loss: 0.6932
Epoch 158 — Train Loss: 0.6932 — Val Loss: 0.6932
Epoch 159 — Train Loss: 0.6932 — Val Loss: 0.6932
Epoch 160 — Train Loss: 0.6932 — Val Loss: 0.6932
Epoch 161 — Train Loss: 0.6932 — Val Loss: 0.6932
Epoch 162 — Train Loss: 0.6932 — Val Loss: 0.6932
Epoch 163 — Train Loss: 0.6932 — Val Loss: 0.6932
Epoch 164 — Train Loss: 0.6932 — Val Loss: 0.6932
Epoch 165 — Train Loss: 0.6932 — Val Loss: 0.6932
Epoch 166 — Train Loss: 0.6932 — Val Loss: 0.6932
Epoch 167 — Train Loss: 0.6932 — Val Loss: 0.6932
Epoch 168 — Train Loss: 0.6932 — Val Loss: 0.6932
Epoch 169 — Train Loss: 0.6932 — Val Loss: 0.6932
Epoch 170 — Train Loss: 0.6932 — Val Loss: 0.6932
Epoch 171 — Train Loss: 0.6932 — Val Loss: 0.6932
Epoch 172 — Train Loss: 0.6932 — Val Loss: 0.6932
Epoch 173 — Train Loss: 0.6932 — Val Loss: 0.6932
Epoch 174 — Train Loss: 0.6932 — Val Loss: 0.6932
Epoch 175 — Train Loss: 0.6932 — Val Loss: 0.6932
Epoch 176 — Train Loss: 0.6932 — Val Loss: 0.6932
Epoch 177 — Train Loss: 0.6932 — Val Loss: 0.6932
Epoch 178 — Train Loss: 0.6932 — Val Loss: 0.6932
Epoch 179 — Train Loss: 0.6932 — Val Loss: 0.6932
Epoch 180 — Train Loss: 0.6932 — Val Loss: 0.6932
Epoch 181 — Train Loss: 0.6932 — Val Loss: 0.6932
Epoch 182 — Train Loss: 0.6932 — Val Loss: 0.6932
Epoch 183 — Train Loss: 0.6932 — Val Loss: 0.6932
Epoch 184 — Train Loss: 0.6932 — Val Loss: 0.6932
Epoch 185 — Train Loss: 0.6932 — Val Loss: 0.6932
Epoch 186 — Train Loss: 0.6932 — Val Loss: 0.6932
Epoch 187 — Train Loss: 0.6932 — Val Loss: 0.6932
Epoch 188 — Train Loss: 0.6932 — Val Loss: 0.6932
Epoch 189 — Train Loss: 0.6932 — Val Loss: 0.6932
Epoch 190 — Train Loss: 0.6932 — Val Loss: 0.6932
Epoch 191 — Train Loss: 0.6932 — Val Loss: 0.6932
Epoch 192 — Train Loss: 0.6932 — Val Loss: 0.6932
Epoch 193 — Train Loss: 0.6932 — Val Loss: 0.6932
Epoch 194 — Train Loss: 0.6932 — Val Loss: 0.6932
Epoch 195 — Train Loss: 0.6932 — Val Loss: 0.6932
Epoch 196 — Train Loss: 0.6932 — Val Loss: 0.6932
Epoch 197 — Train Loss: 0.6932 — Val Loss: 0.6932
Epoch 198 — Train Loss: 0.6932 — Val Loss: 0.6932
Epoch 199 — Train Loss: 0.6932 — Val Loss: 0.6932
Epoch 200 — Train Loss: 0.6932 — Val Loss: 0.6932
Epoch 1 — Train Loss: 0.6719 — Val Loss: 0.6606
Epoch 2 — Train Loss: 0.6409 — Val Loss: 0.6406
Epoch 3 — Train Loss: 0.6244 — Val Loss: 0.6121
Epoch 4 — Train Loss: 0.6102 — Val Loss: 0.6094
Epoch 5 — Train Loss: 0.5870 — Val Loss: 0.6195
Epoch 6 — Train Loss: 0.5737 — Val Loss: 0.5977
Epoch 7 — Train Loss: 0.5463 — Val Loss: 0.5907
Epoch 8 — Train Loss: 0.5258 — Val Loss: 0.5924
Epoch 9 — Train Loss: 0.5086 — Val Loss: 0.5859
Epoch 10 — Train Loss: 0.4686 — Val Loss: 0.5780
Epoch 11 — Train Loss: 0.4439 — Val Loss: 0.5584
Epoch 12 — Train Loss: 0.4146 — Val Loss: 0.5570
Epoch 13 — Train Loss: 0.3894 — Val Loss: 0.5547
Epoch 14 — Train Loss: 0.3697 — Val Loss: 0.5542
Epoch 15 — Train Loss: 0.3316 — Val Loss: 0.5683
Epoch 16 — Train Loss: 0.3130 — Val Loss: 0.5732
Epoch 17 — Train Loss: 0.2819 — Val Loss: 0.5845
Epoch 18 — Train Loss: 0.2666 — Val Loss: 0.5619
Epoch 19 — Train Loss: 0.2436 — Val Loss: 0.5603
Epoch 20 — Train Loss: 0.2415 — Val Loss: 0.5953
Epoch 21 — Train Loss: 0.2073 — Val Loss: 0.5617
Epoch 22 — Train Loss: 0.1834 — Val Loss: 0.5678
Epoch 23 — Train Loss: 0.1706 — Val Loss: 0.5661
Epoch 24 — Train Loss: 0.1490 — Val Loss: 0.5553
Early stopping.
Epoch 1 — Train Loss: 0.6763 — Val Loss: 0.6606
Epoch 2 — Train Loss: 0.6476 — Val Loss: 0.6149
Epoch 3 — Train Loss: 0.6251 — Val Loss: 0.6139
Epoch 4 — Train Loss: 0.6050 — Val Loss: 0.6026
Epoch 5 — Train Loss: 0.5815 — Val Loss: 0.5838
Epoch 6 — Train Loss: 0.5544 — Val Loss: 0.5662
Epoch 7 — Train Loss: 0.5375 — Val Loss: 0.5675
Epoch 8 — Train Loss: 0.5137 — Val Loss: 0.6067
Epoch 9 — Train Loss: 0.4810 — Val Loss: 0.5739
Epoch 10 — Train Loss: 0.4521 — Val Loss: 0.5542
Epoch 11 — Train Loss: 0.4081 — Val Loss: 0.5622
Epoch 12 — Train Loss: 0.3982 — Val Loss: 0.5701
Epoch 13 — Train Loss: 0.3582 — Val Loss: 0.5844
Epoch 14 — Train Loss: 0.3229 — Val Loss: 0.5653
Epoch 15 — Train Loss: 0.3048 — Val Loss: 0.5748
Epoch 16 — Train Loss: 0.2728 — Val Loss: 0.5454
Epoch 17 — Train Loss: 0.2389 — Val Loss: 0.5502
Epoch 18 — Train Loss: 0.2136 — Val Loss: 0.5724
Epoch 19 — Train Loss: 0.2003 — Val Loss: 0.5614
Epoch 20 — Train Loss: 0.1735 — Val Loss: 0.5572
Epoch 21 — Train Loss: 0.1564 — Val Loss: 0.5625
Epoch 22 — Train Loss: 0.1461 — Val Loss: 0.5680
Epoch 23 — Train Loss: 0.1177 — Val Loss: 0.5665
Epoch 24 — Train Loss: 0.1021 — Val Loss: 0.5756
Epoch 25 — Train Loss: 0.0889 — Val Loss: 0.5736
Epoch 26 — Train Loss: 0.0838 — Val Loss: 0.5781
Early stopping.
Epoch 1 — Train Loss: 0.6770 — Val Loss: 0.6547
Epoch 2 — Train Loss: 0.6549 — Val Loss: 0.6411
Epoch 3 — Train Loss: 0.6435 — Val Loss: 0.6337
Epoch 4 — Train Loss: 0.6307 — Val Loss: 0.6270
Epoch 5 — Train Loss: 0.6268 — Val Loss: 0.6237
Epoch 6 — Train Loss: 0.6135 — Val Loss: 0.6233
Epoch 7 — Train Loss: 0.6058 — Val Loss: 0.6236
Epoch 8 — Train Loss: 0.6051 — Val Loss: 0.6106
Epoch 9 — Train Loss: 0.5936 — Val Loss: 0.6111
Epoch 10 — Train Loss: 0.5873 — Val Loss: 0.6107
Epoch 11 — Train Loss: 0.5763 — Val Loss: 0.6078
Epoch 12 — Train Loss: 0.5650 — Val Loss: 0.6027
Epoch 13 — Train Loss: 0.5651 — Val Loss: 0.6024
Epoch 14 — Train Loss: 0.5469 — Val Loss: 0.6016
Epoch 15 — Train Loss: 0.5487 — Val Loss: 0.5965
Epoch 16 — Train Loss: 0.5343 — Val Loss: 0.5975
Epoch 17 — Train Loss: 0.5246 — Val Loss: 0.5950
Epoch 18 — Train Loss: 0.5241 — Val Loss: 0.6103
Epoch 19 — Train Loss: 0.5083 — Val Loss: 0.5970
Epoch 20 — Train Loss: 0.4875 — Val Loss: 0.5859
Epoch 21 — Train Loss: 0.4858 — Val Loss: 0.5880
Epoch 22 — Train Loss: 0.4872 — Val Loss: 0.5896
Epoch 23 — Train Loss: 0.4590 — Val Loss: 0.6071
Epoch 24 — Train Loss: 0.4709 — Val Loss: 0.6005
Epoch 25 — Train Loss: 0.4446 — Val Loss: 0.6097
Epoch 26 — Train Loss: 0.4444 — Val Loss: 0.5833
Epoch 27 — Train Loss: 0.4349 — Val Loss: 0.5947
Epoch 28 — Train Loss: 0.4291 — Val Loss: 0.5824
Epoch 29 — Train Loss: 0.4006 — Val Loss: 0.5943
Epoch 30 — Train Loss: 0.4024 — Val Loss: 0.6006
Epoch 31 — Train Loss: 0.3943 — Val Loss: 0.5829
Epoch 32 — Train Loss: 0.3870 — Val Loss: 0.5956
Epoch 33 — Train Loss: 0.3654 — Val Loss: 0.5998
Epoch 34 — Train Loss: 0.3665 — Val Loss: 0.5972
Epoch 35 — Train Loss: 0.3534 — Val Loss: 0.5715
Epoch 36 — Train Loss: 0.3410 — Val Loss: 0.5805
Epoch 37 — Train Loss: 0.3348 — Val Loss: 0.5894
Epoch 38 — Train Loss: 0.3139 — Val Loss: 0.5978
Epoch 39 — Train Loss: 0.3128 — Val Loss: 0.5960
Epoch 40 — Train Loss: 0.3136 — Val Loss: 0.5912
Epoch 41 — Train Loss: 0.2942 — Val Loss: 0.5956
Epoch 42 — Train Loss: 0.2937 — Val Loss: 0.5937
Epoch 43 — Train Loss: 0.2856 — Val Loss: 0.6008
Epoch 44 — Train Loss: 0.2779 — Val Loss: 0.6328
Epoch 45 — Train Loss: 0.2677 — Val Loss: 0.6209
Early stopping.
Epoch 1 — Train Loss: 0.6886 — Val Loss: 0.6755
Epoch 2 — Train Loss: 0.6675 — Val Loss: 0.6480
Epoch 3 — Train Loss: 0.6500 — Val Loss: 0.6369
Epoch 4 — Train Loss: 0.6348 — Val Loss: 0.6319
Epoch 5 — Train Loss: 0.6254 — Val Loss: 0.6256
Epoch 6 — Train Loss: 0.6100 — Val Loss: 0.6216
Epoch 7 — Train Loss: 0.5985 — Val Loss: 0.6164
Epoch 8 — Train Loss: 0.5830 — Val Loss: 0.6241
Epoch 9 — Train Loss: 0.5765 — Val Loss: 0.6048
Epoch 10 — Train Loss: 0.5537 — Val Loss: 0.6066
Epoch 11 — Train Loss: 0.5413 — Val Loss: 0.6021
Epoch 12 — Train Loss: 0.5320 — Val Loss: 0.5959
Epoch 13 — Train Loss: 0.5182 — Val Loss: 0.5957
Epoch 14 — Train Loss: 0.5035 — Val Loss: 0.6177
Epoch 15 — Train Loss: 0.5013 — Val Loss: 0.6067
Epoch 16 — Train Loss: 0.4714 — Val Loss: 0.6114
Epoch 17 — Train Loss: 0.4644 — Val Loss: 0.6074
Epoch 18 — Train Loss: 0.4385 — Val Loss: 0.5970
Epoch 19 — Train Loss: 0.4274 — Val Loss: 0.5891
Epoch 20 — Train Loss: 0.4059 — Val Loss: 0.6113
Epoch 21 — Train Loss: 0.4049 — Val Loss: 0.5888
Epoch 22 — Train Loss: 0.3708 — Val Loss: 0.5785
Epoch 23 — Train Loss: 0.3671 — Val Loss: 0.5825
Epoch 24 — Train Loss: 0.3485 — Val Loss: 0.5748
Epoch 25 — Train Loss: 0.3328 — Val Loss: 0.5852
Epoch 26 — Train Loss: 0.3153 — Val Loss: 0.5664
Epoch 27 — Train Loss: 0.2995 — Val Loss: 0.5700
Epoch 28 — Train Loss: 0.2920 — Val Loss: 0.5812
Epoch 29 — Train Loss: 0.2775 — Val Loss: 0.5762
Epoch 30 — Train Loss: 0.2623 — Val Loss: 0.5900
Epoch 31 — Train Loss: 0.2509 — Val Loss: 0.6053
Epoch 32 — Train Loss: 0.2500 — Val Loss: 0.6018
Epoch 33 — Train Loss: 0.2390 — Val Loss: 0.5853
Epoch 34 — Train Loss: 0.2177 — Val Loss: 0.5951
Epoch 35 — Train Loss: 0.2072 — Val Loss: 0.5937
Epoch 36 — Train Loss: 0.2012 — Val Loss: 0.5891
Early stopping.
Epoch 1 — Train Loss: 0.6931 — Val Loss: 0.6931
Epoch 2 — Train Loss: 0.6931 — Val Loss: 0.6931
Epoch 3 — Train Loss: 0.6931 — Val Loss: 0.6931
Epoch 4 — Train Loss: 0.6931 — Val Loss: 0.6931
Epoch 5 — Train Loss: 0.6931 — Val Loss: 0.6931
Epoch 6 — Train Loss: 0.6931 — Val Loss: 0.6931
Epoch 7 — Train Loss: 0.6931 — Val Loss: 0.6931
Epoch 8 — Train Loss: 0.6931 — Val Loss: 0.6931
Epoch 9 — Train Loss: 0.6931 — Val Loss: 0.6931
Epoch 10 — Train Loss: 0.6931 — Val Loss: 0.6931
Epoch 11 — Train Loss: 0.6931 — Val Loss: 0.6931
Epoch 12 — Train Loss: 0.6931 — Val Loss: 0.6931
Epoch 13 — Train Loss: 0.6931 — Val Loss: 0.6931
Epoch 14 — Train Loss: 0.6931 — Val Loss: 0.6931
Epoch 15 — Train Loss: 0.6931 — Val Loss: 0.6931
Epoch 16 — Train Loss: 0.6931 — Val Loss: 0.6931
Epoch 17 — Train Loss: 0.6931 — Val Loss: 0.6931
Epoch 18 — Train Loss: 0.6931 — Val Loss: 0.6931
Epoch 19 — Train Loss: 0.6931 — Val Loss: 0.6931
Epoch 20 — Train Loss: 0.6931 — Val Loss: 0.6931
Epoch 21 — Train Loss: 0.6931 — Val Loss: 0.6931
Epoch 22 — Train Loss: 0.6931 — Val Loss: 0.6931
Epoch 23 — Train Loss: 0.6931 — Val Loss: 0.6931
Epoch 24 — Train Loss: 0.6931 — Val Loss: 0.6931
Epoch 25 — Train Loss: 0.6931 — Val Loss: 0.6931
Epoch 26 — Train Loss: 0.6931 — Val Loss: 0.6931
Epoch 27 — Train Loss: 0.6931 — Val Loss: 0.6931
Epoch 28 — Train Loss: 0.6931 — Val Loss: 0.6931
Epoch 29 — Train Loss: 0.6931 — Val Loss: 0.6931
Epoch 30 — Train Loss: 0.6931 — Val Loss: 0.6931
Epoch 31 — Train Loss: 0.6931 — Val Loss: 0.6931
Epoch 32 — Train Loss: 0.6931 — Val Loss: 0.6931
Epoch 33 — Train Loss: 0.6931 — Val Loss: 0.6931
Epoch 34 — Train Loss: 0.6931 — Val Loss: 0.6931
Epoch 35 — Train Loss: 0.6931 — Val Loss: 0.6931
Epoch 36 — Train Loss: 0.6931 — Val Loss: 0.6931
Epoch 37 — Train Loss: 0.6931 — Val Loss: 0.6931
Epoch 38 — Train Loss: 0.6931 — Val Loss: 0.6931
Epoch 39 — Train Loss: 0.6931 — Val Loss: 0.6931
Epoch 40 — Train Loss: 0.6931 — Val Loss: 0.6931
Epoch 41 — Train Loss: 0.6931 — Val Loss: 0.6931
Epoch 42 — Train Loss: 0.6931 — Val Loss: 0.6931
Epoch 43 — Train Loss: 0.6931 — Val Loss: 0.6931
Epoch 44 — Train Loss: 0.6931 — Val Loss: 0.6931
Epoch 45 — Train Loss: 0.6931 — Val Loss: 0.6931
Epoch 46 — Train Loss: 0.6931 — Val Loss: 0.6931
Epoch 47 — Train Loss: 0.6931 — Val Loss: 0.6931
Epoch 48 — Train Loss: 0.6931 — Val Loss: 0.6931
Epoch 49 — Train Loss: 0.6931 — Val Loss: 0.6931
Epoch 50 — Train Loss: 0.6931 — Val Loss: 0.6931
Epoch 51 — Train Loss: 0.6931 — Val Loss: 0.6931
Epoch 52 — Train Loss: 0.6931 — Val Loss: 0.6931
Epoch 53 — Train Loss: 0.6931 — Val Loss: 0.6931
Epoch 54 — Train Loss: 0.6931 — Val Loss: 0.6931
Epoch 55 — Train Loss: 0.6931 — Val Loss: 0.6931
Epoch 56 — Train Loss: 0.6931 — Val Loss: 0.6931
Epoch 57 — Train Loss: 0.6931 — Val Loss: 0.6931
Epoch 58 — Train Loss: 0.6931 — Val Loss: 0.6931
Epoch 59 — Train Loss: 0.6931 — Val Loss: 0.6931
Epoch 60 — Train Loss: 0.6931 — Val Loss: 0.6931
Epoch 61 — Train Loss: 0.6931 — Val Loss: 0.6931
Epoch 62 — Train Loss: 0.6931 — Val Loss: 0.6931
Epoch 63 — Train Loss: 0.6931 — Val Loss: 0.6931
Epoch 64 — Train Loss: 0.6931 — Val Loss: 0.6931
Epoch 65 — Train Loss: 0.6931 — Val Loss: 0.6931
Epoch 66 — Train Loss: 0.6931 — Val Loss: 0.6931
Epoch 67 — Train Loss: 0.6931 — Val Loss: 0.6931
Epoch 68 — Train Loss: 0.6931 — Val Loss: 0.6931
Epoch 69 — Train Loss: 0.6931 — Val Loss: 0.6931
Epoch 70 — Train Loss: 0.6931 — Val Loss: 0.6931
Epoch 71 — Train Loss: 0.6931 — Val Loss: 0.6931
Epoch 72 — Train Loss: 0.6931 — Val Loss: 0.6931
Epoch 73 — Train Loss: 0.6931 — Val Loss: 0.6931
Epoch 74 — Train Loss: 0.6931 — Val Loss: 0.6931
Epoch 75 — Train Loss: 0.6931 — Val Loss: 0.6931
Epoch 76 — Train Loss: 0.6931 — Val Loss: 0.6931
Epoch 77 — Train Loss: 0.6931 — Val Loss: 0.6931
Epoch 78 — Train Loss: 0.6931 — Val Loss: 0.6931
Epoch 79 — Train Loss: 0.6931 — Val Loss: 0.6931
Epoch 80 — Train Loss: 0.6931 — Val Loss: 0.6931
Epoch 81 — Train Loss: 0.6931 — Val Loss: 0.6931
Epoch 82 — Train Loss: 0.6931 — Val Loss: 0.6931
Epoch 83 — Train Loss: 0.6931 — Val Loss: 0.6931
Epoch 84 — Train Loss: 0.6931 — Val Loss: 0.6931
Epoch 85 — Train Loss: 0.6931 — Val Loss: 0.6931
Epoch 86 — Train Loss: 0.6931 — Val Loss: 0.6931
Epoch 87 — Train Loss: 0.6931 — Val Loss: 0.6931
Epoch 88 — Train Loss: 0.6931 — Val Loss: 0.6931
Epoch 89 — Train Loss: 0.6931 — Val Loss: 0.6931
Epoch 90 — Train Loss: 0.6931 — Val Loss: 0.6931
Epoch 91 — Train Loss: 0.6931 — Val Loss: 0.6931
Epoch 92 — Train Loss: 0.6931 — Val Loss: 0.6931
Epoch 93 — Train Loss: 0.6931 — Val Loss: 0.6931
Epoch 94 — Train Loss: 0.6931 — Val Loss: 0.6931
Epoch 95 — Train Loss: 0.6931 — Val Loss: 0.6931
Epoch 96 — Train Loss: 0.6931 — Val Loss: 0.6931
Epoch 97 — Train Loss: 0.6931 — Val Loss: 0.6931
Epoch 98 — Train Loss: 0.6931 — Val Loss: 0.6931
Epoch 99 — Train Loss: 0.6931 — Val Loss: 0.6931
Epoch 100 — Train Loss: 0.6931 — Val Loss: 0.6931
Epoch 101 — Train Loss: 0.6931 — Val Loss: 0.6931
Epoch 102 — Train Loss: 0.6931 — Val Loss: 0.6931
Epoch 103 — Train Loss: 0.6931 — Val Loss: 0.6931
Epoch 104 — Train Loss: 0.6931 — Val Loss: 0.6931
Epoch 105 — Train Loss: 0.6931 — Val Loss: 0.6931
Epoch 106 — Train Loss: 0.6931 — Val Loss: 0.6931
Epoch 107 — Train Loss: 0.6931 — Val Loss: 0.6931
Epoch 108 — Train Loss: 0.6931 — Val Loss: 0.6931
Epoch 109 — Train Loss: 0.6931 — Val Loss: 0.6931
Epoch 110 — Train Loss: 0.6931 — Val Loss: 0.6931
Epoch 111 — Train Loss: 0.6931 — Val Loss: 0.6931
Epoch 112 — Train Loss: 0.6931 — Val Loss: 0.6931
Epoch 113 — Train Loss: 0.6931 — Val Loss: 0.6931
Epoch 114 — Train Loss: 0.6931 — Val Loss: 0.6931
Epoch 115 — Train Loss: 0.6931 — Val Loss: 0.6931
Epoch 116 — Train Loss: 0.6931 — Val Loss: 0.6931
Epoch 117 — Train Loss: 0.6931 — Val Loss: 0.6931
Epoch 118 — Train Loss: 0.6931 — Val Loss: 0.6931
Epoch 119 — Train Loss: 0.6931 — Val Loss: 0.6931
Epoch 120 — Train Loss: 0.6931 — Val Loss: 0.6931
Epoch 121 — Train Loss: 0.6931 — Val Loss: 0.6931
Epoch 122 — Train Loss: 0.6931 — Val Loss: 0.6931
Epoch 123 — Train Loss: 0.6931 — Val Loss: 0.6931
Epoch 124 — Train Loss: 0.6931 — Val Loss: 0.6931
Epoch 125 — Train Loss: 0.6931 — Val Loss: 0.6931
Epoch 126 — Train Loss: 0.6931 — Val Loss: 0.6931
Epoch 127 — Train Loss: 0.6931 — Val Loss: 0.6931
Epoch 128 — Train Loss: 0.6931 — Val Loss: 0.6931
Epoch 129 — Train Loss: 0.6931 — Val Loss: 0.6931
Epoch 130 — Train Loss: 0.6931 — Val Loss: 0.6931
Epoch 131 — Train Loss: 0.6931 — Val Loss: 0.6931
Epoch 132 — Train Loss: 0.6931 — Val Loss: 0.6931
Epoch 133 — Train Loss: 0.6931 — Val Loss: 0.6931
Epoch 134 — Train Loss: 0.6931 — Val Loss: 0.6931
Epoch 135 — Train Loss: 0.6931 — Val Loss: 0.6931
Epoch 136 — Train Loss: 0.6931 — Val Loss: 0.6931
Epoch 137 — Train Loss: 0.6931 — Val Loss: 0.6931
Epoch 138 — Train Loss: 0.6931 — Val Loss: 0.6931
Epoch 139 — Train Loss: 0.6931 — Val Loss: 0.6931
Epoch 140 — Train Loss: 0.6931 — Val Loss: 0.6931
Epoch 141 — Train Loss: 0.6931 — Val Loss: 0.6931
Epoch 142 — Train Loss: 0.6931 — Val Loss: 0.6931
Epoch 143 — Train Loss: 0.6931 — Val Loss: 0.6931
Epoch 144 — Train Loss: 0.6931 — Val Loss: 0.6931
Epoch 145 — Train Loss: 0.6931 — Val Loss: 0.6931
Epoch 146 — Train Loss: 0.6931 — Val Loss: 0.6931
Epoch 147 — Train Loss: 0.6931 — Val Loss: 0.6931
Epoch 148 — Train Loss: 0.6931 — Val Loss: 0.6931
Epoch 149 — Train Loss: 0.6931 — Val Loss: 0.6931
Epoch 150 — Train Loss: 0.6931 — Val Loss: 0.6931
Epoch 151 — Train Loss: 0.6931 — Val Loss: 0.6931
Epoch 152 — Train Loss: 0.6931 — Val Loss: 0.6931
Epoch 153 — Train Loss: 0.6931 — Val Loss: 0.6931
Epoch 154 — Train Loss: 0.6931 — Val Loss: 0.6931
Epoch 155 — Train Loss: 0.6931 — Val Loss: 0.6931
Epoch 156 — Train Loss: 0.6931 — Val Loss: 0.6931
Epoch 157 — Train Loss: 0.6931 — Val Loss: 0.6931
Epoch 158 — Train Loss: 0.6931 — Val Loss: 0.6931
Epoch 159 — Train Loss: 0.6931 — Val Loss: 0.6931
Epoch 160 — Train Loss: 0.6931 — Val Loss: 0.6931
Epoch 161 — Train Loss: 0.6931 — Val Loss: 0.6931
Epoch 162 — Train Loss: 0.6931 — Val Loss: 0.6931
Epoch 163 — Train Loss: 0.6931 — Val Loss: 0.6931
Epoch 164 — Train Loss: 0.6931 — Val Loss: 0.6931
Epoch 165 — Train Loss: 0.6931 — Val Loss: 0.6931
Epoch 166 — Train Loss: 0.6931 — Val Loss: 0.6931
Epoch 167 — Train Loss: 0.6931 — Val Loss: 0.6931
Epoch 168 — Train Loss: 0.6931 — Val Loss: 0.6931
Epoch 169 — Train Loss: 0.6931 — Val Loss: 0.6931
Epoch 170 — Train Loss: 0.6931 — Val Loss: 0.6931
Epoch 171 — Train Loss: 0.6931 — Val Loss: 0.6931
Epoch 172 — Train Loss: 0.6931 — Val Loss: 0.6931
Epoch 173 — Train Loss: 0.6931 — Val Loss: 0.6931
Epoch 174 — Train Loss: 0.6931 — Val Loss: 0.6931
Epoch 175 — Train Loss: 0.6931 — Val Loss: 0.6931
Epoch 176 — Train Loss: 0.6931 — Val Loss: 0.6931
Epoch 177 — Train Loss: 0.6931 — Val Loss: 0.6931
Epoch 178 — Train Loss: 0.6931 — Val Loss: 0.6931
Epoch 179 — Train Loss: 0.6931 — Val Loss: 0.6931
Epoch 180 — Train Loss: 0.6931 — Val Loss: 0.6931
Epoch 181 — Train Loss: 0.6931 — Val Loss: 0.6931
Epoch 182 — Train Loss: 0.6931 — Val Loss: 0.6931
Epoch 183 — Train Loss: 0.6931 — Val Loss: 0.6931
Epoch 184 — Train Loss: 0.6931 — Val Loss: 0.6931
Epoch 185 — Train Loss: 0.6931 — Val Loss: 0.6931
Epoch 186 — Train Loss: 0.6931 — Val Loss: 0.6931
Epoch 187 — Train Loss: 0.6931 — Val Loss: 0.6931
Epoch 188 — Train Loss: 0.6931 — Val Loss: 0.6931
Epoch 189 — Train Loss: 0.6931 — Val Loss: 0.6931
Epoch 190 — Train Loss: 0.6931 — Val Loss: 0.6931
Epoch 191 — Train Loss: 0.6931 — Val Loss: 0.6931
Epoch 192 — Train Loss: 0.6931 — Val Loss: 0.6931
Epoch 193 — Train Loss: 0.6931 — Val Loss: 0.6931
Epoch 194 — Train Loss: 0.6931 — Val Loss: 0.6931
Epoch 195 — Train Loss: 0.6931 — Val Loss: 0.6931
Epoch 196 — Train Loss: 0.6931 — Val Loss: 0.6931
Epoch 197 — Train Loss: 0.6931 — Val Loss: 0.6931
Epoch 198 — Train Loss: 0.6931 — Val Loss: 0.6931
Epoch 199 — Train Loss: 0.6931 — Val Loss: 0.6931
Epoch 200 — Train Loss: 0.6931 — Val Loss: 0.6931
Epoch 1 — Train Loss: 0.6793 — Val Loss: 0.6475
Epoch 2 — Train Loss: 0.6584 — Val Loss: 0.6237
Epoch 3 — Train Loss: 0.6447 — Val Loss: 0.6243
Epoch 4 — Train Loss: 0.6355 — Val Loss: 0.6155
Epoch 5 — Train Loss: 0.6244 — Val Loss: 0.6090
Epoch 6 — Train Loss: 0.6220 — Val Loss: 0.6058
Epoch 7 — Train Loss: 0.6065 — Val Loss: 0.5941
Epoch 8 — Train Loss: 0.6056 — Val Loss: 0.5751
Epoch 9 — Train Loss: 0.5865 — Val Loss: 0.5673
Epoch 10 — Train Loss: 0.5847 — Val Loss: 0.5627
Epoch 11 — Train Loss: 0.5578 — Val Loss: 0.5688
Epoch 12 — Train Loss: 0.5615 — Val Loss: 0.5585
Epoch 13 — Train Loss: 0.5471 — Val Loss: 0.5789
Epoch 14 — Train Loss: 0.5168 — Val Loss: 0.5724
Epoch 15 — Train Loss: 0.4918 — Val Loss: 0.5648
Epoch 16 — Train Loss: 0.4806 — Val Loss: 0.5527
Epoch 17 — Train Loss: 0.4532 — Val Loss: 0.5536
Epoch 18 — Train Loss: 0.4355 — Val Loss: 0.5500
Epoch 19 — Train Loss: 0.4086 — Val Loss: 0.5678
Epoch 20 — Train Loss: 0.3707 — Val Loss: 0.5573
Epoch 21 — Train Loss: 0.3623 — Val Loss: 0.5672
Epoch 22 — Train Loss: 0.3365 — Val Loss: 0.5338
Epoch 23 — Train Loss: 0.3335 — Val Loss: 0.5581
Epoch 24 — Train Loss: 0.3048 — Val Loss: 0.5480
Epoch 25 — Train Loss: 0.2797 — Val Loss: 0.5687
Epoch 26 — Train Loss: 0.2533 — Val Loss: 0.5429
Epoch 27 — Train Loss: 0.2432 — Val Loss: 0.5787
Epoch 28 — Train Loss: 0.2305 — Val Loss: 0.5445
Epoch 29 — Train Loss: 0.2255 — Val Loss: 0.5653
Epoch 30 — Train Loss: 0.1916 — Val Loss: 0.5579
Epoch 31 — Train Loss: 0.1816 — Val Loss: 0.5660
Epoch 32 — Train Loss: 0.1702 — Val Loss: 0.5728
Early stopping.
Epoch 1 — Train Loss: 0.6821 — Val Loss: 0.6609
Epoch 2 — Train Loss: 0.6574 — Val Loss: 0.6318
Epoch 3 — Train Loss: 0.6441 — Val Loss: 0.6270
Epoch 4 — Train Loss: 0.6228 — Val Loss: 0.6307
Epoch 5 — Train Loss: 0.6234 — Val Loss: 0.6050
Epoch 6 — Train Loss: 0.6039 — Val Loss: 0.5933
Epoch 7 — Train Loss: 0.5889 — Val Loss: 0.6080
Epoch 8 — Train Loss: 0.5792 — Val Loss: 0.5685
Epoch 9 — Train Loss: 0.5704 — Val Loss: 0.5789
Epoch 10 — Train Loss: 0.5497 — Val Loss: 0.5667
Epoch 11 — Train Loss: 0.5255 — Val