[I 2025-05-10 21:26:49,124] Trial 47 finished with value: 0.5780807668512518 and parameters: {'lr': 3.2078613738067346e-05, 'weight_decay': 0.0011445781849040598, 'optimizer': 'Adam', 'dropout_rate': 0.261823878615638}. Best is trial 26 with value: 0.5343664689497514.
Epoch 18 — Train Loss: 0.0965 — Val Loss: 0.5877
Epoch 19 — Train Loss: 0.0761 — Val Loss: 0.5831
Early stopping.
Epoch 1 — Train Loss: 0.7005 — Val Loss: 0.6931
Epoch 2 — Train Loss: 0.6933 — Val Loss: 0.6932
Epoch 3 — Train Loss: 0.6928 — Val Loss: 0.6928
Epoch 4 — Train Loss: 0.6916 — Val Loss: 0.6909
Epoch 5 — Train Loss: 0.6921 — Val Loss: 0.6923
Epoch 6 — Train Loss: 0.6906 — Val Loss: 0.6908
Epoch 7 — Train Loss: 0.6901 — Val Loss: 0.6912
Epoch 8 — Train Loss: 0.6904 — Val Loss: 0.6897
Epoch 9 — Train Loss: 0.6874 — Val Loss: 0.6893
Epoch 10 — Train Loss: 0.6891 — Val Loss: 0.6902
Epoch 11 — Train Loss: 0.6915 — Val Loss: 0.6925
Epoch 12 — Train Loss: 0.6919 — Val Loss: 0.6908
Epoch 13 — Train Loss: 0.6918 — Val Loss: 0.6866
Epoch 14 — Train Loss: 0.6905 — Val Loss: 0.6854
Epoch 15 — Train Loss: 0.6859 — Val Loss: 0.6839
Epoch 16 — Train Loss: 0.6864 — Val Loss: 0.6862
Epoch 17 — Train Loss: 0.6877 — Val Loss: 0.6855
Epoch 18 — Train Loss: 0.6873 — Val Loss: 0.6831
Epoch 19 — Train Loss: 0.6856 — Val Loss: 0.6877
Epoch 20 — Train Loss: 0.6897 — Val Loss: 0.6885
Epoch 21 — Train Loss: 0.6910 — Val Loss: 0.6897
Epoch 22 — Train Loss: 0.6911 — Val Loss: 0.6874
Epoch 23 — Train Loss: 0.6872 — Val Loss: 0.6867
Epoch 24 — Train Loss: 0.6914 — Val Loss: 0.6909
Epoch 25 — Train Loss: 0.6920 — Val Loss: 0.6924
Epoch 26 — Train Loss: 0.6943 — Val Loss: 0.6920
Epoch 27 — Train Loss: 0.6925 — Val Loss: 0.6908
Epoch 28 — Train Loss: 0.6892 — Val Loss: 0.6892
Early stopping.
Epoch 1 — Train Loss: 0.6822 — Val Loss: 0.6704
Epoch 2 — Train Loss: 0.6513 — Val Loss: 0.6417
Epoch 3 — Train Loss: 0.6404 — Val Loss: 0.6202
Epoch 4 — Train Loss: 0.6218 — Val Loss: 0.6249
Epoch 5 — Train Loss: 0.5913 — Val Loss: 0.6342
Epoch 6 — Train Loss: 0.5799 — Val Loss: 0.6050
Epoch 7 — Train Loss: 0.5597 — Val Loss: 0.6086
Epoch 8 — Train Loss: 0.5538 — Val Loss: 0.6001
Epoch 9 — Train Loss: 0.5291 — Val Loss: 0.5979
Epoch 10 — Train Loss: 0.5040 — Val Loss: 0.5828
Epoch 11 — Train Loss: 0.4847 — Val Loss: 0.5645
Epoch 12 — Train Loss: 0.4671 — Val Loss: 0.5620
Epoch 13 — Train Loss: 0.4338 — Val Loss: 0.5672
Epoch 14 — Train Loss: 0.4134 — Val Loss: 0.5759
Epoch 15 — Train Loss: 0.3786 — Val Loss: 0.5626
Epoch 16 — Train Loss: 0.3581 — Val Loss: 0.5634
Epoch 17 — Train Loss: 0.3374 — Val Loss: 0.5660
Epoch 18 — Train Loss: 0.3223 — Val Loss: 0.5933
Epoch 19 — Train Loss: 0.2963 — Val Loss: 0.5427
Epoch 20 — Train Loss: 0.2846 — Val Loss: 0.5609
Epoch 21 — Train Loss: 0.2620 — Val Loss: 0.5657
Epoch 22 — Train Loss: 0.2378 — Val Loss: 0.5829
Epoch 23 — Train Loss: 0.2238 — Val Loss: 0.5866
Epoch 24 — Train Loss: 0.2018 — Val Loss: 0.5748
Epoch 25 — Train Loss: 0.2062 — Val Loss: 0.5626
Epoch 26 — Train Loss: 0.1778 — Val Loss: 0.5702
Epoch 27 — Train Loss: 0.1662 — Val Loss: 0.5613
Epoch 28 — Train Loss: 0.1483 — Val Loss: 0.5597
Epoch 29 — Train Loss: 0.1380 — Val Loss: 0.5663
Early stopping.
Epoch 1 — Train Loss: 0.6926 — Val Loss: 0.6917
Epoch 2 — Train Loss: 0.6874 — Val Loss: 0.6813
Epoch 3 — Train Loss: 0.6714 — Val Loss: 0.6587
Epoch 4 — Train Loss: 0.6524 — Val Loss: 0.6422
Epoch 5 — Train Loss: 0.6360 — Val Loss: 0.6377
Epoch 6 — Train Loss: 0.6304 — Val Loss: 0.6280
Epoch 7 — Train Loss: 0.6170 — Val Loss: 0.6178
Epoch 8 — Train Loss: 0.6072 — Val Loss: 0.6150
Epoch 9 — Train Loss: 0.5981 — Val Loss: 0.6091
Epoch 10 — Train Loss: 0.5908 — Val Loss: 0.6024
Epoch 11 — Train Loss: 0.5773 — Val Loss: 0.6024
Epoch 12 — Train Loss: 0.5615 — Val Loss: 0.6017
Epoch 13 — Train Loss: 0.5566 — Val Loss: 0.6046
Epoch 14 — Train Loss: 0.5469 — Val Loss: 0.5961
Epoch 15 — Train Loss: 0.5267 — Val Loss: 0.5941
Epoch 16 — Train Loss: 0.5218 — Val Loss: 0.5999
Epoch 17 — Train Loss: 0.5083 — Val Loss: 0.5913
Epoch 18 — Train Loss: 0.4953 — Val Loss: 0.6169
Epoch 19 — Train Loss: 0.4920 — Val Loss: 0.6039
Epoch 20 — Train Loss: 0.4751 — Val Loss: 0.5928
Epoch 21 — Train Loss: 0.4618 — Val Loss: 0.5950
Epoch 22 — Train Loss: 0.4434 — Val Loss: 0.5942
Epoch 23 — Train Loss: 0.4322 — Val Loss: 0.5894
Epoch 24 — Train Loss: 0.4320 — Val Loss: 0.5909
Epoch 25 — Train Loss: 0.4081 — Val Loss: 0.5831
Epoch 26 — Train Loss: 0.4043 — Val Loss: 0.5737
Epoch 27 — Train Loss: 0.3782 — Val Loss: 0.6171
Epoch 28 — Train Loss: 0.3701 — Val Loss: 0.5810
Epoch 29 — Train Loss: 0.3669 — Val Loss: 0.5825
Epoch 30 — Train Loss: 0.3499 — Val Loss: 0.5776
Epoch 31 — Train Loss: 0.3332 — Val Loss: 0.5927
Epoch 32 — Train Loss: 0.3351 — Val Loss: 0.6016
Epoch 33 — Train Loss: 0.3222 — Val Loss: 0.5923
Epoch 34 — Train Loss: 0.3165 — Val Loss: 0.5787
Epoch 35 — Train Loss: 0.2973 — Val Loss: 0.5710
Epoch 36 — Train Loss: 0.2840 — Val Loss: 0.5779
Epoch 37 — Train Loss: 0.2768 — Val Loss: 0.5977
Epoch 38 — Train Loss: 0.2637 — Val Loss: 0.5825
Epoch 39 — Train Loss: 0.2590 — Val Loss: 0.5775
Epoch 40 — Train Loss: 0.2448 — Val Loss: 0.5904
Epoch 41 — Train Loss: 0.2343 — Val Loss: 0.5958
Epoch 42 — Train Loss: 0.2250 — Val Loss: 0.5915
Epoch 43 — Train Loss: 0.2236 — Val Loss: 0.5953
Epoch 44 — Train Loss: 0.2188 — Val Loss: 0.5865
Epoch 45 — Train Loss: 0.2058 — Val Loss: 0.5837
Early stopping.
Epoch 1 — Train Loss: 0.6711 — Val Loss: 0.6444
Epoch 2 — Train Loss: 0.6452 — Val Loss: 0.6252
Epoch 3 — Train Loss: 0.6329 — Val Loss: 0.6163
Epoch 4 — Train Loss: 0.6205 — Val Loss: 0.6019
Epoch 5 — Train Loss: 0.6066 — Val Loss: 0.5843
Epoch 6 — Train Loss: 0.5886 — Val Loss: 0.6228
Epoch 7 — Train Loss: 0.5773 — Val Loss: 0.5866
Epoch 8 — Train Loss: 0.5662 — Val Loss: 0.5972
Epoch 9 — Train Loss: 0.5506 — Val Loss: 0.5827
Epoch 10 — Train Loss: 0.5315 — Val Loss: 0.5876
Epoch 11 — Train Loss: 0.5127 — Val Loss: 0.5881
Epoch 12 — Train Loss: 0.4953 — Val Loss: 0.5896
Epoch 13 — Train Loss: 0.4706 — Val Loss: 0.5920
Epoch 14 — Train Loss: 0.4478 — Val Loss: 0.5582
Epoch 15 — Train Loss: 0.4426 — Val Loss: 0.5616
Epoch 16 — Train Loss: 0.4197 — Val Loss: 0.5733
Epoch 17 — Train Loss: 0.3948 — Val Loss: 0.5825
Epoch 18 — Train Loss: 0.3715 — Val Loss: 0.5817
Epoch 19 — Train Loss: 0.3589 — Val Loss: 0.5644
Epoch 20 — Train Loss: 0.3422 — Val Loss: 0.5689
Epoch 21 — Train Loss: 0.3245 — Val Loss: 0.5568
Epoch 22 — Train Loss: 0.2997 — Val Loss: 0.5536
Epoch 23 — Train Loss: 0.2940 — Val Loss: 0.5870
Epoch 24 — Train Loss: 0.2711 — Val Loss: 0.5552
Epoch 25 — Train Loss: 0.2606 — Val Loss: 0.5825
Epoch 26 — Train Loss: 0.2398 — Val Loss: 0.5697
Epoch 27 — Train Loss: 0.2278 — Val Loss: 0.5590
Epoch 28 — Train Loss: 0.2245 — Val Loss: 0.5814
Epoch 29 — Train Loss: 0.2056 — Val Loss: 0.5637
Epoch 30 — Train Loss: 0.1943 — Val Loss: 0.5666
Epoch 31 — Train Loss: 0.1710 — Val Loss: 0.6148
Epoch 32 — Train Loss: 0.1717 — Val Loss: 0.5820
Early stopping.
Epoch 1 — Train Loss: 0.6734 — Val Loss: 0.6345
Epoch 2 — Train Loss: 0.6353 — Val Loss: 0.6123
Epoch 3 — Train Loss: 0.6178 — Val Loss: 0.5808
Epoch 4 — Train Loss: 0.6018 — Val Loss: 0.5866
Epoch 5 — Train Loss: 0.5581 — Val Loss: 0.5770
Epoch 6 — Train Loss: 0.5124 — Val Loss: 0.5324
Epoch 7 — Train Loss: 0.4587 — Val Loss: 0.5433
Epoch 8 — Train Loss: 0.3855 — Val Loss: 0.5354
Epoch 9 — Train Loss: 0.3390 — Val Loss: 0.5479
Epoch 10 — Train Loss: 0.2663 — Val Loss: 0.5342
Epoch 11 — Train Loss: 0.2110 — Val Loss: 0.5312
Epoch 12 — Train Loss: 0.1641 — Val Loss: 0.5384
Epoch 13 — Train Loss: 0.1416 — Val Loss: 0.5684
Epoch 14 — Train Loss: 0.0987 — Val Loss: 0.5921
Epoch 15 — Train Loss: 0.0788 — Val Loss: 0.6117
Epoch 16 — Train Loss: 0.0648 — Val Loss: 0.5922
Epoch 17 — Train Loss: 0.0558 — Val Loss: 0.6229
Epoch 18 — Train Loss: 0.0402 — Val Loss: 0.6142
Epoch 19 — Train Loss: 0.0294 — Val Loss: 0.6370
Epoch 20 — Train Loss: 0.0232 — Val Loss: 0.6509
Epoch 21 — Train Loss: 0.0181 — Val Loss: 0.6425
Early stopping.
Epoch 1 — Train Loss: 0.6894 — Val Loss: 0.6763
Epoch 2 — Train Loss: 0.6623 — Val Loss: 0.6558
Epoch 3 — Train Loss: 0.6472 — Val Loss: 0.6346
Epoch 4 — Train Loss: 0.6372 — Val Loss: 0.6269
Epoch 5 — Train Loss: 0.6228 — Val Loss: 0.6278
Epoch 6 — Train Loss: 0.6083 — Val Loss: 0.6159
Epoch 7 — Train Loss: 0.5891 — Val Loss: 0.6420
Epoch 8 — Train Loss: 0.5673 — Val Loss: 0.6030
Epoch 9 — Train Loss: 0.5543 — Val Loss: 0.6069
Epoch 10 — Train Loss: 0.5472 — Val Loss: 0.6023
Epoch 11 — Train Loss: 0.5301 — Val Loss: 0.6204
Epoch 12 — Train Loss: 0.5073 — Val Loss: 0.6274
Epoch 13 — Train Loss: 0.4882 — Val Loss: 0.5843
Epoch 14 — Train Loss: 0.4608 — Val Loss: 0.5861
Epoch 15 — Train Loss: 0.4452 — Val Loss: 0.5859
Epoch 16 — Train Loss: 0.4218 — Val Loss: 0.5950
Epoch 17 — Train Loss: 0.4034 — Val Loss: 0.6122
Epoch 18 — Train Loss: 0.3888 — Val Loss: 0.5881
Epoch 19 — Train Loss: 0.3716 — Val Loss: 0.5796
Epoch 20 — Train Loss: 0.3504 — Val Loss: 0.5754
Epoch 21 — Train Loss: 0.3250 — Val Loss: 0.5875
Epoch 22 — Train Loss: 0.3045 — Val Loss: 0.5788
Epoch 23 — Train Loss: 0.2937 — Val Loss: 0.5925
Epoch 24 — Train Loss: 0.2764 — Val Loss: 0.5854
Epoch 25 — Train Loss: 0.2573 — Val Loss: 0.5926
Epoch 26 — Train Loss: 0.2366 — Val Loss: 0.5909
Epoch 27 — Train Loss: 0.2268 — Val Loss: 0.5804
Epoch 28 — Train Loss: 0.2213 — Val Loss: 0.5951
Epoch 29 — Train Loss: 0.2015 — Val Loss: 0.5851
Epoch 30 — Train Loss: 0.1896 — Val Loss: 0.5847
Early stopping.
Epoch 1 — Train Loss: 0.6785 — Val Loss: 0.6472
Epoch 2 — Train Loss: 0.6568 — Val Loss: 0.6426
Epoch 3 — Train Loss: 0.6314 — Val Loss: 0.6194
Epoch 4 — Train Loss: 0.6054 — Val Loss: 0.6112
Epoch 5 — Train Loss: 0.5883 — Val Loss: 0.5959
Epoch 6 — Train Loss: 0.5568 — Val Loss: 0.6088
Epoch 7 — Train Loss: 0.5307 — Val Loss: 0.5734
Epoch 8 — Train Loss: 0.5060 — Val Loss: 0.6093
Epoch 9 — Train Loss: 0.4686 — Val Loss: 0.5743
Epoch 10 — Train Loss: 0.4346 — Val Loss: 0.5654
Epoch 11 — Train Loss: 0.3958 — Val Loss: 0.6084
Epoch 12 — Train Loss: 0.3625 — Val Loss: 0.5504
Epoch 13 — Train Loss: 0.3196 — Val Loss: 0.5744
Epoch 14 — Train Loss: 0.2849 — Val Loss: 0.6394
Epoch 15 — Train Loss: 0.2423 — Val Loss: 0.5696
Epoch 16 — Train Loss: 0.2182 — Val Loss: 0.5804
Epoch 17 — Train Loss: 0.2040 — Val Loss: 0.6194
Epoch 18 — Train Loss: 0.1767 — Val Loss: 0.5649
Epoch 19 — Train Loss: 0.1513 — Val Loss: 0.5446
Epoch 20 — Train Loss: 0.1233 — Val Loss: 0.5640
Epoch 21 — Train Loss: 0.1055 — Val Loss: 0.5844
Epoch 22 — Train Loss: 0.0917 — Val Loss: 0.5910
Epoch 23 — Train Loss: 0.0813 — Val Loss: 0.5708
Epoch 24 — Train Loss: 0.0732 — Val Loss: 0.5682
Epoch 25 — Train Loss: 0.0627 — Val Loss: 0.5938
Epoch 26 — Train Loss: 0.0500 — Val Loss: 0.5925
Epoch 27 — Train Loss: 0.0517 — Val Loss: 0.6081
Epoch 28 — Train Loss: 0.0401 — Val Loss: 0.6134
Epoch 29 — Train Loss: 0.0308 — Val Loss: 0.6387
Early stopping.
Epoch 1 — Train Loss: 0.6770 — Val Loss: 0.6461
Epoch 2 — Train Loss: 0.6467 — Val Loss: 0.6282
Epoch 3 — Train Loss: 0.6321 — Val Loss: 0.6174
Epoch 4 — Train Loss: 0.6101 — Val Loss: 0.6155
Epoch 5 — Train Loss: 0.5922 — Val Loss: 0.6123
Epoch 6 — Train Loss: 0.5695 — Val Loss: 0.6010
Epoch 7 — Train Loss: 0.5452 — Val Loss: 0.5814
Epoch 8 — Train Loss: 0.5084 — Val Loss: 0.5818
Epoch 9 — Train Loss: 0.4791 — Val Loss: 0.6678
Epoch 10 — Train Loss: 0.4730 — Val Loss: 0.5510
Epoch 11 — Train Loss: 0.4239 — Val Loss: 0.5584
Epoch 12 — Train Loss: 0.3947 — Val Loss: 0.5401
Epoch 13 — Train Loss: 0.3559 — Val Loss: 0.5358
Epoch 14 — Train Loss: 0.3369 — Val Loss: 0.5838
Epoch 15 — Train Loss: 0.3182 — Val Loss: 0.5424
Epoch 16 — Train Loss: 0.2912 — Val Loss: 0.5930
Epoch 17 — Train Loss: 0.2595 — Val Loss: 0.5333
Epoch 18 — Train Loss: 0.2247 — Val Loss: 0.5294
Epoch 19 — Train Loss: 0.2042 — Val Loss: 0.5248
Epoch 20 — Train Loss: 0.1935 — Val Loss: 0.5229
Epoch 21 — Train Loss: 0.1718 — Val Loss: 0.5386
Epoch 22 — Train Loss: 0.1536 — Val Loss: 0.5445
Epoch 23 — Train Loss: 0.1483 — Val Loss: 0.5346
Epoch 24 — Train Loss: 0.1206 — Val Loss: 0.5398
Epoch 25 — Train Loss: 0.1170 — Val Loss: 0.5381
Epoch 26 — Train Loss: 0.0916 — Val Loss: 0.5462
Epoch 27 — Train Loss: 0.0844 — Val Loss: 0.5874
Epoch 28 — Train Loss: 0.0736 — Val Loss: 0.5290
Epoch 29 — Train Loss: 0.0711 — Val Loss: 0.5357
Epoch 30 — Train Loss: 0.0574 — Val Loss: 0.5705
Early stopping.
Epoch 1 — Train Loss: 0.6833 — Val Loss: 0.6511
Epoch 2 — Train Loss: 0.6537 — Val Loss: 0.6379
Epoch 3 — Train Loss: 0.6363 — Val Loss: 0.6382
Epoch 4 — Train Loss: 0.6282 — Val Loss: 0.6165
Epoch 5 — Train Loss: 0.6246 — Val Loss: 0.6065
Epoch 6 — Train Loss: 0.6022 — Val Loss: 0.5968
Epoch 7 — Train Loss: 0.5979 — Val Loss: 0.6025
Epoch 8 — Train Loss: 0.5804 — Val Loss: 0.6083
Epoch 9 — Train Loss: 0.5634 — Val Loss: 0.5831
Epoch 10 — Train Loss: 0.5384 — Val Loss: 0.5858
Epoch 11 — Train Loss: 0.5301 — Val Loss: 0.5642
Epoch 12 — Train Loss: 0.5088 — Val Loss: 0.5807
Epoch 13 — Train Loss: 0.4866 — Val Loss: 0.5334
Epoch 14 — Train Loss: 0.4724 — Val Loss: 0.5564
Epoch 15 — Train Loss: 0.4430 — Val Loss: 0.5403
Epoch 16 — Train Loss: 0.4280 — Val Loss: 0.5390
Epoch 17 — Train Loss: 0.3950 — Val Loss: 0.5800
Epoch 18 — Train Loss: 0.3888 — Val Loss: 0.5216
Epoch 19 — Train Loss: 0.3571 — Val Loss: 0.5320
Epoch 20 — Train Loss: 0.3241 — Val Loss: 0.5533
Epoch 21 — Train Loss: 0.3064 — Val Loss: 0.5690
Epoch 22 — Train Loss: 0.2994 — Val Loss: 0.5402
Epoch 23 — Train Loss: 0.2721 — Val Loss: 0.5515
Epoch 24 — Train Loss: 0.2627 — Val Loss: 0.6049
Epoch 25 — Train Loss: 0.2325 — Val Loss: 0.5419
Epoch 26 — Train Loss: 0.2216 — Val Loss: 0.5486
Epoch 27 — Train Loss: 0.2076 — Val Loss: 0.5529
Epoch 28 — Train Loss: 0.2054 — Val Loss: 0.5508
Early stopping.
Epoch 1 — Train Loss: 0.6699 — Val Loss: 0.6425
Epoch 2 — Train Loss: 0.6431 — Val Loss: 0.6278
Epoch 3 — Train Loss: 0.6434 — Val Loss: 0.6423
Epoch 4 — Train Loss: 0.6306 — Val Loss: 0.6106
Epoch 5 — Train Loss: 0.6200 — Val Loss: 0.6296
Epoch 6 — Train Loss: 0.6158 — Val Loss: 0.6129
Epoch 7 — Train Loss: 0.5973 — Val Loss: 0.5809
Epoch 8 — Train Loss: 0.5822 — Val Loss: 0.5958
Epoch 9 — Train Loss: 0.5783 — Val Loss: 0.5844
Epoch 10 — Train Loss: 0.5519 — Val Loss: 0.5672
Epoch 11 — Train Loss: 0.5429 — Val Loss: 0.5636
Epoch 12 — Train Loss: 0.5113 — Val Loss: 0.5608
Epoch 13 — Train Loss: 0.4917 — Val Loss: 0.5670
Epoch 14 — Train Loss: 0.4580 — Val Loss: 0.5444
Epoch 15 — Train Loss: 0.4496 — Val Loss: 0.5660
Epoch 16 — Train Loss: 0.4352 — Val Loss: 0.5791
Epoch 17 — Train Loss: 0.3881 — Val Loss: 0.5685
Epoch 18 — Train Loss: 0.3969 — Val Loss: 0.5856
Epoch 19 — Train Loss: 0.3557 — Val Loss: 0.5602
Epoch 20 — Train Loss: 0.3361 — Val Loss: 0.5648
Epoch 21 — Train Loss: 0.3135 — Val Loss: 0.5408
Epoch 22 — Train Loss: 0.2961 — Val Loss: 0.5817
Epoch 23 — Train Loss: 0.2837 — Val Loss: 0.5352
Epoch 24 — Train Loss: 0.2619 — Val Loss: 0.5425
Epoch 25 — Train Loss: 0.2301 — Val Loss: 0.5781
Epoch 26 — Train Loss: 0.2365 — Val Loss: 0.5719
Epoch 27 — Train Loss: 0.2164 — Val Loss: 0.5379
Epoch 28 — Train Loss: 0.2004 — Val Loss: 0.5563
Epoch 29 — Train Loss: 0.1899 — Val Loss: 0.5620
Epoch 30 — Train Loss: 0.1778 — Val Loss: 0.5709
Epoch 31 — Train Loss: 0.1537 — Val Loss: 0.5490
Epoch 32 — Train Loss: 0.1418 — Val Loss: 0.5736
Epoch 33 — Train Loss: 0.1402 — Val Loss: 0.5570
Early stopping.
Epoch 1 — Train Loss: 0.6845 — Val Loss: 0.6604
Epoch 2 — Train Loss: 0.6601 — Val Loss: 0.6464
Epoch 3 — Train Loss: 0.6512 — Val Loss: 0.6235
Epoch 4 — Train Loss: 0.6351 — Val Loss: 0.6193
Epoch 5 — Train Loss: 0.6290 — Val Loss: 0.6040
Epoch 6 — Train Loss: 0.6175 — Val Loss: 0.6032
Epoch 7 — Train Loss: 0.6086 — Val Loss: 0.5648
Epoch 8 — Train Loss: 0.5920 — Val Loss: 0.5930
Epoch 9 — Train Loss: 0.5874 — Val Loss: 0.5843
Epoch 10 — Train Loss: 0.5803 — Val Loss: 0.5943
Epoch 11 — Train Loss: 0.5638 — Val Loss: 0.5789
Epoch 12 — Train Loss: 0.5522 — Val Loss: 0.5596
Epoch 13 — Train Loss: 0.5215 — Val Loss: 0.5664
Epoch 14 — Train Loss: 0.5137 — Val Loss: 0.5534
Epoch 15 — Train Loss: 0.4800 — Val Loss: 0.5928
Epoch 16 — Train Loss: 0.4587 — Val Loss: 0.5558
Epoch 17 — Train Loss: 0.4271 — Val Loss: 0.5380
Epoch 18 — Train Loss: 0.4077 — Val Loss: 0.5604
Epoch 19 — Train Loss: 0.3852 — Val Loss: 0.5449
Epoch 20 — Train Loss: 0.3764 — Val Loss: 0.5637
Epoch 21 — Train Loss: 0.3407 — Val Loss: 0.5597
Epoch 22 — Train Loss: 0.3247 — Val Loss: 0.5440
Epoch 23 — Train Loss: 0.3054 — Val Loss: 0.5667
Epoch 24 — Train Loss: 0.2735 — Val Loss: 0.5247
Epoch 25 — Train Loss: 0.2598 — Val Loss: 0.5308
Epoch 26 — Train Loss: 0.2326 — Val Loss: 0.5315
Epoch 27 — Train Loss: 0.2200 — Val Loss: 0.5804
Epoch 28 — Train Loss: 0.2111 — Val Loss: 0.5638
Epoch 29 — Train Loss: 0.1918 — Val Loss: 0.5383
Epoch 30 — Train Loss: 0.1806 — Val Loss: 0.5907
Epoch 31 — Train Loss: 0.1607 — Val Loss: 0.5322
Epoch 32 — Train Loss: 0.1549 — Val Loss: 0.5297
Epoch 33 — Train Loss: 0.1321 — Val Loss: 0.5317
Epoch 34 — Train Loss: 0.1254 — Val Loss: 0.5677
Early stopping.
Epoch 1 — Train Loss: 0.6803 — Val Loss: 0.6504
Epoch 2 — Train Loss: 0.6675 — Val Loss: 0.6594
Epoch 3 — Train Loss: 0.6575 — Val Loss: 0.6176
Epoch 4 — Train Loss: 0.6458 — Val Loss: 0.6158
Epoch 5 — Train Loss: 0.6422 — Val Loss: 0.6199
Epoch 6 — Train Loss: 0.6324 — Val Loss: 0.6075
Epoch 7 — Train Loss: 0.6189 — Val Loss: 0.6033
Epoch 8 — Train Loss: 0.6269 — Val Loss: 0.6065
Epoch 9 — Train Loss: 0.6211 — Val Loss: 0.5932
Epoch 10 — Train Loss: 0.6087 — Val Loss: 0.6087
Epoch 11 — Train Loss: 0.6009 — Val Loss: 0.5919
Epoch 12 — Train Loss: 0.5926 — Val Loss: 0.5827
Epoch 13 — Train Loss: 0.5929 — Val Loss: 0.5794
Epoch 14 — Train Loss: 0.5736 — Val Loss: 0.5671
Epoch 15 — Train Loss: 0.5634 — Val Loss: 0.5734
Epoch 16 — Train Loss: 0.5514 — Val Loss: 0.5819
Epoch 17 — Train Loss: 0.5332 — Val Loss: 0.5593
Epoch 18 — Train Loss: 0.5120 — Val Loss: 0.5513
Epoch 19 — Train Loss: 0.4976 — Val Loss: 0.5520
Epoch 20 — Train Loss: 0.4835 — Val Loss: 0.5799
Epoch 21 — Train Loss: 0.4697 — Val Loss: 0.5763
Epoch 22 — Train Loss: 0.4568 — Val Loss: 0.5710
Epoch 23 — Train Loss: 0.4348 — Val Loss: 0.5541
Epoch 24 — Train Loss: 0.4162 — Val Loss: 0.5563
Epoch 25 — Train Loss: 0.4005 — Val Loss: 0.5449
Epoch 26 — Train Loss: 0.3734 — Val Loss: 0.5588
Epoch 27 — Train Loss: 0.3428 — Val Loss: 0.5700
Epoch 28 — Train Loss: 0.3439 — Val Loss: 0.5225
Epoch 29 — Train Loss: 0.3236 — Val Loss: 0.5637
Epoch 30 — Train Loss: 0.3070 — Val Loss: 0.5531
Epoch 31 — Train Loss: 0.2890 — Val Loss: 0.5698
Epoch 32 — Train Loss: 0.2780 — Val Loss: 0.5963
Epoch 33 — Train Loss: 0.2805 — Val Loss: 0.5334
Epoch 34 — Train Loss: 0.2628 — Val Loss: 0.5608
Epoch 35 — Train Loss: 0.2503 — Val Loss: 0.5500
Epoch 36 — Train Loss: 0.2530 — Val Loss: 0.5781
Epoch 37 — Train Loss: 0.2229 — Val Loss: 0.5618
Epoch 38 — Train Loss: 0.2013 — Val Loss: 0.5344
Early stopping.
Epoch 1 — Train Loss: 0.6893 — Val Loss: 0.6697
Epoch 2 — Train Loss: 0.6947 — Val Loss: 0.6931
Epoch 3 — Train Loss: 0.6932 — Val Loss: 0.6931
Epoch 4 — Train Loss: 0.6932 — Val Loss: 0.6931
Epoch 5 — Train Loss: 0.6932 — Val Loss: 0.6931
Epoch 6 — Train Loss: 0.6932 — Val Loss: 0.6931
Epoch 7 — Train Loss: 0.6932 — Val Loss: 0.6931
Epoch 8 — Train Loss: 0.6932 — Val Loss: 0.6931
Epoch 9 — Train Loss: 0.6932 — Val Loss: 0.6931
Epoch 10 — Train Loss: 0.6932 — Val Loss: 0.6931
Epoch 11 — Train Loss: 0.6932 — Val Loss: 0.6932
Early stopping.
Epoch 1 — Train Loss: 0.6827 — Val Loss: 0.6888
Epoch 2 — Train Loss: 0.6710 — Val Loss: 0.6575
Epoch 3 — Train Loss: 0.6586 — Val Loss: 0.6745
Epoch 4 — Train Loss: 0.6663 — Val Loss: 0.6290
Epoch 5 — Train Loss: 0.6478 — Val Loss: 0.6161
Epoch 6 — Train Loss: 0.6318 — Val Loss: 0.6166
Epoch 7 — Train Loss: 0.6241 — Val Loss: 0.6447
Epoch 8 — Train Loss: 0.6280 — Val Loss: 0.5986
Epoch 9 — Train Loss: 0.6193 — Val Loss: 0.6606
Epoch 10 — Train Loss: 0.6107 — Val Loss: 0.5841
Epoch 11 — Train Loss: 0.6087 — Val Loss: 0.6352
Epoch 12 — Train Loss: 0.6040 — Val Loss: 0.6168
Epoch 13 — Train Loss: 0.5882 — Val Loss: 0.5956
Epoch 14 — Train Loss: 0.5755 — Val Loss: 0.5741
Epoch 15 — Train Loss: 0.5580 — Val Loss: 0.5647
Epoch 16 — Train Loss: 0.5395 — Val Loss: 0.5719
Epoch 17 — Train Loss: 0.5355 — Val Loss: 0.5655
Epoch 18 — Train Loss: 0.5091 — Val Loss: 0.5580
Epoch 19 — Train Loss: 0.4868 — Val Loss: 0.5589
Epoch 20 — Train Loss: 0.4889 — Val Loss: 0.5626
Epoch 21 — Train Loss: 0.4625 — Val Loss: 0.5438
Epoch 22 — Train Loss: 0.4366 — Val Loss: 0.5239
Epoch 23 — Train Loss: 0.4116 — Val Loss: 0.5424
Epoch 24 — Train Loss: 0.3828 — Val Loss: 0.5349
Epoch 25 — Train Loss: 0.3877 — Val Loss: 0.5534
Epoch 26 — Train Loss: 0.3520 — Val Loss: 0.5454
Epoch 27 — Train Loss: 0.3303 — Val Loss: 0.5524
Epoch 28 — Train Loss: 0.3130 — Val Loss: 0.5970
Epoch 29 — Train Loss: 0.3088 — Val Loss: 0.5141
Epoch 30 — Train Loss: 0.2977 — Val Loss: 0.5375
Epoch 31 — Train Loss: 0.2750 — Val Loss: 0.5348
Epoch 32 — Train Loss: 0.2607 — Val Loss: 0.5176
Epoch 33 — Train Loss: 0.2425 — Val Loss: 0.5442
Epoch 34 — Train Loss: 0.2240 — Val Loss: 0.5627
Epoch 35 — Train Loss: 0.2115 — Val Loss: 0.5471
Epoch 36 — Train Loss: 0.1974 — Val Loss: 0.5754
Epoch 37 — Train Loss: 0.1831 — Val Loss: 0.5767
Epoch 38 — Train Loss: 0.1711 — Val Loss: 0.5532
Epoch 39 — Train Loss: 0.1801 — Val Loss: 0.5619
Early stopping.
Epoch 1 — Train Loss: 0.6907 — Val Loss: 0.6742
Epoch 2 — Train Loss: 0.6707 — Val Loss: 0.6763
Epoch 3 — Train Loss: 0.6688 — Val Loss: 0.6385
Epoch 4 — Train Loss: 0.6587 — Val Loss: 0.6449
Epoch 5 — Train Loss: 0.6588 — Val Loss: 0.6349
Epoch 6 — Train Loss: 0.6454 — Val Loss: 0.6414
Epoch 7 — Train Loss: 0.6522 — Val Loss: 0.6442
Epoch 8 — Train Loss: 0.6366 — Val Loss: 0.6298
Epoch 9 — Train Loss: 0.6394 — Val Loss: 0.6281
Epoch 10 — Train Loss: 0.6344 — Val Loss: 0.6238
Epoch 11 — Train Loss: 0.6285 — Val Loss: 0.6005
Epoch 12 — Train Loss: 0.6152 — Val Loss: 0.5861
Epoch 13 — Train 