[I 2025-05-09 09:22:19,141] Trial 73 finished with value: 0.5946928186850114 and parameters: {'lr': 0.00011909020272413709, 'weight_decay': 0.003367291425328754, 'optimizer': 'Adam', 'dropout_rate': 0.2891455896245945}. Best is trial 64 with value: 0.5315759723836725.
Epoch 7 — Train Loss: 0.6448 — Val Loss: 0.6327
Epoch 8 — Train Loss: 0.6423 — Val Loss: 0.6264
Epoch 9 — Train Loss: 0.6365 — Val Loss: 0.6303
Epoch 10 — Train Loss: 0.6355 — Val Loss: 0.6253
Epoch 11 — Train Loss: 0.6319 — Val Loss: 0.6208
Epoch 12 — Train Loss: 0.6243 — Val Loss: 0.6222
Epoch 13 — Train Loss: 0.6171 — Val Loss: 0.6150
Epoch 14 — Train Loss: 0.6156 — Val Loss: 0.6175
Epoch 15 — Train Loss: 0.6027 — Val Loss: 0.6120
Epoch 16 — Train Loss: 0.6022 — Val Loss: 0.6125
Epoch 17 — Train Loss: 0.5947 — Val Loss: 0.6032
Epoch 18 — Train Loss: 0.5874 — Val Loss: 0.6001
Epoch 19 — Train Loss: 0.5812 — Val Loss: 0.6010
Epoch 20 — Train Loss: 0.5708 — Val Loss: 0.5986
Epoch 21 — Train Loss: 0.5642 — Val Loss: 0.6030
Epoch 22 — Train Loss: 0.5622 — Val Loss: 0.5989
Epoch 23 — Train Loss: 0.5475 — Val Loss: 0.6021
Epoch 24 — Train Loss: 0.5420 — Val Loss: 0.6022
Epoch 25 — Train Loss: 0.5369 — Val Loss: 0.5963
Epoch 26 — Train Loss: 0.5237 — Val Loss: 0.5993
Epoch 27 — Train Loss: 0.5203 — Val Loss: 0.5918
Epoch 28 — Train Loss: 0.5144 — Val Loss: 0.5864
Epoch 29 — Train Loss: 0.5030 — Val Loss: 0.5841
Epoch 30 — Train Loss: 0.4987 — Val Loss: 0.5953
Epoch 31 — Train Loss: 0.4795 — Val Loss: 0.5873
Epoch 32 — Train Loss: 0.4710 — Val Loss: 0.5877
Epoch 33 — Train Loss: 0.4631 — Val Loss: 0.6060
Epoch 34 — Train Loss: 0.4566 — Val Loss: 0.5735
Epoch 35 — Train Loss: 0.4492 — Val Loss: 0.5826
Epoch 36 — Train Loss: 0.4367 — Val Loss: 0.5804
Epoch 37 — Train Loss: 0.4312 — Val Loss: 0.5782
Epoch 38 — Train Loss: 0.4156 — Val Loss: 0.5767
Epoch 39 — Train Loss: 0.4013 — Val Loss: 0.5818
Epoch 40 — Train Loss: 0.4063 — Val Loss: 0.5893
Epoch 41 — Train Loss: 0.3838 — Val Loss: 0.5812
Epoch 42 — Train Loss: 0.3814 — Val Loss: 0.5797
Epoch 43 — Train Loss: 0.3772 — Val Loss: 0.5754
Epoch 44 — Train Loss: 0.3696 — Val Loss: 0.5718
Epoch 45 — Train Loss: 0.3565 — Val Loss: 0.5763
Epoch 46 — Train Loss: 0.3565 — Val Loss: 0.5835
Epoch 47 — Train Loss: 0.3371 — Val Loss: 0.5780
Epoch 48 — Train Loss: 0.3465 — Val Loss: 0.5748
Epoch 49 — Train Loss: 0.3205 — Val Loss: 0.5640
Epoch 50 — Train Loss: 0.3320 — Val Loss: 0.5854
Epoch 51 — Train Loss: 0.3230 — Val Loss: 0.5764
Epoch 52 — Train Loss: 0.3083 — Val Loss: 0.5775
Epoch 53 — Train Loss: 0.2963 — Val Loss: 0.5894
Epoch 54 — Train Loss: 0.2874 — Val Loss: 0.5718
Epoch 55 — Train Loss: 0.2869 — Val Loss: 0.5798
Epoch 56 — Train Loss: 0.2727 — Val Loss: 0.5819
Epoch 57 — Train Loss: 0.2696 — Val Loss: 0.5820
Epoch 58 — Train Loss: 0.2610 — Val Loss: 0.5695
Epoch 59 — Train Loss: 0.2541 — Val Loss: 0.5812
Early stopping.
Epoch 1 — Train Loss: 0.6932 — Val Loss: 0.6930
Epoch 2 — Train Loss: 0.6931 — Val Loss: 0.6930
Epoch 3 — Train Loss: 0.6924 — Val Loss: 0.6871
Epoch 4 — Train Loss: 0.6868 — Val Loss: 0.6772
Epoch 5 — Train Loss: 0.6761 — Val Loss: 0.6622
Epoch 6 — Train Loss: 0.6691 — Val Loss: 0.6508
Epoch 7 — Train Loss: 0.6602 — Val Loss: 0.6504
Epoch 8 — Train Loss: 0.6535 — Val Loss: 0.6513
Epoch 9 — Train Loss: 0.6550 — Val Loss: 0.6381
Epoch 10 — Train Loss: 0.6502 — Val Loss: 0.6485
Epoch 11 — Train Loss: 0.6545 — Val Loss: 0.6355
Epoch 12 — Train Loss: 0.6499 — Val Loss: 0.6374
Epoch 13 — Train Loss: 0.6484 — Val Loss: 0.6312
Epoch 14 — Train Loss: 0.6465 — Val Loss: 0.6245
Epoch 15 — Train Loss: 0.6439 — Val Loss: 0.6313
Epoch 16 — Train Loss: 0.6378 — Val Loss: 0.6265
Epoch 17 — Train Loss: 0.6365 — Val Loss: 0.6287
Epoch 18 — Train Loss: 0.6321 — Val Loss: 0.6200
Epoch 19 — Train Loss: 0.6382 — Val Loss: 0.6155
Epoch 20 — Train Loss: 0.6331 — Val Loss: 0.6153
Epoch 21 — Train Loss: 0.6280 — Val Loss: 0.6173
Epoch 22 — Train Loss: 0.6327 — Val Loss: 0.6202
Epoch 23 — Train Loss: 0.6327 — Val Loss: 0.6093
Epoch 24 — Train Loss: 0.6204 — Val Loss: 0.6145
Epoch 25 — Train Loss: 0.6186 — Val Loss: 0.6076
Epoch 26 — Train Loss: 0.6160 — Val Loss: 0.6039
Epoch 27 — Train Loss: 0.6155 — Val Loss: 0.6021
Epoch 28 — Train Loss: 0.6071 — Val Loss: 0.5940
Epoch 29 — Train Loss: 0.5979 — Val Loss: 0.5991
Epoch 30 — Train Loss: 0.5965 — Val Loss: 0.5877
Epoch 31 — Train Loss: 0.5823 — Val Loss: 0.5900
Epoch 32 — Train Loss: 0.5794 — Val Loss: 0.5788
Epoch 33 — Train Loss: 0.5648 — Val Loss: 0.5853
Epoch 34 — Train Loss: 0.5590 — Val Loss: 0.5876
Epoch 35 — Train Loss: 0.5555 — Val Loss: 0.5981
Epoch 36 — Train Loss: 0.5526 — Val Loss: 0.5635
Epoch 37 — Train Loss: 0.5409 — Val Loss: 0.5616
Epoch 38 — Train Loss: 0.5330 — Val Loss: 0.5648
Epoch 39 — Train Loss: 0.5242 — Val Loss: 0.5747
Epoch 40 — Train Loss: 0.5236 — Val Loss: 0.5453
Epoch 41 — Train Loss: 0.5154 — Val Loss: 0.5491
Epoch 42 — Train Loss: 0.4988 — Val Loss: 0.5477
Epoch 43 — Train Loss: 0.4888 — Val Loss: 0.5568
Epoch 44 — Train Loss: 0.4834 — Val Loss: 0.5404
Epoch 45 — Train Loss: 0.4784 — Val Loss: 0.5340
Epoch 46 — Train Loss: 0.4702 — Val Loss: 0.5588
Epoch 47 — Train Loss: 0.4707 — Val Loss: 0.5476
Epoch 48 — Train Loss: 0.4464 — Val Loss: 0.5551
Epoch 49 — Train Loss: 0.4421 — Val Loss: 0.5422
Epoch 50 — Train Loss: 0.4262 — Val Loss: 0.5437
Epoch 51 — Train Loss: 0.4066 — Val Loss: 0.5632
Epoch 52 — Train Loss: 0.4127 — Val Loss: 0.5518
Epoch 53 — Train Loss: 0.4052 — Val Loss: 0.5644
Epoch 54 — Train Loss: 0.3755 — Val Loss: 0.5452
Epoch 55 — Train Loss: 0.3796 — Val Loss: 0.5390
Early stopping.
Epoch 1 — Train Loss: 0.6926 — Val Loss: 0.6884
Epoch 2 — Train Loss: 0.6806 — Val Loss: 0.6579
Epoch 3 — Train Loss: 0.6694 — Val Loss: 0.6610
Epoch 4 — Train Loss: 0.6646 — Val Loss: 0.6493
Epoch 5 — Train Loss: 0.6521 — Val Loss: 0.6511
Epoch 6 — Train Loss: 0.6549 — Val Loss: 0.6455
Epoch 7 — Train Loss: 0.6480 — Val Loss: 0.6360
Epoch 8 — Train Loss: 0.6421 — Val Loss: 0.6310
Epoch 9 — Train Loss: 0.6437 — Val Loss: 0.6234
Epoch 10 — Train Loss: 0.6434 — Val Loss: 0.6250
Epoch 11 — Train Loss: 0.6313 — Val Loss: 0.6215
Epoch 12 — Train Loss: 0.6416 — Val Loss: 0.6151
Epoch 13 — Train Loss: 0.6293 — Val Loss: 0.6180
Epoch 14 — Train Loss: 0.6293 — Val Loss: 0.6146
Epoch 15 — Train Loss: 0.6189 — Val Loss: 0.6057
Epoch 16 — Train Loss: 0.6196 — Val Loss: 0.6109
Epoch 17 — Train Loss: 0.6136 — Val Loss: 0.6076
Epoch 18 — Train Loss: 0.6024 — Val Loss: 0.6175
Epoch 19 — Train Loss: 0.6048 — Val Loss: 0.6005
Epoch 20 — Train Loss: 0.6022 — Val Loss: 0.5956
Epoch 21 — Train Loss: 0.5904 — Val Loss: 0.6055
Epoch 22 — Train Loss: 0.5801 — Val Loss: 0.5952
Epoch 23 — Train Loss: 0.5707 — Val Loss: 0.5790
Epoch 24 — Train Loss: 0.5710 — Val Loss: 0.5920
Epoch 25 — Train Loss: 0.5597 — Val Loss: 0.5723
Epoch 26 — Train Loss: 0.5541 — Val Loss: 0.5867
Epoch 27 — Train Loss: 0.5374 — Val Loss: 0.5838
Epoch 28 — Train Loss: 0.5298 — Val Loss: 0.5740
Epoch 29 — Train Loss: 0.5307 — Val Loss: 0.5547
Epoch 30 — Train Loss: 0.5274 — Val Loss: 0.5657
Epoch 31 — Train Loss: 0.5019 — Val Loss: 0.5753
Epoch 32 — Train Loss: 0.4932 — Val Loss: 0.5581
Epoch 33 — Train Loss: 0.4988 — Val Loss: 0.5715
Epoch 34 — Train Loss: 0.4814 — Val Loss: 0.5608
Epoch 35 — Train Loss: 0.4665 — Val Loss: 0.5954
Epoch 36 — Train Loss: 0.4451 — Val Loss: 0.6022
Epoch 37 — Train Loss: 0.4409 — Val Loss: 0.5683
Epoch 38 — Train Loss: 0.4273 — Val Loss: 0.5431
Epoch 39 — Train Loss: 0.4111 — Val Loss: 0.5457
Epoch 40 — Train Loss: 0.3987 — Val Loss: 0.5469
Epoch 41 — Train Loss: 0.3873 — Val Loss: 0.5689
Epoch 42 — Train Loss: 0.3649 — Val Loss: 0.5593
Epoch 43 — Train Loss: 0.3661 — Val Loss: 0.5734
Epoch 44 — Train Loss: 0.3632 — Val Loss: 0.5524
Epoch 45 — Train Loss: 0.3369 — Val Loss: 0.5612
Epoch 46 — Train Loss: 0.3165 — Val Loss: 0.5526
Epoch 47 — Train Loss: 0.3128 — Val Loss: 0.5663
Epoch 48 — Train Loss: 0.3050 — Val Loss: 0.5958
Early stopping.
Epoch 1 — Train Loss: 0.7159 — Val Loss: 0.6888
Epoch 2 — Train Loss: 0.6931 — Val Loss: 0.6935
Epoch 3 — Train Loss: 0.6969 — Val Loss: 0.6919
Epoch 4 — Train Loss: 0.6957 — Val Loss: 0.6917
Epoch 5 — Train Loss: 0.6959 — Val Loss: 0.6927
Epoch 6 — Train Loss: 0.6964 — Val Loss: 0.6928
Epoch 7 — Train Loss: 0.6952 — Val Loss: 0.6954
Epoch 8 — Train Loss: 0.6952 — Val Loss: 0.6934
Epoch 9 — Train Loss: 0.6976 — Val Loss: 0.6894
Epoch 10 — Train Loss: 0.6950 — Val Loss: 0.6904
Epoch 11 — Train Loss: 0.7048 — Val Loss: 0.6902
Early stopping.
Epoch 1 — Train Loss: 0.6955 — Val Loss: 0.6930
Epoch 2 — Train Loss: 0.6945 — Val Loss: 0.6933
Epoch 3 — Train Loss: 0.6932 — Val Loss: 0.6925
Epoch 4 — Train Loss: 0.6935 — Val Loss: 0.6931
Epoch 5 — Train Loss: 0.6934 — Val Loss: 0.6948
Epoch 6 — Train Loss: 0.6932 — Val Loss: 0.6922
Epoch 7 — Train Loss: 0.6934 — Val Loss: 0.6927
Epoch 8 — Train Loss: 0.6931 — Val Loss: 0.6932
Epoch 9 — Train Loss: 0.6935 — Val Loss: 0.6931
Epoch 10 — Train Loss: 0.6931 — Val Loss: 0.6931
Epoch 11 — Train Loss: 0.6931 — Val Loss: 0.6930
Epoch 12 — Train Loss: 0.6931 — Val Loss: 0.6909
Epoch 13 — Train Loss: 0.6940 — Val Loss: 0.6931
Epoch 14 — Train Loss: 0.6931 — Val Loss: 0.6928
Epoch 15 — Train Loss: 0.6933 — Val Loss: 0.6931
Epoch 16 — Train Loss: 0.6928 — Val Loss: 0.6924
Epoch 17 — Train Loss: 0.6934 — Val Loss: 0.6928
Epoch 18 — Train Loss: 0.6935 — Val Loss: 0.6931
Epoch 19 — Train Loss: 0.6932 — Val Loss: 0.6931
Epoch 20 — Train Loss: 0.6933 — Val Loss: 0.6931
Epoch 21 — Train Loss: 0.6933 — Val Loss: 0.6929
Epoch 22 — Train Loss: 0.6929 — Val Loss: 0.7313
Early stopping.
Epoch 1 — Train Loss: 0.6745 — Val Loss: 0.6300
Epoch 2 — Train Loss: 0.6411 — Val Loss: 0.6241
Epoch 3 — Train Loss: 0.6393 — Val Loss: 0.6019
Epoch 4 — Train Loss: 0.6298 — Val Loss: 0.6016
Epoch 5 — Train Loss: 0.6110 — Val Loss: 0.5926
Epoch 6 — Train Loss: 0.5983 — Val Loss: 0.5900
Epoch 7 — Train Loss: 0.5846 — Val Loss: 0.5832
Epoch 8 — Train Loss: 0.5713 — Val Loss: 0.5774
Epoch 9 — Train Loss: 0.5609 — Val Loss: 0.5820
Epoch 10 — Train Loss: 0.5347 — Val Loss: 0.5720
Epoch 11 — Train Loss: 0.5271 — Val Loss: 0.5821
Epoch 12 — Train Loss: 0.5034 — Val Loss: 0.5572
Epoch 13 — Train Loss: 0.4736 — Val Loss: 0.5726
Epoch 14 — Train Loss: 0.4590 — Val Loss: 0.5715
Epoch 15 — Train Loss: 0.4367 — Val Loss: 0.5720
Epoch 16 — Train Loss: 0.4202 — Val Loss: 0.5698
Epoch 17 — Train Loss: 0.4014 — Val Loss: 0.5884
Epoch 18 — Train Loss: 0.3899 — Val Loss: 0.5385
Epoch 19 — Train Loss: 0.3679 — Val Loss: 0.5662
Epoch 20 — Train Loss: 0.3459 — Val Loss: 0.5691
Epoch 21 — Train Loss: 0.3350 — Val Loss: 0.5556
Epoch 22 — Train Loss: 0.3108 — Val Loss: 0.6112
Epoch 23 — Train Loss: 0.3029 — Val Loss: 0.5623
Epoch 24 — Train Loss: 0.2748 — Val Loss: 0.5502
Epoch 25 — Train Loss: 0.2753 — Val Loss: 0.5787
Epoch 26 — Train Loss: 0.2529 — Val Loss: 0.5806
Epoch 27 — Train Loss: 0.2400 — Val Loss: 0.5699
Epoch 28 — Train Loss: 0.2174 — Val Loss: 0.6287
Early stopping.
Epoch 1 — Train Loss: 0.6885 — Val Loss: 0.6669
Epoch 2 — Train Loss: 0.6626 — Val Loss: 0.6389
Epoch 3 — Train Loss: 0.6492 — Val Loss: 0.6204
Epoch 4 — Train Loss: 0.6289 — Val Loss: 0.6016
Epoch 5 — Train Loss: 0.6198 — Val Loss: 0.5995
Epoch 6 — Train Loss: 0.6096 — Val Loss: 0.5950
Epoch 7 — Train Loss: 0.5977 — Val Loss: 0.5777
Epoch 8 — Train Loss: 0.5854 — Val Loss: 0.5673
Epoch 9 — Train Loss: 0.5625 — Val Loss: 0.5697
Epoch 10 — Train Loss: 0.5541 — Val Loss: 0.5997
Epoch 11 — Train Loss: 0.5256 — Val Loss: 0.5568
Epoch 12 — Train Loss: 0.5004 — Val Loss: 0.5514
Epoch 13 — Train Loss: 0.4843 — Val Loss: 0.5290
Epoch 14 — Train Loss: 0.4388 — Val Loss: 0.5440
Epoch 15 — Train Loss: 0.4289 — Val Loss: 0.5690
Epoch 16 — Train Loss: 0.3885 — Val Loss: 0.5334
Epoch 17 — Train Loss: 0.3646 — Val Loss: 0.5537
Epoch 18 — Train Loss: 0.3377 — Val Loss: 0.5610
Epoch 19 — Train Loss: 0.3052 — Val Loss: 0.5594
Epoch 20 — Train Loss: 0.2729 — Val Loss: 0.5443
Epoch 21 — Train Loss: 0.2559 — Val Loss: 0.5649
Epoch 22 — Train Loss: 0.2263 — Val Loss: 0.5495
Epoch 23 — Train Loss: 0.2175 — Val Loss: 0.5787
Early stopping.
Epoch 1 — Train Loss: 0.6905 — Val Loss: 0.6747
Epoch 2 — Train Loss: 0.6685 — Val Loss: 0.6520
Epoch 3 — Train Loss: 0.6533 — Val Loss: 0.6359
Epoch 4 — Train Loss: 0.6549 — Val Loss: 0.6349
Epoch 5 — Train Loss: 0.6472 — Val Loss: 0.6240
Epoch 6 — Train Loss: 0.6366 — Val Loss: 0.6184
Epoch 7 — Train Loss: 0.6327 — Val Loss: 0.6146
Epoch 8 — Train Loss: 0.6243 — Val Loss: 0.6036
Epoch 9 — Train Loss: 0.6203 — Val Loss: 0.5997
Epoch 10 — Train Loss: 0.5966 — Val Loss: 0.5906
Epoch 11 — Train Loss: 0.5919 — Val Loss: 0.6009
Epoch 12 — Train Loss: 0.5770 — Val Loss: 0.5763
Epoch 13 — Train Loss: 0.5612 — Val Loss: 0.5527
Epoch 14 — Train Loss: 0.5360 — Val Loss: 0.5763
Epoch 15 — Train Loss: 0.5215 — Val Loss: 0.5553
Epoch 16 — Train Loss: 0.5061 — Val Loss: 0.5371
Epoch 17 — Train Loss: 0.4854 — Val Loss: 0.5299
Epoch 18 — Train Loss: 0.4562 — Val Loss: 0.5334
Epoch 19 — Train Loss: 0.4314 — Val Loss: 0.5355
Epoch 20 — Train Loss: 0.4136 — Val Loss: 0.5296
Epoch 21 — Train Loss: 0.3720 — Val Loss: 0.5446
Epoch 22 — Train Loss: 0.3527 — Val Loss: 0.5735
Epoch 23 — Train Loss: 0.3336 — Val Loss: 0.5215
Epoch 24 — Train Loss: 0.3107 — Val Loss: 0.5252
Epoch 25 — Train Loss: 0.2956 — Val Loss: 0.5450
Epoch 26 — Train Loss: 0.2745 — Val Loss: 0.5494
Epoch 27 — Train Loss: 0.2597 — Val Loss: 0.5572
Epoch 28 — Train Loss: 0.2503 — Val Loss: 0.5345
Epoch 29 — Train Loss: 0.2230 — Val Loss: 0.5565
Epoch 30 — Train Loss: 0.2200 — Val Loss: 0.5624
Epoch 31 — Train Loss: 0.1934 — Val Loss: 0.5663
Epoch 32 — Train Loss: 0.1786 — Val Loss: 0.6012
Epoch 33 — Train Loss: 0.1671 — Val Loss: 0.5838
Early stopping.
Epoch 1 — Train Loss: 0.6930 — Val Loss: 0.6928
Epoch 2 — Train Loss: 0.6924 — Val Loss: 0.6914
Epoch 3 — Train Loss: 0.6892 — Val Loss: 0.6835
Epoch 4 — Train Loss: 0.6791 — Val Loss: 0.6657
Epoch 5 — Train Loss: 0.6661 — Val Loss: 0.6550
Epoch 6 — Train Loss: 0.6555 — Val Loss: 0.6559
Epoch 7 — Train Loss: 0.6517 — Val Loss: 0.6417
Epoch 8 — Train Loss: 0.6501 — Val Loss: 0.6378
Epoch 9 — Train Loss: 0.6448 — Val Loss: 0.6347
Epoch 10 — Train Loss: 0.6490 — Val Loss: 0.6305
Epoch 11 — Train Loss: 0.6432 — Val Loss: 0.6288
Epoch 12 — Train Loss: 0.6327 — Val Loss: 0.6181
Epoch 13 — Train Loss: 0.6318 — Val Loss: 0.6188
Epoch 14 — Train Loss: 0.6266 — Val Loss: 0.6123
Epoch 15 — Train Loss: 0.6318 — Val Loss: 0.6149
Epoch 16 — Train Loss: 0.6267 — Val Loss: 0.6165
Epoch 17 — Train Loss: 0.6188 — Val Loss: 0.6097
Epoch 18 — Train Loss: 0.6168 — Val Loss: 0.6054
Epoch 19 — Train Loss: 0.6018 — Val Loss: 0.6166
Epoch 20 — Train Loss: 0.6087 — Val Loss: 0.6027
Epoch 21 — Train Loss: 0.5945 — Val Loss: 0.5921
Epoch 22 — Train Loss: 0.5967 — Val Loss: 0.6063
Epoch 23 — Train Loss: 0.5874 — Val Loss: 0.5953
Epoch 24 — Train Loss: 0.5723 — Val Loss: 0.6013
Epoch 25 — Train Loss: 0.5706 — Val Loss: 0.5943
Epoch 26 — Train Loss: 0.5596 — Val Loss: 0.5905
Epoch 27 — Train Loss: 0.5600 — Val Loss: 0.5866
Epoch 28 — Train Loss: 0.5351 — Val Loss: 0.5896
Epoch 29 — Train Loss: 0.5342 — Val Loss: 0.5987
Epoch 30 — Train Loss: 0.5211 — Val Loss: 0.5882
Epoch 31 — Train Loss: 0.5216 — Val Loss: 0.5946
Epoch 32 — Train Loss: 0.5074 — Val Loss: 0.5935
Epoch 33 — Train Loss: 0.4939 — Val Loss: 0.5803
Epoch 34 — Train Loss: 0.4802 — Val Loss: 0.5817
Epoch 35 — Train Loss: 0.4755 — Val Loss: 0.5950
Epoch 36 — Train Loss: 0.4578 — Val Loss: 0.5906
Epoch 37 — Train Loss: 0.4457 — Val Loss: 0.5810
Epoch 38 — Train Loss: 0.4430 — Val Loss: 0.5822
Epoch 39 — Train Loss: 0.4347 — Val Loss: 0.5945
Epoch 40 — Train Loss: 0.4219 — Val Loss: 0.5764
Epoch 41 — Train Loss: 0.4015 — Val Loss: 0.5877
Epoch 42 — Train Loss: 0.3973 — Val Loss: 0.5952
Epoch 43 — Train Loss: 0.3842 — Val Loss: 0.6026
Epoch 44 — Train Loss: 0.3834 — Val Loss: 0.5793
Epoch 45 — Train Loss: 0.3717 — Val Loss: 0.5988
Epoch 46 — Train Loss: 0.3600 — Val Loss: 0.5884
Epoch 47 — Train Loss: 0.3447 — Val Loss: 0.5962
Epoch 48 — Train Loss: 0.3410 — Val Loss: 0.5870
Epoch 49 — Train Loss: 0.3326 — Val Loss: 0.5930
Epoch 50 — Train Loss: 0.3216 — Val Loss: 0.5956
Early stopping.
Epoch 1 — Train Loss: 0.6929 — Val Loss: 0.6926
Epoch 2 — Train Loss: 0.6921 — Val Loss: 0.6909
Epoch 3 — Train Loss: 0.6897 — Val Loss: 0.6868
Epoch 4 — Train Loss: 0.6855 — Val Loss: 0.6806
Epoch 5 — Train Loss: 0.6789 — Val Loss: 0.6731
Epoch 6 — Train Loss: 0.6691 — Val Loss: 0.6640
Epoch 7 — Train Loss: 0.6646 — Val Loss: 0.6593
Epoch 8 — Train Loss: 0.6601 — Val Loss: 0.6555
Epoch 9 — Train Loss: 0.6576 — Val Loss: 0.6500
Epoch 10 — Train Loss: 0.6508 — Val Loss: 0.6448
Epoch 11 — Train Loss: 0.6492 — Val Loss: 0.6439
Epoch 12 — Train Loss: 0.6445 — Val Loss: 0.6396
Epoch 13 — Train Loss: 0.6438 — Val Loss: 0.6379
Epoch 14 — Train Loss: 0.6382 — Val Loss: 0.6329
Epoch 15 — Train Loss: 0.6363 — Val Loss: 0.6305
Epoch 16 — Train Loss: 0.6405 — Val Loss: 0.6285
Epoch 17 — Train Loss: 0.6393 — Val Loss: 0.6276
Epoch 18 — Train Loss: 0.6341 — Val Loss: 0.6280
Epoch 19 — Train Loss: 0.6286 — Val Loss: 0.6268
Epoch 20 — Train Loss: 0.6282 — Val Loss: 0.6253
Epoch 21 — Train Loss: 0.6288 — Val Loss: 0.6245
Epoch 22 — Train Loss: 0.6255 — Val Loss: 0.6210
Epoch 23 — Train Loss: 0.6262 — Val Loss: 0.6204
Epoch 24 — Train Loss: 0.6194 — Val Loss: 0.6175
Epoch 25 — Train Loss: 0.6204 — Val Loss: 0.6163
Epoch 26 — Train Loss: 0.6185 — Val Loss: 0.6161
Epoch 27 — Train Loss: 0.6123 — Val Loss: 0.6153
Epoch 28 — Train Loss: 0.6114 — Val Loss: 0.6110
Epoch 29 — Train Loss: 0.6137 — Val Loss: 0.6094
Epoch 30 — Train Loss: 0.6146 — Val Loss: 0.6089
Epoch 31 — Train Loss: 0.6061 — Val Loss: 0.6039
Epoch 32 — Train Loss: 0.6014 — Val Loss: 0.6029
Epoch 33 — Train Loss: 0.6008 — Val Loss: 0.6057
Epoch 34 — Train Loss: 0.6009 — Val Loss: 0.6072
Epoch 35 — Train Loss: 0.5945 — Val Loss: 0.6015
Epoch 36 — Train Loss: 0.5960 — Val Loss: 0.6032
Epoch 37 — Train Loss: 0.5883 — Val Loss: 0.6020
Epoch 38 — Train Loss: 0.5857 — Val Loss: 0.5978
Epoch 39 — Train Loss: 0.5834 — Val Loss: 0.6014
Epoch 40 — Train Loss: 0.5781 — Val Loss: 0.5987
Epoch 41 — Train Loss: 0.5680 — Val Loss: 0.5932
Epoch 42 — Train Loss: 0.5689 — Val Loss: 0.5899
Epoch 43 — Train Loss: 0.5627 — Val Loss: 0.5951
Epoch 44 — Train Loss: 0.5591 — Val Loss: 0.5987
Epoch 45 — Train Loss: 0.5605 — Val Loss: 0.6015
Epoch 46 — Train Loss: 0.5564 — Val Loss: 0.5924
Epoch 47 — Train Loss: 0.5491 — Val Loss: 0.5944
Epoch 48 — Train Loss: 0.5472 — Val Loss: 0.5985
Epoch 49 — Train Loss: 0.5416 — Val Loss: 0.5959
Epoch 50 — Train Loss: 0.5404 — Val Loss: 0.5899
Epoch 51 — Train Loss: 0.5402 — Val Loss: 0.5847
Epoch 52 — Train Loss: 0.5370 — Val Loss: 0.5929
Epoch 53 — Train Loss: 0.5310 — Val Loss: 0.5854
Epoch 54 — Train Loss: 0.5228 — Val Loss: 0.5870
Epoch 55 — Train Loss: 0.5179 — Val Loss: 0.5894
Epoch 56 — Train Loss: 0.5099 — Val Loss: 0.5914
Epoch 57 — Train Loss: 0.5072 — Val Loss: 0.5978
Epoch 58 — Train Loss: 0.5262 — Val Loss: 0.5902
Epoch 59 — Train Loss: 0.5057 — Val Loss: 0.6018
Epoch 60 — Train Loss: 0.5100 — Val Loss: 0.5837
Epoch 61 — Train Loss: 0.5003 — Val Loss: 0.5853
Epoch 62 — Train Loss: 0.4905 — Val Loss: 0.5806
Epoch 63 — Train Loss: 0.4821 — Val Loss: 0.5823
Epoch 64 — Train Loss: 0.4916 — Val Loss: 0.5930
Epoch 65 — Train Loss: 0.4804 — Val Loss: 0.5846
Epoch 66 — Train Loss: 0.4755 — Val Loss: 0.5894
Epoch 67 — Train Loss: 0.4688 — Val Loss: 0.5912
Epoch 68 — Train Loss: 0.4705 — Val Loss: 0.5907
Epoch 69 — Train Loss: 0.4595 — Val Loss: 0.5866
Epoch 70 — Train Loss: 0.4534 — Val Loss: 0.5939
Epoch 71 — Train Loss: 0.4526 — Val Loss: 0.6022
Epoch 72 — Train Loss: 0.4466 — Val Loss: 0.6005
Early stopping.
Epoch 1 — Train Loss: 0.6916 — Val Loss: 0.6826
Epoch 2 — Train Loss: 0.6691 — Val Loss: 0.6397
Epoch 3 — Train Loss: 0.6457 — Val Loss: 0.6290
Epoch 4 — Train Loss: 0.6322 — Val Loss: 0.6157
Epoch 5 — Train Loss: 0.6160 — Val Loss: 0.6042
Epoch 6 — Train Loss: 0.6021 — Val Loss: 0.5993
Epoch 7 — Train Loss: 0.5877 — Val Loss: 0.5932
Epoch 8 — Train Loss: 0.5711 — Val Loss: 0.5877
Epoch 9 — Train Loss: 0.5441 — Val Loss: 0.6024
Epoch 10 — Train Loss: 0.5325 — Val Loss: 0.5881
Epoch 11 — Train Loss: 0.5107 — Val Loss: 0.5713
Epoch 12 — Train Loss: 0.4901 — Val Loss: 0.5751
Epoch 13 — Train Loss: 0.4652 — Val Loss: 0.5705
Epoch 14 — Train Loss: 0.4518 — Val Loss: 0.5705
Epoch 15 — Train Loss: 0.4309 — Val Loss: 0.5615
Epoch 16 — Train Loss: 0.3982 — Val Loss: 0.5546
Epoch 17 — Train Loss: 0.3871 — Val Loss: 0.5656
Epoch 18 — Train Loss: 0.3716 — Val Loss: 0.5527
Epoch 19 — Train Loss: 0.3393 — Val Loss: 0.6052
Epoch 20 — Train Loss: 0.3114 — Val Loss: 0.5674
Epoch 21 — Train Loss: 0.3140 — Val Loss: 0.5589
Epoch 22 — Train Loss: 0.2745 — Val Loss: 0.5749
Epoch 23 — Train Loss: 0.2552 — Val Loss: 0.5700
Epoch 24 — Train Loss: 0.2413 — Val Loss: 0.5913
Epoch 25 — Train Loss: 0.2285 — Val Loss: 0.5581
Epoch 26 — Train Loss: 0.2103 — Val Loss: 0.5786
Epoch 27 — Train Loss: 0.1891 — Val Loss: 0.5727
Epoch 28 — Train Loss: 0.1832 — Val Loss: 0.5853
Early stopping.
Epoch 1 — Train Loss: 0.6922 — Val Loss: 0.6894
Epoch 2 — Train Loss: 0.6816 — Val Loss: 0.6626
Epoch 3 — Train Loss: 0.6588 — Val Loss: 0.6336
Epoch 4 — Train Loss: 0.6439 — Val Loss: 0.6199
Epoch 5 — Train Loss: 0.6428 — Val Loss: 0.6270
Epoch 6 — Train Loss: 0.6366 — Val Loss: 0.6221
Epoch 7 — Train Loss: 0.6249 — Val Loss: 0.6117
Epoch 8 — Train Loss: 0.6332 — Val Loss: 0.6134
Epoch 9 — Train Loss: 0.6119 — Val Loss: 0.6012
Epoch 10 — Train Loss: 0.6098 — Val Loss: 0.6016
Epoch 11 — Train Loss: 0.6036 — Val Loss: 0.5910
Epoch 12 — Train Loss: 0.5920 — Val Loss: 0.6019
Epoch 13 — Train Loss: 0.5719 — Val Loss: 0.5889
Epoch 14 — Train Loss: 0.5595 — Val Loss: 0.5806
Epoch 15 — Train Loss: 0.5519 — Val Loss: 0.5819
Epoch 16 — Train Loss: 0.5355 — Val Loss: 0.5724
Epoch 17 — Train Loss: 0.5245 — Val Loss: 0.5678
Epoch 18 — Train Loss: 0.5104 — Val Loss: 0.5596
Epoch 19 — Train Loss: 0.4874 — Val Loss: 0.5733