nohup: ignoring input
[I 2025-05-10 10:46:00,451] A new study created in memory with name: no-name-68fddb7a-a9fa-4eb4-a084-d9202492643a
/sise/home/shirmord/hw/layla.py:205: FutureWarning: suggest_loguniform has been deprecated in v3.0.0. This feature will be removed in v6.0.0. See https://github.com/optuna/optuna/releases/tag/v3.0.0. Use suggest_float(..., log=True) instead.
  lr = trial.suggest_loguniform('lr', 1e-6, 1e-3)
/sise/home/shirmord/hw/layla.py:206: FutureWarning: suggest_loguniform has been deprecated in v3.0.0. This feature will be removed in v6.0.0. See https://github.com/optuna/optuna/releases/tag/v3.0.0. Use suggest_float(..., log=True) instead.
  weight_decay = trial.suggest_loguniform('weight_decay', 1e-6, 1e-2)
[I 2025-05-10 10:55:53,766] Trial 0 finished with value: 0.5846394213763151 and parameters: {'lr': 7.784232792801693e-06, 'weight_decay': 0.009764731895263251, 'optimizer': 'Adam', 'dropout_rate': 0.220841312854188}. Best is trial 0 with value: 0.5846394213763151.
[I 2025-05-10 11:02:28,584] Trial 1 finished with value: 0.5938887639479203 and parameters: {'lr': 2.2767015310852027e-05, 'weight_decay': 3.099340010242593e-05, 'optimizer': 'RMSprop', 'dropout_rate': 0.30363077682042044}. Best is trial 0 with value: 0.5846394213763151.
[I 2025-05-10 11:09:22,346] Trial 2 finished with value: 0.6931081511757591 and parameters: {'lr': 2.0636972164932763e-06, 'weight_decay': 8.801789654376316e-06, 'optimizer': 'SGD', 'dropout_rate': 0.41722934424202585}. Best is trial 0 with value: 0.5846394213763151.
[I 2025-05-10 11:57:08,935] Trial 3 finished with value: 0.6930611046877775 and parameters: {'lr': 9.761240559110547e-05, 'weight_decay': 7.223762760825384e-06, 'optimizer': 'SGD', 'dropout_rate': 0.10400448241498705}. Best is trial 0 with value: 0.5846394213763151.
[I 2025-05-10 12:03:50,591] Trial 4 finished with value: 0.5757033369757912 and parameters: {'lr': 1.8820177671321502e-05, 'weight_decay': 0.0014941492231979128, 'optimizer': 'RMSprop', 'dropout_rate': 0.4361236923397408}. Best is trial 4 with value: 0.5757033369757912.
[I 2025-05-10 12:19:57,091] Trial 5 finished with value: 0.5948468847708268 and parameters: {'lr': 2.12201220576757e-06, 'weight_decay': 5.334220300948259e-05, 'optimizer': 'AdamW', 'dropout_rate': 0.20128794913604275}. Best is trial 4 with value: 0.5757033369757912.
[I 2025-05-10 12:32:44,415] Trial 6 finished with value: 0.5827055866068059 and parameters: {'lr': 1.5225629518892758e-06, 'weight_decay': 1.20801512220509e-05, 'optimizer': 'Adam', 'dropout_rate': 0.30106350281920896}. Best is trial 4 with value: 0.5757033369757912.
[I 2025-05-10 13:20:29,964] Trial 7 finished with value: 0.6931819579818032 and parameters: {'lr': 6.255036243738012e-05, 'weight_decay': 0.0033961919846420686, 'optimizer': 'SGD', 'dropout_rate': 0.2692933473468475}. Best is trial 4 with value: 0.5757033369757912.
[I 2025-05-10 14:08:19,457] Trial 8 finished with value: 0.6929655920375477 and parameters: {'lr': 0.00019430453737264837, 'weight_decay': 0.00608641385244292, 'optimizer': 'SGD', 'dropout_rate': 0.4983294360959966}. Best is trial 4 with value: 0.5757033369757912.
[I 2025-05-10 14:56:01,024] Trial 9 finished with value: 0.692580660906705 and parameters: {'lr': 0.00032749344737364165, 'weight_decay': 0.00014926587570789234, 'optimizer': 'SGD', 'dropout_rate': 0.1265546130631015}. Best is trial 4 with value: 0.5757033369757912.
[I 2025-05-10 15:04:58,146] Trial 10 finished with value: 0.5841245131059126 and parameters: {'lr': 1.3351009892620317e-05, 'weight_decay': 0.0005427412783217918, 'optimizer': 'RMSprop', 'dropout_rate': 0.40609746363331556}. Best is trial 4 with value: 0.5757033369757912.
[I 2025-05-10 15:27:51,923] Trial 11 finished with value: 0.5831480719826438 and parameters: {'lr': 1.1895893536082078e-06, 'weight_decay': 1.4042396179344407e-06, 'optimizer': 'Adam', 'dropout_rate': 0.35872526154629775}. Best is trial 4 with value: 0.5757033369757912.
[I 2025-05-10 15:36:04,605] Trial 12 finished with value: 0.5843340288509022 and parameters: {'lr': 5.253157890449484e-06, 'weight_decay': 0.0009074435504917018, 'optimizer': 'RMSprop', 'dropout_rate': 0.0017442779074461345}. Best is trial 4 with value: 0.5757033369757912.
[I 2025-05-10 15:41:50,758] Trial 13 finished with value: 0.5784040082584728 and parameters: {'lr': 3.2800350381155924e-05, 'weight_decay': 0.0006709593972496353, 'optimizer': 'Adam', 'dropout_rate': 0.49342766379595826}. Best is trial 4 with value: 0.5757033369757912.
[I 2025-05-10 15:46:47,538] Trial 14 finished with value: 0.5830526807091453 and parameters: {'lr': 4.361696533432819e-05, 'weight_decay': 0.000819851362909126, 'optimizer': 'AdamW', 'dropout_rate': 0.45919868574631145}. Best is trial 4 with value: 0.5757033369757912.
[I 2025-05-10 15:53:52,939] Trial 15 finished with value: 0.6892371719533746 and parameters: {'lr': 0.0005759129442569206, 'weight_decay': 0.00020868319364532802, 'optimizer': 'RMSprop', 'dropout_rate': 0.4956158957384125}. Best is trial 4 with value: 0.5757033369757912.
[I 2025-05-10 16:01:27,053] Trial 16 finished with value: 0.5663253502412275 and parameters: {'lr': 2.1486616501253433e-05, 'weight_decay': 0.0026245740986398872, 'optimizer': 'Adam', 'dropout_rate': 0.42098627558571844}. Best is trial 16 with value: 0.5663253502412275.
[I 2025-05-10 16:13:23,414] Trial 17 finished with value: 0.5837433273142034 and parameters: {'lr': 5.25345404035437e-06, 'weight_decay': 0.0018950420634623478, 'optimizer': 'Adam', 'dropout_rate': 0.3801171982318937}. Best is trial 16 with value: 0.5663253502412275.
