[I 2025-05-11 03:02:45,510] Trial 77 finished with value: 0.5875932910225609 and parameters: {'lr': 0.0005742253028091053, 'weight_decay': 0.0076905095681336025, 'optimizer': 'Adam', 'dropout_rate': 0.15562908254922975}. Best is trial 26 with value: 0.5343664689497514.
[I 2025-05-11 03:07:48,514] Trial 78 finished with value: 0.5888099431991577 and parameters: {'lr': 0.0001586048663959306, 'weight_decay': 0.000382737442302315, 'optimizer': 'Adam', 'dropout_rate': 0.33230879171083355}. Best is trial 26 with value: 0.5343664689497514.
[I 2025-05-11 03:15:12,012] Trial 79 finished with value: 0.5425057411193848 and parameters: {'lr': 3.555941638736454e-05, 'weight_decay': 0.0051421644027980365, 'optimizer': 'Adam', 'dropout_rate': 0.44397347977819707}. Best is trial 26 with value: 0.5343664689497514.
[I 2025-05-11 03:22:51,513] Trial 80 finished with value: 0.5559727831320329 and parameters: {'lr': 2.7772768116801122e-05, 'weight_decay': 0.0014227064375127356, 'optimizer': 'Adam', 'dropout_rate': 0.44687712720640194}. Best is trial 26 with value: 0.5343664689497514.
[I 2025-05-11 03:28:38,921] Trial 81 finished with value: 0.5384773709557273 and parameters: {'lr': 3.4040836429936956e-05, 'weight_decay': 0.001520672653777625, 'optimizer': 'Adam', 'dropout_rate': 0.44762592004793156}. Best is trial 26 with value: 0.5343664689497514.
[I 2025-05-11 03:35:58,314] Trial 82 finished with value: 0.5747945471243425 and parameters: {'lr': 1.79286620206359e-05, 'weight_decay': 0.002813735494091476, 'optimizer': 'Adam', 'dropout_rate': 0.42591058941895704}. Best is trial 26 with value: 0.5343664689497514.
[I 2025-05-11 03:42:19,794] Trial 83 finished with value: 0.5721403176134283 and parameters: {'lr': 3.752187013623519e-05, 'weight_decay': 0.0017754619664198735, 'optimizer': 'Adam', 'dropout_rate': 0.4908603146023093}. Best is trial 26 with value: 0.5343664689497514.
[I 2025-05-11 03:47:54,434] Trial 84 finished with value: 0.5843354420228438 and parameters: {'lr': 2.1616695851898344e-05, 'weight_decay': 0.0007318854204679384, 'optimizer': 'Adam', 'dropout_rate': 0.4686993229428059}. Best is trial 26 with value: 0.5343664689497514.
[I 2025-05-11 03:56:13,504] Trial 85 finished with value: 0.5784572124481201 and parameters: {'lr': 0.00021943803010627852, 'weight_decay': 0.005152950871502828, 'optimizer': 'Adam', 'dropout_rate': 0.3735157205403489}. Best is trial 26 with value: 0.5343664689497514.
[I 2025-05-11 04:02:17,743] Trial 86 finished with value: 0.6060072530399669 and parameters: {'lr': 1.2708359668608784e-05, 'weight_decay': 7.560577125346899e-06, 'optimizer': 'Adam', 'dropout_rate': 0.4067443296646257}. Best is trial 26 with value: 0.5343664689497514.
[I 2025-05-11 04:48:19,483] Trial 87 finished with value: 0.6930666240778837 and parameters: {'lr': 3.337888406210266e-05, 'weight_decay': 0.004390667130174074, 'optimizer': 'SGD', 'dropout_rate': 0.4394613649957758}. Best is trial 26 with value: 0.5343664689497514.
[I 2025-05-11 04:54:30,120] Trial 88 finished with value: 0.6929141001267867 and parameters: {'lr': 0.00030786546711461505, 'weight_decay': 0.0009531041734255438, 'optimizer': 'RMSprop', 'dropout_rate': 0.3915590021824375}. Best is trial 26 with value: 0.5343664689497514.
[I 2025-05-11 04:58:49,807] Trial 89 finished with value: 0.5846328822049227 and parameters: {'lr': 2.8336034596714756e-05, 'weight_decay': 1.1169420057328333e-06, 'optimizer': 'Adam', 'dropout_rate': 0.0405231741286384}. Best is trial 26 with value: 0.5343664689497514.
[I 2025-05-11 05:01:36,240] Trial 90 finished with value: 0.6846482515335083 and parameters: {'lr': 0.0005167688981329418, 'weight_decay': 0.0021819482765516283, 'optimizer': 'AdamW', 'dropout_rate': 0.4608122458912356}. Best is trial 26 with value: 0.5343664689497514.
[I 2025-05-11 05:09:56,746] Trial 91 finished with value: 0.5752308238636363 and parameters: {'lr': 2.5148192287892867e-05, 'weight_decay': 0.0013952410372023137, 'optimizer': 'Adam', 'dropout_rate': 0.44893515254704247}. Best is trial 26 with value: 0.5343664689497514.
[I 2025-05-11 05:16:24,375] Trial 92 finished with value: 0.5619701938195663 and parameters: {'lr': 3.292856530396206e-05, 'weight_decay': 0.0033291125840211344, 'optimizer': 'Adam', 'dropout_rate': 0.41862701103438105}. Best is trial 26 with value: 0.5343664689497514.
[I 2025-05-11 05:21:17,231] Trial 93 finished with value: 0.5673462163318287 and parameters: {'lr': 4.2169827031666006e-05, 'weight_decay': 0.00023242289265659781, 'optimizer': 'Adam', 'dropout_rate': 0.4436469233949841}. Best is trial 26 with value: 0.5343664689497514.
[I 2025-05-11 05:31:25,968] Trial 94 finished with value: 0.5682437918402932 and parameters: {'lr': 2.0182332940952735e-05, 'weight_decay': 0.005697368530043396, 'optimizer': 'Adam', 'dropout_rate': 0.4986183631499843}. Best is trial 26 with value: 0.5343664689497514.
[I 2025-05-11 05:39:16,531] Trial 95 finished with value: 0.5731339476325296 and parameters: {'lr': 1.5399917801682178e-05, 'weight_decay': 0.003874621903180992, 'optimizer': 'Adam', 'dropout_rate': 0.427220436252583}. Best is trial 26 with value: 0.5343664689497514.
[I 2025-05-11 05:46:10,632] Trial 96 finished with value: 0.5737664070996371 and parameters: {'lr': 2.4302395197892263e-05, 'weight_decay': 0.0014046756789504388, 'optimizer': 'Adam', 'dropout_rate': 0.4621946818477393}. Best is trial 26 with value: 0.5343664689497514.
[I 2025-05-11 05:53:30,277] Trial 97 finished with value: 0.538753173568032 and parameters: {'lr': 5.588634829005209e-05, 'weight_decay': 0.00250074423156059, 'optimizer': 'Adam', 'dropout_rate': 0.4775376349189713}. Best is trial 26 with value: 0.5343664689497514.
[I 2025-05-11 06:01:50,557] Trial 98 finished with value: 0.5539318756623701 and parameters: {'lr': 5.284746591747876e-05, 'weight_decay': 0.007863217528387267, 'optimizer': 'Adam', 'dropout_rate': 0.4834534273678245}. Best is trial 26 with value: 0.5343664689497514.
